title,company,location,date,link,description
Data Scientist,Pearson,Australia,2024-08-30,https://au.linkedin.com/jobs/view/data-scientist-at-pearson-4009369369?position=6&pageNum=2&refId=Nl4aC0aZUl4e7GqwB9LFxQ%3D%3D&trackingId=FbdQrJPo7Gy7PO%2F7qRW%2FvQ%3D%3D&trk=public_jobs_jserp-result_search-card,"About the role: Reporting to the Lead Data Scientist, you will support the development and delivery of data science models. You will play a key role in maintaining high standards of data quality and model validation. Additionally, you will contribute to extending and refining existing data pipelines by integrating additional analytics and models

Our Team: Workforce Skills – We provide upskilling and reskilling that ensures people can thrive in a digital, automated future. Faethm is a SaaS platform that uses artificial intelligence to help prepare people for the future of work and was acquired by Pearson in 2021. Workforce Skills is the newest division at Pearson with ambitious and exciting plans for growth.

As a Data Scientist You Will Be Responsible For


Advanced Analytical Implementation: Implement analytical techniques and methods to discover data patterns, develop classification, prediction, and optimization models, and drive business outcomes.
Model Development Support: Engage in the model development lifecycle from conception to deployment, focusing on creating scalable and efficient models.
Data Pipeline Maintenance: Collaborate on updating and maintaining data pipelines using AWS, integrating new models, and ensuring seamless data flows.
Generative AI Application: Apply knowledge of Language Model Models (LLMs) and generative AI to enhance data quality and creativity.
Qualitative Research and Analysis : Perform research, data analysis, and visualisation in the areas of future of work, workforce analytics, skills, and education, contributing to targeted outcomes.
Collaboration with Product and Customer Teams : Engage with product and customer teams to understand client issues and ensure solutions deliver substantial value.


To be successful in this role, you will ideally have:


1+ years in data science with a strong background in data science or machine learning, and a formal qualification in a related field.
Proficiency in Python, with hands-on experience in developing data processing workflows, performing analyses, and deploying machine learning models.
Competence in SQL for data extraction, manipulation and analysis, with familiarity with database systems like Athena
Experience with AWS for building and optimizing data pipelines, deploying data models and managing large-scale datasets in a cloud environment.
Foundational understanding of generative AI concepts, with the ability to apply these technologies to improve data quality and model development.


Benefits


Bonus leave day, to invest in your learning as well as volunteer day to give back to the community
Flexible hybrid working


Flexible working: We are committed to hybrid working practices and has adopted flexible remote and virtual working. Where possible our employees can choose to manage their attendance to the office more flexibly.

If you are as passionate as we are about changing lives through learning, then help us to learn more about you and why you want to work with Pearson. Click ‘Apply Now’ to create your application online.

What To Expect From Pearson

Did you know Pearson is one of the 10 most innovative education companies of 2022?

At Pearson, we add life to a lifetime of learning so everyone can realize the life they imagine. We do this by creating vibrant and enriching learning experiences designed for real-life impact. We are on a journey to be 100 percent digital to meet the changing needs of the global population by developing a new strategy with ambitious targets. To deliver on our strategic vision, we have five business divisions that are the foundation for the long-term growth of the company: Assessment & Qualifications, Virtual Learning, English Language Learning, Workforce Skills and Higher Education. Alongside these, we have our corporate divisions: Digital & Technology, Finance, Global Corporate Marketing & Communications, Human Resources, Legal, Strategy and Direct to Consumer. Learn more at We are Pearson.

We value the power of an inclusive culture and also a strong sense of belonging. We promote a culture where differences are embraced, opportunities are accessible, consideration and respect are the norm and all individuals are supported in reaching their full potential. Through our talent, we believe that diversity, equity and inclusion make us a more innovative and vibrant place to work. People are at the center, and we are committed to building a workplace where talent can learn, grow and thrive.

Pearson is an Affirmative Action and Equal Opportunity Employer and a member of E-Verify. We want a team that represents a variety of backgrounds, perspectives and skills. The more inclusive we are, the better our work will be. All employment decisions are based on qualifications, merit and business need. All qualified applicants will receive consideration for employment without regard to race, ethnicity, color, religion, sex, sexual orientation, gender identity, gender expression, age, national origin, protected veteran status, disability status or any other group protected by law. We strive for a workforce that reflects the diversity of our communities.

To learn more about Pearson’s commitment to a diverse and inclusive workforce, navigate to: Diversity, Equity & Inclusion at Pearson.

If you are an individual with a disability and are unable or limited in your ability to use or access our career site as a result of your disability, you may request reasonable accommodations by emailing TalentExperienceGlobalTeam@grp.pearson.com.

Note that the information you provide will stay confidential and will be stored securely. It will not be seen by those involved in making decisions as part of the recruitment process.

Job: RESEARCH AND DEVELOPMENT

Organization: Workforce Skills

Schedule: FULL\_TIME

Workplace Type

Req ID: 16690
Show more "
Computer Vision Engineer,Brixio,Australia,2024-08-28,https://au.linkedin.com/jobs/view/computer-vision-engineer-at-brixio-4009305696?position=7&pageNum=2&refId=Nl4aC0aZUl4e7GqwB9LFxQ%3D%3D&trackingId=rOEfZCJYXKrHD9FaONFtzg%3D%3D&trk=public_jobs_jserp-result_search-card,"Job Locations:

Brisbane or Sydney, Australia

Singapore

Bangkok

Work Setup: Hybrid

Start Date: ASAP

Experience: 5 to 7 years

Job Overview:

We are seeking an experienced and innovative Computer Vision Engineer to join our R&D team. This role is ideal for a hands-on professional with a startup mindset who thrives on building solutions from the ground up. As part of our team, you will play a crucial role in shaping our data science strategy, developing advanced computer vision models, and collaborating with partners to implement cutting-edge solutions.

Key Responsibilities:


Business Requirements: Understand and analyze business needs to design and develop effective computer vision solutions that align with our strategic goals
Innovation Strategy: Contribute to the continuous innovation and improvement of our product by integrating state-of-the-art computer vision techniques
Data Science Strategy: Design and implement a comprehensive data science strategy to enhance our product offerings
Model Development: Develop, test, and refine advanced computer vision models to solve complex problems and drive product innovation
Collaboration: Work closely with cross-functional teams and external partners to ensure the successful application of computer vision solutions



Requirements


Experience: 5 to 7 years in IT, digital companies, or software development, with a focus on computer vision projects
Technical Expertise: Strong experience in computer vision development and a deep understanding of the entire camera/video pipeline (lens distortion, sensor calibration, focus, etc.)
Cloud Knowledge: Familiarity with Microsoft Azure and cloud-based solutions
Data Project Management: Experience or interest in managing data projects, with a focus on practical application and customer impact
Software Skills: Proficiency in at least one coding language and experience with software release management, including tools like Git
MLOps/DevOps: Hands-on experience with MLOps and DevOps practices, including tools like Docker and Ansible
Agile Practices: Knowledgeable in agile methodologies and experienced in working within a fast-paced, collaborative team environment
Communication: Excellent communication and presentation skills, with a customer-centric approach to problem-solving
Show more "
Data & Reporting Analyst,AGPAL & QIP,Australia,2024-08-30,https://au.linkedin.com/jobs/view/data-reporting-analyst-at-agpal-qip-4011298413?position=8&pageNum=2&refId=Nl4aC0aZUl4e7GqwB9LFxQ%3D%3D&trackingId=5i3i5lmkr0eZ62aR7JY%2B%2Fw%3D%3D&trk=public_jobs_jserp-result_search-card,"National Health Accreditation Group
Brisbane City Fringe Location
NFP Salary Packaging




AGPAL Group has an exciting opportunity for a Data & Reporting Analyst. AGPAL and QIP are leading not-for-profit accreditation providers, specialising in the delivery of services to a diverse range of health, community and human service organisations across Australia. We are dedicated to supporting these organisations to achieve accreditation and are passionate about improving the quality and safety of the services they offer, to ensure Australia's health system remains one of the best in the world.




The primary responsibility of this role is to support Operations through development and delivery of compliance reporting for the Australian Commission on Safety and Quality in Health Care. Additional responsibilities will be to support the Digital Transformation initiative through data analysis and the development of reports.




Key deliverables of the role:

Develop, prepare and submit reports to meet the compliance and business needs of the organisation.
Support modelling and data analysis.
Communicate data-driven conclusions and strategic recommendations to senior leadership to optimize business processes and enhance commercial performance.
Support digital transformation by identifying business needs and developing reports and dashboards that meet those needs.
Collaborate with stakeholders across the organisation and provide solutions to their reporting and data needs.




Knowledge and skills required:

A relevant tertiary degree qualification with at least two years relevant work experience (highly desirable);
Relevant Information Systems Qualifications highly desirable;
A good understanding of databases and an analytical approach to database reporting;
High level numeracy skills with demonstrated attention to detail and accuracy with data;
Proficiency in Power BI, Power Query, MS excel and MS WIISE (highly desirable);
Demonstrated high level of competency, knowledge and skills in the use of Microsoft Office products;
Excellent organization and time management skills;
High attention to detail with the ability to multi-task, adheres to deadlines and timeframes, follow through and accept responsibility.




What we offer:

Salary Packaging
Bonus Leave (3 days), Birthday Leave and Study Leave
Supportive work environment
Competitive salary




If this sounds like you then please apply by clicking the 'apply' button by 6 September 2024.




For enquiries, please send an email to hrmailbag@agpal.com.au




Note: Successful candidates may be required to obtain police check and working with children check.




AGPAL Group embraces a diverse workforce and welcomes applications from Aboriginal and Torres Strait Islander people.

Show more "
Computer Vision Engineer,Brixio,Australia,2024-08-28,https://au.linkedin.com/jobs/view/computer-vision-engineer-at-brixio-4009303877?position=9&pageNum=2&refId=Nl4aC0aZUl4e7GqwB9LFxQ%3D%3D&trackingId=fF1qLmjZ9B1GeZ0mS%2FhJHA%3D%3D&trk=public_jobs_jserp-result_search-card,"Job Locations:

Brisbane or Sydney, Australia

Singapore

Bangkok

Work Setup: Hybrid

Start Date: ASAP

Experience: 5 to 7 years

Job Overview:

We are seeking an experienced and innovative Computer Vision Engineer to join our R&D team. This role is ideal for a hands-on professional with a startup mindset who thrives on building solutions from the ground up. As part of our team, you will play a crucial role in shaping our data science strategy, developing advanced computer vision models, and collaborating with partners to implement cutting-edge solutions.

Key Responsibilities:


Business Requirements: Understand and analyze business needs to design and develop effective computer vision solutions that align with our strategic goals
Innovation Strategy: Contribute to the continuous innovation and improvement of our product by integrating state-of-the-art computer vision techniques
Data Science Strategy: Design and implement a comprehensive data science strategy to enhance our product offerings
Model Development: Develop, test, and refine advanced computer vision models to solve complex problems and drive product innovation
Collaboration: Work closely with cross-functional teams and external partners to ensure the successful application of computer vision solutions



Requirements


Experience: 5 to 7 years in IT, digital companies, or software development, with a focus on computer vision projects
Technical Expertise: Strong experience in computer vision development and a deep understanding of the entire camera/video pipeline (lens distortion, sensor calibration, focus, etc.)
Cloud Knowledge: Familiarity with Microsoft Azure and cloud-based solutions
Data Project Management: Experience or interest in managing data projects, with a focus on practical application and customer impact
Software Skills: Proficiency in at least one coding language and experience with software release management, including tools like Git
MLOps/DevOps: Hands-on experience with MLOps and DevOps practices, including tools like Docker and Ansible
Agile Practices: Knowledgeable in agile methodologies and experienced in working within a fast-paced, collaborative team environment
Communication: Excellent communication and presentation skills, with a customer-centric approach to problem-solving
Show more "
Data Scientist-Marketing Analytics,Loyalytics AI,Australia,2024-08-02,https://au.linkedin.com/jobs/view/data-scientist-marketing-analytics-at-loyalytics-ai-3990653027?position=10&pageNum=2&refId=Nl4aC0aZUl4e7GqwB9LFxQ%3D%3D&trackingId=6Db3AcdCGnHrvNiyun2QZw%3D%3D&trk=public_jobs_jserp-result_search-card,"About Loyalytics

Loyalytics is a fast-growing Analytics consulting and product organization based out of Bangalore. We work with large retail clients across the globe helping them monetize their data assets through our consulting assignments and product accelerators. We are a young dynamic team of 100+ analytics practitioners working on some of the most cutting-edge tools and technologies.

Who We Are


Technical team: A team full of data scientists, data engineers and business analysts who work with 1M+ data points every day.
Market Size: Massive multi-billion $ global market opportunity.
Leadership: Combined experience of 40+ years of experience in the industry.
Customers: Word-of-mouth and referral driven marketing to acquire customers like big retail brands in GCC regions like Lulu, GMG, among others (Strong product-market fit).
What makes us stand apart: 8 years old bootstrapped and 100+ people company that is still hiring.


About The Job

We are looking for an experienced Data Scientist who is well-versed in machine learning and statistical modelling. You will be working with data platforms and databases, get deeply involve in data cleaning and ETL building, use whatever modeling skills you have, be it time-series forecasting or classification algorithms, to help solve marketing problems and finally bring your insight or solution to

the senior management. We are looking for a self-starter who is passionate about coding, data wrangling and sharing insight with others.

Responsibilities


Understand marketing initiatives, challenges, questions and concerns and transforming them into data science solutions and metrics.
Develop models and analytical frameworks to quantitatively measure the impact, efficiency and effectiveness of marketing activities.
Develop and implement innovative machine learning techniques to answer key business questions from marketing team or senior management while identifying new areas to explore.
Present your recommendation to marketing colleagues and senior management.
Collaborate with internal or external members to bring in data source/platform/technique into the team.


Requirements


2+ years of experience in data analytics
Experience with data cleaning and exploratory data analysis; High proficiency in SQL
Expertise in at least one scripting language (Python or R) as well as scientific libraries like-Numpy or Pandas.
Knowledge in statistical modeling: Regression/Classification/Clustering/Time Series/Forecasting/Causal Inference and other techniques
Experience working with popular machine learning frameworks like Scikit-learn, XGboost.
Experience developing sophisticated models and solving sophisticated quantitative problems that could be understood by non-technical colleagues
Basic understanding and knowledge of digital marketing practices and KPIs on ecommerce ad platforms
Desire to partner up with other data scientists, data analysts and key business partners
Show more "
Analytics Lead,Talent,Australia,2024-08-26,https://au.linkedin.com/jobs/view/analytics-lead-at-talent-4007739819?position=1&pageNum=5&refId=hUSidHjNVQUdaWYQZt40zg%3D%3D&trackingId=jHGvoAhX5mQQvLv9Qf7FOQ%3D%3D&trk=public_jobs_jserp-result_search-card,"Our client, a top-tier aviation company, is looking for an experienced Analytics Lead for a 12-month fixed-term contract. In this role, you will lead a team of analytics specialists, providing strategic support and delivering insights and analysis to the aligned squad.

This is a business-focused position that requires a strong expertise in SQL and data visualisation tools.

In this role you will:

Lead a team of Analytics Specialists and Associates to support squad deliverables
Mentor and grow direct reports across tasks and career aspirations
Support analysts through squad processes and rituals (through guidance and advice) to empower analysts when working independently
Maintain documentation for program, repeat processes and general information to support wider team members.

To be successfull in this role, you must have experience with/in:

SQL
Financial Services experience
Experience leading Analytics team
Experiecne using digital analytics
Exceptional stakeholder communication and management
Visualisation tools such as, Power BI, Tableau or similar

Show more "
Data Analyst (251),LeavePlus,Australia,2024-08-05,https://au.linkedin.com/jobs/view/data-analyst-251-at-leaveplus-3994007766?position=2&pageNum=5&refId=hUSidHjNVQUdaWYQZt40zg%3D%3D&trackingId=qCHlfrVHcVxG8igsr1aQrg%3D%3D&trk=public_jobs_jserp-result_search-card,"Introduction:

Now is the time to join LeavePlus, as we embark on the transformational process to become the leading digital regulator and administrator of an employee entitlement scheme.

Utilizing cutting-edge data and digital solutions, we're streamlining, automating, and elevating our processes. By harnessing technological advancements and refining our systems, we're committed to delivering a unique user experience for both our members and our team.

We’re dedicated to empowering our workforce through continuous learning and professional development, recognizing that they are the driving force behind our transformative initiatives. Play a pivotal role in shaping our future as critical thinkers, innovators, and modern regulators.

Description:

Reporting to the Data and Analytics Manager you will extract information from multiple sources to analyse patterns and trends. These valuable insights will be used to formulate business strategies.

Skills and Experiences:

Key Responsibilities:


Deliver data-driven insights to support strategic decision making
Interpret complex data sets using analytical tools to decipher trends, patterns and insights to inform strategic decision-making
Maintain data models, databases and systems to support data analysis and reporting
Work cross-functionally across the business to gather data to meet their data needs to drive data informed solutions
Build BI reporting and visualisations to communicate with impact across stakeholders in LeavePlus
Develop best practice communication to drive the presentation of insights across the business
Conduct regular quality assurance checks on dataset to ensure accuracy and consistency.



Skills Required:


Proficient in SQL and data querying languages
Demonstrated experience working with Azure services (eg. Synapse, Cosmos) Fabric, Python and R
Successful examples of results driven by Power BI, Tableau or other data visualisation tools
Familiar with working with large datasets and database management systems
Knowledge of statistical methods preferred
Examples of effective communication and presentation skills



Qualifications:


Prior experience in a data analysis or business intelligence role
Degree in Data Science, Computer Science, Engineering or related field
Demonstrated experience in using analytics tools for interpreting data trends and patterns
Familiarity with HR information systems (HRIS) and leave management processes is an advantage



Join Our Team: If you are energised by interpreting challenging complex datasets and feel rewarded when you can translate these into meaningful results driving powerful transforming solutions.

Application Process: To apply, please submit your resume and a cover letter outlining your relevant experience and why you are the ideal candidate for this role. We look forward to reviewing your application and potentially welcoming you to our team at LeavePlus.

Please note that employment at LeavePlus is conditional upon the satisfactory completion of a National Police Check. Applications are open to those with full working rights in Australia. LeavePlus is proud to be an Equal Employment Opportunity Employer.
Show more "
Data Analyst / Economist,Hays,Australia,2024-08-21,https://au.linkedin.com/jobs/view/data-analyst-economist-at-hays-4003673408?position=3&pageNum=5&refId=hUSidHjNVQUdaWYQZt40zg%3D%3D&trackingId=IiI9KFz2ysEpXc4CBLinTQ%3D%3D&trk=public_jobs_jserp-result_search-card,"One Data Analyst/Economist position in Canberra
Contract to 30 June 2025 with possible extension options
Competitive hourly rate

One Data Analyst/Economist opportunity within a Government Department for an initial contract to 30 June 2025

Your new company


You will be working with a Government Department as a Data Analyst/Economist in the Workforce Data Intelligence Unit. This is a dynamic team responsible for creating data-driven intelligence to support evidence-based reforms.



Your new role


The Data Analyst/Economist will be responsible for working with a cross functional team of analysts, economists and software developers to develop a workforce supply and demand modelling tool. Apply in depth knowledge in forecasting, statistics, linear programming and other optimisation algorithms and quantitative techniques. Work collaboratively in a team environment, consult and share information with others to achieve work area and business outcomes. Present data and complex numerical information in a clear and concise manner and clearly communicate statistical concepts to senior and non-technical audiences Provision of Data Analyst.



What you'll need to succeed


To be considered, you will need:


Proven working experience as a data analyst
Ability to interrogate large data sets using a range of analytical software.
SQL and SAS programming skills
Excellent communication skills, including report writing skills
Experience presenting analysis to higher level public servants, such as data analysis or costing models
Working knowledge of data models, database design/structures and basic statistics
Demonstrated ability to manage time and work in fast-paced environments.
Computer science degree or degree in a highly quantitative field beneficial but not essential for those with experience
Experience with one of more programming languages such as R, Python - desirable
You must be an Australian citizen and will possess or be willing to go through the process to obtain and maintain a (Baseline) personnel security clearance.



What you'll get in return


In return you will secure a competitive hourly rate with an initial contract to 30 June 2025 with possible extension options.



What you need to do now


If you are interested in this role, please contact Antonio Musolino on (02) 6112 7621 or email Antonio.Musolino@hays.com.au.

If this job isn't quite right for you, but you're looking for more opportunities in the IT industry, please contact me for a confidential discussion on your career.

Desired Skills and Experience

* Proven working experience as a data analyst
* Ability to interrogate large data sets using a range of analytical software.
* SQL and SAS programming skills
* Excellent communication skills, including report writing skills
* Experience presenting analysis to higher level public servants, such as data analysis or costing models
* Working knowledge of data models, database design/structures and basic statistics
* Demonstrated ability to manage time and work in fast-paced environments.
* Computer science degree or degree in a highly quantitative field beneficial but not essential for those with experience
* Experience with one of more programming languages such as R, Python - desirable

Show more "
