title,company,location,date,link,description
Data Scientist,Pearson,Australia,2024-08-30,https://au.linkedin.com/jobs/view/data-scientist-at-pearson-4009369369?position=10&pageNum=7&refId=cot8kIFC113kbXLAw8zyMg%3D%3D&trackingId=u16kwKGkFYlEoTr4BRk4%2Bg%3D%3D&trk=public_jobs_jserp-result_search-card,"About the role: Reporting to the Lead Data Scientist, you will support the development and delivery of data science models. You will play a key role in maintaining high standards of data quality and model validation. Additionally, you will contribute to extending and refining existing data pipelines by integrating additional analytics and models

Our Team: Workforce Skills – We provide upskilling and reskilling that ensures people can thrive in a digital, automated future. Faethm is a SaaS platform that uses artificial intelligence to help prepare people for the future of work and was acquired by Pearson in 2021. Workforce Skills is the newest division at Pearson with ambitious and exciting plans for growth.

As a Data Scientist You Will Be Responsible For


Advanced Analytical Implementation: Implement analytical techniques and methods to discover data patterns, develop classification, prediction, and optimization models, and drive business outcomes.
Model Development Support: Engage in the model development lifecycle from conception to deployment, focusing on creating scalable and efficient models.
Data Pipeline Maintenance: Collaborate on updating and maintaining data pipelines using AWS, integrating new models, and ensuring seamless data flows.
Generative AI Application: Apply knowledge of Language Model Models (LLMs) and generative AI to enhance data quality and creativity.
Qualitative Research and Analysis : Perform research, data analysis, and visualisation in the areas of future of work, workforce analytics, skills, and education, contributing to targeted outcomes.
Collaboration with Product and Customer Teams : Engage with product and customer teams to understand client issues and ensure solutions deliver substantial value.


To be successful in this role, you will ideally have:


1+ years in data science with a strong background in data science or machine learning, and a formal qualification in a related field.
Proficiency in Python, with hands-on experience in developing data processing workflows, performing analyses, and deploying machine learning models.
Competence in SQL for data extraction, manipulation and analysis, with familiarity with database systems like Athena
Experience with AWS for building and optimizing data pipelines, deploying data models and managing large-scale datasets in a cloud environment.
Foundational understanding of generative AI concepts, with the ability to apply these technologies to improve data quality and model development.


Benefits


Bonus leave day, to invest in your learning as well as volunteer day to give back to the community
Flexible hybrid working


Flexible working: We are committed to hybrid working practices and has adopted flexible remote and virtual working. Where possible our employees can choose to manage their attendance to the office more flexibly.

If you are as passionate as we are about changing lives through learning, then help us to learn more about you and why you want to work with Pearson. Click ‘Apply Now’ to create your application online.

What To Expect From Pearson

Did you know Pearson is one of the 10 most innovative education companies of 2022?

At Pearson, we add life to a lifetime of learning so everyone can realize the life they imagine. We do this by creating vibrant and enriching learning experiences designed for real-life impact. We are on a journey to be 100 percent digital to meet the changing needs of the global population by developing a new strategy with ambitious targets. To deliver on our strategic vision, we have five business divisions that are the foundation for the long-term growth of the company: Assessment & Qualifications, Virtual Learning, English Language Learning, Workforce Skills and Higher Education. Alongside these, we have our corporate divisions: Digital & Technology, Finance, Global Corporate Marketing & Communications, Human Resources, Legal, Strategy and Direct to Consumer. Learn more at We are Pearson.

We value the power of an inclusive culture and also a strong sense of belonging. We promote a culture where differences are embraced, opportunities are accessible, consideration and respect are the norm and all individuals are supported in reaching their full potential. Through our talent, we believe that diversity, equity and inclusion make us a more innovative and vibrant place to work. People are at the center, and we are committed to building a workplace where talent can learn, grow and thrive.

Pearson is an Affirmative Action and Equal Opportunity Employer and a member of E-Verify. We want a team that represents a variety of backgrounds, perspectives and skills. The more inclusive we are, the better our work will be. All employment decisions are based on qualifications, merit and business need. All qualified applicants will receive consideration for employment without regard to race, ethnicity, color, religion, sex, sexual orientation, gender identity, gender expression, age, national origin, protected veteran status, disability status or any other group protected by law. We strive for a workforce that reflects the diversity of our communities.

To learn more about Pearson’s commitment to a diverse and inclusive workforce, navigate to: Diversity, Equity & Inclusion at Pearson.

If you are an individual with a disability and are unable or limited in your ability to use or access our career site as a result of your disability, you may request reasonable accommodations by emailing TalentExperienceGlobalTeam@grp.pearson.com.

Note that the information you provide will stay confidential and will be stored securely. It will not be seen by those involved in making decisions as part of the recruitment process.

Job: RESEARCH AND DEVELOPMENT

Organization: Workforce Skills

Schedule: FULL\_TIME

Workplace Type

Req ID: 16690
Show more "
Analytics Engineer,Employment Hero,Australia,2024-08-23,https://au.linkedin.com/jobs/view/analytics-engineer-at-employment-hero-3989105101?position=1&pageNum=10&refId=mDVp6sRWvkAVZCgN10GcaQ%3D%3D&trackingId=sJk91Lz6FXuw67zopc2ZEQ%3D%3D&trk=public_jobs_jserp-result_search-card,"Our mission and where you fit in

At Employment Hero, we're an ambitious bunch of people on a mission to make employment easier and more valuable for everyone.

Since our inception in 2014, we've had some pretty impressive growth (100% YoY), reached unicorn status in 2022, and now serve 300,000 businesses globally, with 2 million+ users on the platform. We have no plans to slow down.

There's never been a more exciting time to join one of the fastest-growing SaaS unicorns, so let's see if we could be a match!

What Your Days Might Look Like

Reporting to the Data Manager, you will be part of a highly collaborative but remotely distributed team delivering our core reusable data assets that enable a wide variety of use cases such as report building, insights generation, ML applications and customer marketing. We are focused on delivering the most valuable impacts first, while also lifting our documentation, standards and reusability to enable even more speed as we deliver.

As an Analytics Engineer, you'll be{{:}}


Data assets development{{:}} Serve as the directly responsible individual (DRI) to translate business requirements and existing complex queries into a reusable data models / assets using dbt
Data assets cataloguing and documentation{{:}} Develop and maintain the documentation of core and business-specific data models / assets
Reverse ETL and customer engagement platform support{{:}} Develop and maintain data models specifically for our reverse ETL and customer engagement platform use cases
dbt code convention{{:}} Maintain and enforce all coding convention and standards across all dbt models, including naming
dbt code performance{{:}} Maintain and develop all dbt models in line with best practices to ensure optimum performance
Intra-team collaboration{{:}} Working with other Data Analyst(s) to translate requirements into reusable and performant data models and with Data Engineer(s) to ensure data model performance is optimised



Are you ready to make a significant impact in a rapidly expanding analytics team? Are you excited about taking ownership of our data assets? If you're looking for a dynamic role where you can unleash your skills and contribute to the growth of a company, then we have the perfect opportunity for you!

What you will bring?


4+ years in the Data space as an analytics engineer / data engineer
Demonstrated experience in ETL and data modelling projects
Demonstrated experience architecting flexible and scalable data warehouse and modelling practice
Demonstrated ability to understand and translate business requirements / metrics into technical data model development plans
Ability to connect the dots between technical implementation work and business context



Bonus Points{{:}}


dbt experience strongly preferred



Experience is important, but for us the biggest measure of success is people who can live and breathe The EH Way of working. Show us what you can bring to the table, and we'll empower you to let your talents shine.

The EH Way

The EH Way is how we describe our culture at Employment Hero and how we all operate. It is our DNA. You can read all about it on our careers page{{:}} https{{:}}//employmenthero.com/careers/

In short, you'll love working with us if{{:}}


Revolutionising employment gets your heart racing
You thrive on the flexibility (and responsibility) of a remote-first business
Our values align, and shape how you show up every day
You love the dynamic pace of a startup, are driven by innovation, and enjoy working with other smart people



Plus, you'll get to enjoy a number of great perks, including{{:}}


A generous budget for your home office
Cutting-edge tools and technology
Reward and recognition programs - because great work should be recognised and rewarded
Cashback offers and discounts on popular brands through our Swag app
Employee Share Option Program{{:}} be an owner of Employment Hero
Annual Global Gathering - so far we've been to Thailand, Vietnam and are excited to meet in Bali in September 2024



Are we a match?

Think we're the right match for you? Fantastic! Click 'Apply' and our talent team will reach out with the next steps.

At Employment Hero, we are committed to safeguarding the privacy of your application data. To understand how we do so, you can read our Applicant Privacy Policy here{{:}} https{{:}}//employmenthero.com/legals/applicant-policy/

Employment Hero celebrates diverse perspectives and experiences, we invite people of all backgrounds and identities to apply for this position.
Show more "
Artificial Intelligence Analyst,Data#3,Australia,2024-08-30,https://au.linkedin.com/jobs/view/artificial-intelligence-analyst-at-data%233-4011245090?position=2&pageNum=10&refId=mDVp6sRWvkAVZCgN10GcaQ%3D%3D&trackingId=ZyfO12jyJiLyP%2FVQOcjRCg%3D%3D&trk=public_jobs_jserp-result_search-card,"As an AI Analyst, you will play a key role in advancing AI technologies and ensuring their responsible use within the organisation. You’ll work closely with various teams to support the implementation of AI strategies, frameworks, and governance processes. Your contributions will help build a strong foundation for AI adoption while ensuring compliance with policies and safeguarding the organization and its employees.




Contract Details:

Duration: Immediate start
Contract: until 30 June 2025.
Location: Brisbane, inner city office + 2-3 days WFH







Key Responsibilities:

AI Strategy & Framework: Review and analyse AI-related content to update frameworks and governance processes. Facilitate discussions and collaborate with teams to define operating models and integrate AI guardrails.
Enablement & Execution: Support the creation and testing of training materials and user guides, and facilitate change and training workshops. Assist with the technical analysis of use cases and manage pilot activities.
Change & Communications: Maintain and update the AI Hub, monitor feedback, and handle queries. Assist with change impact assessments and stakeholder management activities.
Compliance: Ensure adherence to relevant legislation, policies, and safety requirements.




What We’re Looking For:

5-10 years of experience in a complex analyst role, preferably within technology programs.
Proven ability to develop and present project documentation, including use cases, change plans, and process artifacts.
Strong communication skills, with experience in preparing reports and presentations in dynamic environments.
Expertise in business process mapping, design/redesign, and stakeholder engagement.
Experience with AI-driven technologies, AI policy implementation, and project tools like SharePoint is a plus.




How to Apply:

Follow the Apply button and submit your CV.

Contact Abbie Clarke at Data#3 on 0413 444 157 or abbie_clarke@data3.com.au




If you do not meet the role criteria but are still interested in hearing about opportunities through Data#3, please also get in touch for more information on our other available positions!

Show more "
Machine Learning Engineer | Manager | Artificial Intelligence,PwC Australia,Australia,2024-08-30,https://au.linkedin.com/jobs/view/machine-learning-engineer-manager-artificial-intelligence-at-pwc-australia-3968867938?position=3&pageNum=10&refId=mDVp6sRWvkAVZCgN10GcaQ%3D%3D&trackingId=1OmzEHnJLoQ5dprOFasJwQ%3D%3D&trk=public_jobs_jserp-result_search-card,"The Opportunity

At PwC, we help Australian businesses, not-for-profits create value and improve the way they work. From improving healthcare, to creating smarter cities and igniting Australia’s start up industry, you’ll build trust in society and solve important problems.

The AI team is comprised of highly experienced designers, developers, data scientists and analysts who are responsible for delivering digital products and AI solutions to PwC’s business across multiple lines of service in Australia.

We partner with subject matter experts across the business to advise on, design and develop technology-enabled solutions that help to transform the way we deliver assurance, advisory, tax and legal services to our clients.

The role

Our Data Scientists are responsible for designing and developing new digital products and AI solutions for PwC’s firmwide business and our clients.

On a day-to-day basis you will be:


Collaborating with cross-functional teams to understand requirements and speccing up technical solutions.
Developing algorithms and heuristics for extracting information from unstructured and semi-structured data sources, cleansing and normalising data at a large scale.
Engaging in scaffolding new projects, testing new ideas, pairing with developers, and reviewing pull requests.
Producing clean, maintainable and efficient code to be deployed at scale in Azure cloud.
Contributing to team stand-ups and software development lifecycle activities.
Participating in firmwide data science and machine learning forums and communities to share ideas and contribute to our body of knowledge.
Coaching and mentoring to junior data scientists.



About You

Applicants must be able to demonstrate the following key capabilities and behaviours:


Strong Python development experience with modern ML/LLM frameworks.
Knowledge of ML models such as regression/boosting models,
Knowledge of deep learning, including CNN or RNN, preferably the domain of CV and NLP.
Experiences in RAG pipelines including evaluation and optimisation with industry standard packages.
Strong experience with SQL databases such as PostgreSQL (or equivalents), preferable experiences in Vector DBs.
Strong understanding of applying algorithms at scale, selecting statistical methods, and using the scientific method to derive robust conclusions.
Capability to identify emerging theory and apply it to practical situations.
Strong critical thinking skills, an analytical mindset and outstanding attention to detail.
Ability to work efficiently with remote teams using collaboration technology.
Ability to identify issues and solve complex problems as part of a team.
Good written and verbal communication skills.
A proactive approach to resolving problems.
Knowledge of proper source code management and the use of Git repositories.



Ideally, you will also have:


A research background in ML/LLM model development.
Prior experience with microservices architectures and containerisation, including good knowledge of Docker.
Strong prompt engineering skills.
Knowledge of agile software development lifecycles (SDLC) and experience working on agile projects.
Prior experience with any message-queueing solutions (e.g. RabbitMQ, Kafka).
Prior experience with data pipelines at scale and building on top of them.
Prior experience with observability standards and frameworks such as OpenTelemetry.
Prior experience with developing on cloud environments such as Azure.
Typescript development experience with ReactJS and NodeJS.



We're an inclusive bunch, and we try to make life easier - for our clients, our teams and our communities. If you need reasonable adjustments when applying, just let us know.

Emily Vegas is the Recruitment Manager for the role. As the team experiences high volumes of applications, we appreciate your patience to allow for a timely and fair process for all.

540552WD
Show more "
Senior ML Engineer,Talenza,Australia,2024-08-20,https://au.linkedin.com/jobs/view/senior-ml-engineer-at-talenza-4002630762?position=4&pageNum=10&refId=mDVp6sRWvkAVZCgN10GcaQ%3D%3D&trackingId=eBEKoou%2FwZpP2nSYSQQxGw%3D%3D&trk=public_jobs_jserp-result_search-card,"Senior Machine Learning Engineer (MLOps)

Sydney

$220,000 Inc Super + Bonus

Role Overview

Join a newly established team designing, building, and operating Machine Learning solutions, you will also utilise data science and machine learning capabilities at scale using cutting-edge cloud technology. As a Senior Machine Learning Engineer, you will lead and take end-to-end ownership of your product in a modern DevOps culture. You will be responsible for architecture, design, development, testing, and operations, delivering incrementally in iterative cycles. You will have an Agile mindset and a keen interest in software engineering across a range of technologies.

Key Requirements


7+ years of experience as a software engineer in an agile DevOps environment using an object-oriented development language (Java, Python)
Experience leading projects across the full SDLC including design, build, test, and supporting mission-critical production platforms
Expertise in implementing MLOps best practices including CI/CD pipelines
Demonstrated proficiency using cloud technologies and integrating with ML services such as GCP Vertex AI, DataRobot, or AWS SageMaker in large and complex organizations
Extensive experience with SQL and Python environments
Strong data engineering experience
Deep familiarity with cloud technologies and architectural practices to enhance tooling across the ML model development lifecycle
Excellent collaboration and communication skills, and a self-starter able to lead a team to deliver solutions


If you feel you possess the relevant skills to the above, apply now with most updated CV!
Show more "
Staff Software Engineer- Generative AI,Workforce Australia for Individuals,Australia,2024-08-22,https://au.linkedin.com/jobs/view/staff-software-engineer-generative-ai-at-workforce-australia-for-individuals-4005661221?position=5&pageNum=10&refId=mDVp6sRWvkAVZCgN10GcaQ%3D%3D&trackingId=d9DuxyKihuCA33x5e%2F1sZA%3D%3D&trk=public_jobs_jserp-result_search-card,"You are a technology leader passionate about Generative AI, agentic computing and the challenge of building safe and reliable systems on cutting edge technology.
We are leading the world in AI ambition within Australia?s largest bank and fintech!
Together, we will engineer the future of banking with innovative Gen AI solutions!


Do work that matters

As we continue our pursuit of NPS 30 we need to transform the way we engage with our customers and colleagues. The Gen AI Domain has been set up to build the tools and capabilities needed within the group tapping into the promise of Generative AI as a key technology to solve those needs.

This domain will power the creation of Generative AI solutions that will support more personalised experiences for our customers and our people. We must bring a customer first mindset into every decision; every


Click here to view more detail / apply for Staff Software Engineer- Generative AI
Show more "
