title,company,location,date,link,description
Laboratory Technician,BGI Genomics,Australia,2024-08-28,https://au.linkedin.com/jobs/view/laboratory-technician-at-bgi-genomics-4009812981?position=1&pageNum=10&refId=2NKSTxg4ikUuimT%2FKpjjjQ%3D%3D&trackingId=i6GQGRvT9RpEEX5NsPfmFQ%3D%3D&trk=public_jobs_jserp-result_search-card,"Laboratory Technician (Bilingual: English and Mandarin preferred)




Expand your horizons and bring the technology closer to people with BGI #OMICSFORALL

BGI Group was founded in 1999 in China with the vision of using genomics for the benefit of mankind and has since become the largest genomics organization in the world. Currently, BGI is operating and serving customers in more than 100 countries and regions, with more than 10,000 employees around the world.




With a focus on research and applications in the healthcare, agriculture, conservation, and environmental fields, BGI Group has a proven track record of innovative, high-profile research, which has generated 5,200+ publications, with 600+ publications in top-tier journals such as Nature series, Science series, Cell series, and New England Journal of Medicine. As a result of these accomplishments, in the field of R&D, BGI was ranked No.1 among corporations in the biological sciences sector in the Asia-Pacific region and No.8 worldwide by the Nature Index 2024.







Our mission is to transform people’s lives for the better. We don’t hesitate to take bold decisions that can help us to achieve new breakthroughs. We believe that the success of our business will mean a better world for people to live in.










Our message to the world is simple – make everyone’s life healthier and longer with the help of BGI.




Why joining us?

Here at BGI, we bring the most talented and dedicated science and business professionals to act as one to deliver outstanding technology and services to people.

Our multicultural team is engaged in challenging work that brings satisfaction and unlimited professional growth. We keep learning and upgrading ourselves, we support each other to achieve the best result.







Your duties as Laboratory Technician include but are not limited to the following:

Prepare, process, analyze and store genetic material/tissue samples according to standard operating procedures (SOPs);
Use/operate bio-safety cabinets, incubators, centrifuges, sequencers, liquid handlers, vortexers, quality control equipment and various supporting laboratory equipment;
Perform data entry and analysis and reports accurately and unambiguously;
Monitor and report scientific progress to ensure that appropriate Quality Assurance (QA) and Quality Control (QC) procedures are followed;
Configure, operate and maintain specialized equipment;
Assist with the development of SOPs for procedural and equipment aspects in the lab;
Optimisation of new protocols and facilitating with implementation in the laboratory;
Liaise with other team members in the refinement of SOPs to improve quality of the result and expand the scale of operation;
Complies with company SOPs and strictly adheres to biosecurity policies and procedures to ensure QA and QC requirements are met;
Maintain/monitor inventories, placing orders and verifying receipt;
Identify and isolate problems and assist with troubleshooting of equipment and procedures.
Manage lab warehouse operations, including coordination with overseas warehouses, training, system management, and ensuring the accuracy and timeliness of key business data.
Monitor and optimize warehouse processes, focusing on key business indicators such as inventory accuracy, logistics management, and compliance with operational procedures.










The successful candidates for this position are able to demonstrate:

A Bachelor degree in Biotechnology or an equivalent science qualification;
Relevant laboratory skills, and experience in managing and performing laboratory-based activities from multiple research projects;
Knowledge and experience in genetics and genomics with special emphasis on next generation sequencing, high-throughput genotyping;
Demonstrated problem solving and analytical skills combined with the ability to investigate and resolve general issues within the laboratory environment;
Demonstrated ability to follow and adhere to policies and practices and understand quality management system requirements;
Excellent data entry skills including high attention to detail and data accuracy;
A positive can-do attitude and commitment to producing high level performance outcomes;
Skills in liaising with different department in HQ to implement various workflow and facilitate technological transfer;
Proficient in English and Mandarin.







Here at BGI we value people and consider our employees as partners. A transparent, fair and friendly environment is what we created here. An agile approach in management is what we implement here and we give each partner enough independence as well as guidance. We take care of our partners’ physical and mental health and we are dedicated to the work-life balance corporate culture.




Not only do we bring genomics closer to people, we also participate in various charity programs, advocate nature preservation, and support equality. We condemn any discrimination and are committed to giving job opportunities to everyone regardless of sex, race, gender, religion, marital status, domestic partner status, age, national origin or ancestry, physical or mental disability, medical condition, sexual orientation, pregnancy, military or veteran status, citizenship status etc.




Let’s move to a brighter and more equal future together anddeliver #Omicsforall

Show more "
Business Analyst,Strategic Partners Australia,Australia,2024-08-27,https://au.linkedin.com/jobs/view/business-analyst-at-strategic-partners-australia-4010920638?position=2&pageNum=10&refId=2NKSTxg4ikUuimT%2FKpjjjQ%3D%3D&trackingId=p2fh%2BgK35o%2BmELY4jWZQ%2FA%3D%3D&trk=public_jobs_jserp-result_search-card,"One of our Federal government clients is seeking to engage Business Analyst.




Role: Business Analyst

Location of work: Sydney (Hybrid)

Length of contract: 06 Months

Contract extensions: 06 months Extension

Security Clearance: Australian Citizen (client intend to process Baseline security clearance after onboarding)




Overview:

As a BA, you will be required to:

• Work with the business SME’s and IT teams to analyse business requirements to discover the underlying business need to be addressed, through workshops or discussions with stakeholders.

• Specifying Requirements (business, functional and non-functional) – documenting the requirements in a format that can be shared with, and easily understood by, a variety of stakeholders (Business, Executive, Application and Solution Designer resources, Development resources and Testing resources). This could be either traditional business requirements documents or User stories for Agile projects.

• Develop user interface designs utilising User Central Design (UCD) principles and practices to design user interfaces that conform with industry and Australian Government Accessibility and Usability principles, practices, and guidelines.

• Develop process maps with as-is process analysis and to-be process designs.

• Quickly learn and understand overall business structure, strategy and how it may impact on work efforts for the team.

• Assist with testing preparation and execution.

• Assist with UAT preparation and system implementation including the development of user manuals and training.

• Displaying strong skills in managing your own performance to deliver on deparment's strategic priorities and team business plan. As a valued member of the team, you will also:

• Undertake additional responsibilities or tasks as required.

• Work professionally, positively and cooperatively as part of deparment, and model the values of Accountability, Professionalism and Teamwork.

• Undertake reasonable care for your own health and safety and that of others in the workplace that may be affected by your actions.




Qualifications and experience:

• Relevant tertiary qualifications in IT.

• Excellent knowledge of IT Systems Development Lifecycles (SDLC) and Agile delivery methodology.

• Comprehensive knowledge and skills sets associated with eliciting, documenting and managing requirements.

• Strong experience in the use of industry process modelling tools and requirements management tools.

• Strong knowledge of process modelling (including the use of BPMN) data analysis and modelling. • Excellent application of analytical and problem-solving skills in IT systems and IT delivery.

• Strong enterprise analysis skills and ability to resolve complex problems in a diverse and changing business environment.

• Good ability to use user centric design thinking and related skills.

• Good ability to manage multiple tasks or projects at once.

• Strong ability to effectively present information to different target audiences both verbally and in writing.

• Strong ability to work independently with limited supervision and be accountable for outcomes. • Strong ability to work with other business analysts and guide them to achieve common business objectives.

• A commitment to customer service excellence and professional representation combined with proven ability to communicate and accept responsibilities.

• Desirable knowledge of deparment's systems including SAS, Microsoft Dynamics, Java, Siebel/Oracle fusion, Peoplesoft and Data Warehouse.

Show more "
Data Analyst,Endeavour Group,Australia,2024-08-12,https://au.linkedin.com/jobs/view/data-analyst-at-endeavour-group-3981952048?position=3&pageNum=10&refId=2NKSTxg4ikUuimT%2FKpjjjQ%3D%3D&trackingId=MrgqeUz%2FaliNJk3EV0STRQ%3D%3D&trk=public_jobs_jserp-result_search-card,"Company Description

Let’s create a more sociable future together

At Endeavour, we’re totally into what we do. With a portfolio that includes Dan Murphy’s, BWS, ALH Hotels, Pinnacle Drinks and more, we love to bring people together. Together we share our passion for our products and industry; it’s what inspires us to dream big, and continue to create new experiences for our customers and teams across Australia. If you thrive on positive energy, we want to meet you!

Our Analytics team is at the heart of this purpose. When you join Analytics, you’re not just filling a role; you'll join a vibrant community dedicated to leveraging data to craft a more sociable future where data enhances every interaction and decision, fostering a more connected world. Our environment is agile, with a focus on fostering personal and professional growth through continuous learning and innovative challenges.

Job Description


Bring your passion and feel the energy
We offer flexibility, hybrid/remote working - we value our people
Team discounts across Endeavour Group


As a Data Analyst within our Analytics team — comprising over 200 passionate professionals—you'll harness innovative data technologies to drive strategic initiatives across our dynamic business landscape. Working in a fast-paced agile environment, you will collaborate closely within vibrant, cross-functional squads, each laser-focused on specific business missions.

This newly created role sits in the Analytics space focusing on delivering pub experiences locals love by understanding guest value propositions, strategies for price optimisation and in-depth data analytics of the current pubs landscape across the Endeavour Group. We’re seeking a proactive and versatile analyst with a keen ability to ask insightful questions, drive impactful work and create compelling data visualisations. This role is perfect for someone not only skilled in data analytics, but also willing to tackle challenges and broaden their toolkit to seek solutions.

Sound good? Read on.

Here is a taster of what you can expect in this role

This Role Involves


Analyse and interpret complex datasets to support pricing and marketing strategies
Develop and maintain dashboards and visualisations that effectively communicate insights and drive decision making
Proactively identify opportunities for process improvements and data optimisation
Owning your projects and ensuring the data architecture supports rapid growth and innovation.
Utilising extensive databases to unravel complex queries that are as challenging as they are rewarding.
Deriving insights from large amounts of data and translating this into a story that helps stakeholders and senior leaders understand, make decisions and drive action.
Spreading data literacy and fostering a culture of curiosity and informed decision-making throughout the organisation.


Qualifications

Now let’s talk about you


You are a Collaborative team player. You’ll be working in a multi-functional squad looking to deliver the most value for your product/service/project, where building connections and expanding on your knowledge and that of others will be key to solving difficult problems
Self-motivated, you thrive in dynamic environments and are comfortable navigating through ambiguity imposed by the matrix structure we work in and the shared decision making that goes with it
You’re adventurous with data, constantly seeking new methods or tools to enhance understanding and outcomes.
Your core skills are in SQL and you have hands-on experience with cloud platforms (GCP a plus).
Your analytical prowess is matched with an ability to visualise data compellingly (Tableau skills are a bonus).
Communication is your strong suit; you translate complex data into clear, actionable insights.
Experience with Agile WoW
You may have prior experience in a Retail or Hospitality role that helps you understand the landscape you are designing your data products for.


The benefits are good too!


We offer flexible working in every sense
An exclusive discount card for BWS, Dan Murphy’s, Woolworths, BIG W and other Endeavour Group brands, including our ALH pubs
Monthly meeting-free days
Your health and wellbeing is your most important asset, and as one of our valued team members, it’s our first priority. You will have a range of free services to help you live well and support your physical, mental and financial wellbeing
Endeavour Group is full of opportunities - use our dedicated learning and development options to grow an idea, yourself, and your career. This is just the start, so dream big.
At Endeavour, we value being a workplace where everyone’s welcome - if you meet a number of the requirements (and not all), we encourage you to apply.


Additional Information

We are together creators

With a portfolio that includes Dan Murphy’s, BWS, ALH Hotels, Pinnacle Drinks and more, Endeavour Group is big on sociability. Together we create the moments that bring millions of people together. And together we have more fun, create more opportunities, and score a lot more goals. We’re serious about creating a safe, inclusive and fun place to rock up to where equal opportunity is key, and flexibility is part of how we roll.

We’re all about creating a more sociable future - for our customers and each other. If this job excites you - and you’re close-enough on the requirements, reach out, we’d love to hear from you.

You can learn more about working with us on LinkedIn or at endeavourgroupcareers.com.au.

Our Talent Team and Hiring Leaders kindly request no unsolicited resumes or approaches from Recruitment Agencies. Endeavour Group is not responsible for any fees related to unsolicited resumes.

#WeAreTogetherCreators #ComeAsYouAre #DreamBig #FeelTheEnergy #LeaveYourMark #EndeavourGroup


Show more "
Data Scientist / Data Specialist,face2face Recruitment,Australia,2024-08-02,https://au.linkedin.com/jobs/view/data-scientist-data-specialist-at-face2face-recruitment-3990396505?position=5&pageNum=10&refId=2NKSTxg4ikUuimT%2FKpjjjQ%3D%3D&trackingId=Fz7rYpN9AAqCSq81GMlPeQ%3D%3D&trk=public_jobs_jserp-result_search-card,"Closing Date: 8 August 2024, 9:00 AM



face2face reference: 619159

Location: ACT, NSW, NT, QLD, SA, TAS, VIC, WA, Offsite

Hours: Full-time

Contract length: 6 Months Contract + 6 Months (Pending approval)

Entry requirements: Australian Citizen + Minimum Baseline

Pay range: $900.00 – 1000.00 p/d inc super

About the role:

The Data Scientist / Specialist will be expected to stocktake existing integrity data and metrics at the entity and whole of APS levels, identify gaps and explore improvements to existing data collection methods, automate repetitive tasks and streamline data workflows, manage data in a manner consistent with best practices and security requirements, serve as a subject matter expert offering guidance and support to colleagues on interpreting data analysis, data governance and information security.

Required Experience/skills


Experience in the drafting of data policies and/or frameworks within time-pressured, high profile environments.
A proven track record of providing strategic data policy advice to senior executives and/or ministers on complex data matters.
Proficient data analysis and management skills.
Leverage data and build customisable, engaging and informative data visualisations.
Make data discoverable using a centralised searchable registry.



Desirable Experience Skills


Ability to succinctly articulate technical concepts to non-technical audiences.
Experience working collaboratively as part of a positive, supportive and inclusive team, including in high pressure periods.
Effective, excellent communication skills and the demonstrated ability to collaborate with stakeholders.
Experience with Microsoft Office suite, Power BI, SQL, and programming languages.



If this sounds like the role for you, and you'd like to learn more, click apply now. f2f Recruitment team will be happy to assist you.

Urvish Kahar

02 6199 5750

TeamICT@f2frecruitment.com.au

Excited about this role but don’t believe your experience perfectly matches all job specifications? Why not examine your transferable skills? If they position you as a strong, quality candidate, it’s well worth applying for the position. Read more on transferable skills: www.f2frecruitment.com.au/transferable-skills-more-important-than-ever

#APS


Thank you for your interest in this position with face2face Recruitment. Our advertisements automatically stay live for 30 days, even if the position is filled beforehand. Should you find this role closed, not all is lost. If you submit your resume to us as a general expression of interest, we will consider you for other positions that suit your talent and experience. We may well have current positions to fill and will certainly consider you for future suitable roles. Submitting your resume has the added bonus of getting your name in the mix for opportunities we fill without even advertising. All you have to do is send your resume to TeamICT@f2frecruitment.com.au.
Show more "
Analyst,Henslow - Oaklins Member Firm,Australia,2024-08-27,https://au.linkedin.com/jobs/view/analyst-at-henslow-oaklins-member-firm-4008329423?position=7&pageNum=10&refId=2NKSTxg4ikUuimT%2FKpjjjQ%3D%3D&trackingId=KIgLrIATvDRdJ4aP%2Fa5V%2Bw%3D%3D&trk=public_jobs_jserp-result_search-card,"Henslow is seeking a motivated and driven analyst to join it’s equity capital markets team in Melbourne.




The role suits an individual who has is looking to work across a broad range of businesses, ranging from entrepreneurial private businesses to ASX listed corporates.




The day to day requirements on an analyst will vary depending on the transaction. You will be exposed to the entire deal process from initial discussions to strategic development through to execution and closing.




The successful candidate will hold a degree in accounting, finance or another relevant field and be looking for an opportunity to foster a career in corporate finance and investment banking.

Responsibilities

Ability to build/develop strong industry knowledge across multiple industries;
Preparing company specific and industry research;
Interpreting industry data and conduct cross company and sub sector data analysis;
Research current and potential clientele and relevant industries that they operate in;
Compile pitch documents and assist in building and updating presentations and ASX materials for existing clients;
Develop and interpret financial models and analysis;
Attend and assist with client meetings;
Work well within the team and provide support to managing directors, directors, associates and wider team as needed.




Skills & Experience

Tertiary degree in a relevant discipline with strong academic results, preferred;
Strong commercial acumen and a demonstrable interest in the industry;
You must be an Australian citizen or permanent resident to apply for this position.




Personal Attributes

Outstanding communication skills (both verbal and written);
Possess independence, critical thinking skills, and a passion for investing;
Excellent planning, organisational and time management skills;
High attention to detail and accuracy of work;
Ability to problem solve and to generate workable solutions;
Ability to work both in a team and independently;
A good sense humour and enthusiastic attitude.




Show more "
Data Scientist / Data Specialist,face2face Recruitment,Australia,2024-08-02,https://au.linkedin.com/jobs/view/data-scientist-data-specialist-at-face2face-recruitment-3990397308?position=8&pageNum=10&refId=2NKSTxg4ikUuimT%2FKpjjjQ%3D%3D&trackingId=duRHajyyQX%2FL4w0j%2BpLQrw%3D%3D&trk=public_jobs_jserp-result_search-card,"Closing Date: 8 August 2024, 9:00 AM



face2face reference: 619159

Location: ACT, NSW, NT, QLD, SA, TAS, VIC, WA, Offsite

Hours: Full-time

Contract length: 6 Months Contract + 6 Months (Pending approval)

Entry requirements: Australian Citizen + Minimum Baseline

Pay range: $900.00 – 1000.00 p/d inc super

About the role:

The Data Scientist / Specialist will be expected to stocktake existing integrity data and metrics at the entity and whole of APS levels, identify gaps and explore improvements to existing data collection methods, automate repetitive tasks and streamline data workflows, manage data in a manner consistent with best practices and security requirements, serve as a subject matter expert offering guidance and support to colleagues on interpreting data analysis, data governance and information security.

Required Experience/skills


Experience in the drafting of data policies and/or frameworks within time-pressured, high profile environments.
A proven track record of providing strategic data policy advice to senior executives and/or ministers on complex data matters.
Proficient data analysis and management skills.
Leverage data and build customisable, engaging and informative data visualisations.
Make data discoverable using a centralised searchable registry.



Desirable Experience Skills


Ability to succinctly articulate technical concepts to non-technical audiences.
Experience working collaboratively as part of a positive, supportive and inclusive team, including in high pressure periods.
Effective, excellent communication skills and the demonstrated ability to collaborate with stakeholders.
Experience with Microsoft Office suite, Power BI, SQL, and programming languages.



If this sounds like the role for you, and you'd like to learn more, click apply now. f2f Recruitment team will be happy to assist you.

Urvish Kahar

02 6199 5750

TeamICT@f2frecruitment.com.au

Excited about this role but don’t believe your experience perfectly matches all job specifications? Why not examine your transferable skills? If they position you as a strong, quality candidate, it’s well worth applying for the position. Read more on transferable skills: www.f2frecruitment.com.au/transferable-skills-more-important-than-ever

#APS


Thank you for your interest in this position with face2face Recruitment. Our advertisements automatically stay live for 30 days, even if the position is filled beforehand. Should you find this role closed, not all is lost. If you submit your resume to us as a general expression of interest, we will consider you for other positions that suit your talent and experience. We may well have current positions to fill and will certainly consider you for future suitable roles. Submitting your resume has the added bonus of getting your name in the mix for opportunities we fill without even advertising. All you have to do is send your resume to TeamICT@f2frecruitment.com.au.
Show more "
