title,company,location,date,link,description
Data Scientist-Marketing Analytics,Loyalytics AI,Australia,2024-08-02,https://au.linkedin.com/jobs/view/data-scientist-marketing-analytics-at-loyalytics-ai-3990653027?position=35&pageNum=0&refId=djANzLv%2FJMbf8OaodSCELA%3D%3D&trackingId=FqDjhKAU2QBPKlZhHD094w%3D%3D&trk=public_jobs_jserp-result_search-card,"About Loyalytics

Loyalytics is a fast-growing Analytics consulting and product organization based out of Bangalore. We work with large retail clients across the globe helping them monetize their data assets through our consulting assignments and product accelerators. We are a young dynamic team of 100+ analytics practitioners working on some of the most cutting-edge tools and technologies.

Who We Are


Technical team: A team full of data scientists, data engineers and business analysts who work with 1M+ data points every day.
Market Size: Massive multi-billion $ global market opportunity.
Leadership: Combined experience of 40+ years of experience in the industry.
Customers: Word-of-mouth and referral driven marketing to acquire customers like big retail brands in GCC regions like Lulu, GMG, among others (Strong product-market fit).
What makes us stand apart: 8 years old bootstrapped and 100+ people company that is still hiring.


About The Job

We are looking for an experienced Data Scientist who is well-versed in machine learning and statistical modelling. You will be working with data platforms and databases, get deeply involve in data cleaning and ETL building, use whatever modeling skills you have, be it time-series forecasting or classification algorithms, to help solve marketing problems and finally bring your insight or solution to

the senior management. We are looking for a self-starter who is passionate about coding, data wrangling and sharing insight with others.

Responsibilities


Understand marketing initiatives, challenges, questions and concerns and transforming them into data science solutions and metrics.
Develop models and analytical frameworks to quantitatively measure the impact, efficiency and effectiveness of marketing activities.
Develop and implement innovative machine learning techniques to answer key business questions from marketing team or senior management while identifying new areas to explore.
Present your recommendation to marketing colleagues and senior management.
Collaborate with internal or external members to bring in data source/platform/technique into the team.


Requirements


2+ years of experience in data analytics
Experience with data cleaning and exploratory data analysis; High proficiency in SQL
Expertise in at least one scripting language (Python or R) as well as scientific libraries like-Numpy or Pandas.
Knowledge in statistical modeling: Regression/Classification/Clustering/Time Series/Forecasting/Causal Inference and other techniques
Experience working with popular machine learning frameworks like Scikit-learn, XGboost.
Experience developing sophisticated models and solving sophisticated quantitative problems that could be understood by non-technical colleagues
Basic understanding and knowledge of digital marketing practices and KPIs on ecommerce ad platforms
Desire to partner up with other data scientists, data analysts and key business partners
Show more "
Research Scientist,"Department of Energy, Environment and Climate Action",Australia,2024-08-13,https://au.linkedin.com/jobs/view/research-scientist-at-department-of-energy-environment-and-climate-action-4000088509?position=36&pageNum=0&refId=djANzLv%2FJMbf8OaodSCELA%3D%3D&trackingId=v%2BTndrS8eOk4fFri3oxBoQ%3D%3D&trk=public_jobs_jserp-result_search-card,"This position supports science delivery for a $30M Strategic Partnership that is using digital and genomic innovation to transform the Australian Grains Genebank (AGG) from a traditional genebank into a bio-digital resource centre. The AGG is the national centre for grain crop genetic resources and has the mandate to acquire, conserve and distribute these resources to underpin the development of more resilient and productive grain crop varieties. The Strategic Partnership aims to unlock the genetic potential of plant genetic resources to accelerate cereal, oilseed and pulse crop improvement for the benefit of the Australian grains industry.

You will work within a multidisciplinary team of research scientists to apply genetic and genomic analysis methods to characterise the plant genetic resource collection conserved within the AGG. This will include identifying duplicate and misclassified accessions, identifying collection gaps, tracking accession genetic integrity and more effectively curating the collection using genotype data. It will also include using genomic approaches to enrich accession passport information, for example by determining the geographical origin of accessions with incomplete passport information.

Specialist/Technical Expertise/Qualifications


Demonstrated expertise in genetic and genomic data analysis methods relevant to genebank genomics, diversity analysis, and the characterisation of plant genetic resources.
Extensive bioinformatics skills including working with command line tools, scripting, and high throughput computing environments, necessary for managing and analysing large genomic datasets.
A strong peer-reviewed journal publication track record, demonstrating a significant contribution to science delivery both individually and as part of a multidisciplinary team.
Excellent verbal and written communication abilities, with strong interpersonal skills to effectively collaborate within a multidisciplinary team environment to deliver timely outcomes.
Essential: A PhD in population genetics, diversity informatics, quantitative genetics, plant molecular genetics and/or genomics, or a similar field.
Desirable: Experience in applying genetic and genomic analysis methods in cereals, oilseeds or pulses.


This is a fixed term position available for 3 years. The work location for this position is AgriBio in Bundoora with hybrid work arrangements available.

To be considered for this position, applicants are encouraged to submit a resume and cover letter (no longer than 2 pages) summarising their skills and relevant experience. Please refer to the Key Selection Criteria provided in the Position description, including the mandatory requirements.

For further information please refer to the attached position description.

Applications close at midnight on Tuesday, 3 September 2024.

Other Relevant Information

this particular vacancy, priority consideration applies to Victorian Public Service (VPS) and select employees of the Victorian Public Sector who apply through the Jobs and Skills Exchange (JSE) jobs board platform.

Preferred candidates will be required to undertake pre-employment screening, including a Declaration and Consent form and a National Police Check.

To be eligible for appointment to this role, applicants will possess corresponding work rights for the advertised employment period. Appointment to an ongoing position is only available to an Australian/New Zealand citizen or an Australian Permanent Resident.

A Diverse, Inclusive and Flexible Workplace

DEECA welcomes applicants from a diverse range of backgrounds and we focus on the essential requirements of the job and being consistent and fair in our treatment of all applicants. We also understand that a balanced life is important to our employees. Talk to us about our flexible options such as working some days from home, starting early or late, working part time, job sharing or accessing paid or unpaid leave.
Show more "
ML Engineer,Talenza,Australia,2024-08-19,https://au.linkedin.com/jobs/view/ml-engineer-at-talenza-4003509098?position=37&pageNum=0&refId=djANzLv%2FJMbf8OaodSCELA%3D%3D&trackingId=PAaheE2RA6jdahbpQeLdvw%3D%3D&trk=public_jobs_jserp-result_search-card,"Machine Learning Engineer

Sydney

$185k Inc Super + Bonus

Role Overview

Join a newly established team designing, building, and operating Machine Learning solutions & utilise data science and machine learning capabilities at scale using cutting-edge cloud technology. As a Machine Learning Engineer, you'll take end-to-end ownership of your product in a modern DevOps culture. You will be responsible for architecture, design, development, testing, and operations, delivering incrementally in iterative cycles.

Key Requirements


5+ years of experience as a software engineer in an agile DevOps environment using an object-oriented development language (Java, Python)
Experience across the full SDLC including design, build, test, and supporting mission-critical production platforms
Ability to implement MLOps best practices including CI/CD pipelines
Demonstrated proficiency using cloud technologies and integrating with ML services such as GCP Vertex AI, DataRobot, or AWS SageMaker in large and complex organizations
Experience with SQL and Python environments
Data engineering experience will be highly regarded
Familiarity with cloud technologies and architectural practices to enhance tooling across the ML model development lifecycle


If you feel you possess the relevant skills to the above, apply now with most updated CV!
Show more "
Business Intelligence Data Analyst,HealthShare Victoria,Australia,2024-08-12,https://au.linkedin.com/jobs/view/business-intelligence-data-analyst-at-healthshare-victoria-3996189851?position=38&pageNum=0&refId=djANzLv%2FJMbf8OaodSCELA%3D%3D&trackingId=iOwC8xlkLOpMTbCxb8ibRw%3D%3D&trk=public_jobs_jserp-result_search-card,"About HealthShare Victoria




HSV was established on 1 January 2021 as a commercially oriented independent provider of supply chain, procurement and corporate shared services to Victoria’s public health sector. HSV’s purpose is to partner with Victoria’s public health services and suppliers to support better value for the public health sector and better outcomes for their patients.




Our focus is on the end-to-end supply chain needs of health services, including operating the State Supply Chain, to ensure Victoria’s public health services have access to goods that may be in higher demand or difficult to access. Under the Health Services Act 1988 (Vic), we administer compliance-related functions, and work with health services to assist them in meeting compliance and probity obligations.

The Opportunity

Reporting to the Business Intelligence Data Manager, this role is responsible for cleansing, maintenance, and publication of multiple key datasets. Additional responsibilities include ensuring accuracy of HSV's Master Data, project work relating to the datasets, ad hoc reporting and liaising with external data providers.

Opportunities exist to extend into data analysis, data management and automation tasks performed within the wider team.

Key Accountabilities Include, but not limited to:

Liaise with the HSV employees responsible for data collection and ensure that data is available for further processing as needed
Monitor receipt and automated cleansing of spend data, troubleshooting any issues
Review data quality metrics of received data for early detection of data issues, and liaise with external data providers to resolve issues
Maintain master data and mappings used to align customer and supplier dimensions
Liaise with HSV employees providing product and pricing data to ensure validity and completeness
Update product and pricing workbooks in accordance with provided information, following documented processes
Run data validation logic to maintain data quality




What You Will Bring:

Relevant experience in a data administration/analyst type role including strong experience with Advance Excel and working knowledge of SQL Server and VBA
Experience with PowerBI (advantageous)
Current working knowledge in Excel macro development and use
Proven ability to track data anomalies back to root cause
Awareness of commercial procurement practices and/or tenders & contracts
Ability to interpret contracts and related legislations (advantageous)
Strong attention to detail
Ability to identify issues, develop solutions, initiate action, and provide authoritative advice




What HSV can offer you:

Salary packaging
4 weeks of annual leave plus 13 Accrued Days Off
Annual Leave loading of 17.5%
Flexible work arrangements
Easter Tuesday public holiday




We're actively reviewing applications as they come in and selecting candidates for further consideration




A full position description can be found on the HSV Careers Page. To express your interest, please submit your CV via LinkedIn. We look forward to hearing from you!




HSV is an all-inclusive employer. Applications from Aboriginal and Torres Strait Islander peoples, people with disability, LGBTI and people from culturally diverse backgrounds are encouraged.




Probity checks are also conducted in the latter stages of the recruitment process.

Show more "
Junior Tableau Developer,Ingrity,Australia,2024-08-28,https://au.linkedin.com/jobs/view/junior-tableau-developer-at-ingrity-4012125811?position=41&pageNum=0&refId=djANzLv%2FJMbf8OaodSCELA%3D%3D&trackingId=5yElk7SVjNtcd8AV%2BfJlqA%3D%3D&trk=public_jobs_jserp-result_search-card,"Unlock Your Potential: Join Our Team as a Tableau Developer (junior to mid-level) to work with one of our Banking and insurance clients and Transform Data into Actionable Insights!

At INGRITY

Imagine the Impossible: It's not just an aspiration for our clients; we expect the same from our team.

INGRITY isn't your typical workplace; we thrive on the fusion of Intelligence & Grit. Prioritising personal growth, open communication, continuous learning, career progression, and accountability, we're on the lookout for individuals like you.


Do you seek roles fostering personal growth, allowing you to excel?
Do you flourish in a culture that values open communication and diverse perspectives?
Are you passionate about expanding your skills, and eager to join a company that invests in employee development?
Are integrity and accountability at the core of your values?


If you answered yes to any of these questions, we invite you to explore opportunities with us and join a team committed to data-smart excellence.

Do impactful work

Join us and make a difference. Our customers face challenges on their journey to data intelligence, from data silos to legacy constraints. Navigating regulations complicates matters. We specialise in innovative solutions, empowering businesses to adopt Data Smart practices, transforming data into a strategic asset.

Joining our team means empowering companies to embrace data intelligence, making informed decisions, boosting efficiency, fostering growth, and enhancing customer experiences in today's dynamic business environment.

Are you ready to step into your greatness and imagine the impossible?

About The Job

As a Junior Tableau Developer, you will play a key role in transforming raw data into meaningful insights using Tableau. You will collaborate with cross-functional teams to design, develop, and maintain interactive dashboards and reports that support our business objectives. This is an excellent opportunity for someone with a data analysis background who is eager to advance their career in data visualisation and business intelligence.

Key Responsibilities


Develop, design, and maintain Tableau dashboards and reports to support business decision-making.
Collaborate with stakeholders to gather requirements and translate them into technical solutions.
Conduct data analysis to identify trends, patterns, and insights that inform business strategies.
Ensure data accuracy and integrity by performing data validation and quality checks.
Assist in the integration of various data sources into Tableau to create comprehensive reports.
Provide training and support to end-users on Tableau functionality and best practices.


Requirements


1 + years of proven experience in BI development space with Tableau and data analytics background.
Solid hands-on experience with Tableau, including building interactive dashboards and reports.
Strong data analysis skills, with proficiency in SQL and Excel.
Familiarity with data warehousing concepts and ETL processes.
Excellent problem-solving skills and attention to detail.
Strong communication and collaboration skills, with the ability to work effectively in a team environment.


About INGRITY

We are a fast-growing, progressive Sydney-based data & analytics company. We service many large corporates and SMBs in the financial services sector, to derive value from data. At Ingrity, we are committed to building a diverse and inclusive workforce to deliver value to customers. As a value-driven organisation, we nurture and support our people by having a laser-sharp focus on skill and talent development, collaboration, and flexibility.
Show more "
Data Scientist | Artificial Intelligence,PwC Australia,Australia,2024-08-27,https://au.linkedin.com/jobs/view/data-scientist-artificial-intelligence-at-pwc-australia-4009417958?position=42&pageNum=0&refId=djANzLv%2FJMbf8OaodSCELA%3D%3D&trackingId=isKe1UQq5wSREbpbhYqYEQ%3D%3D&trk=public_jobs_jserp-result_search-card,"Flexible work options - work smarter in a way that suits your lifestyle.
26 weeks paid parental leave - for mum, dad & foster carers.
Opportunities available in Sydney, Adelaide, Brisbane and Melbourne.



Looking for an exciting, diverse and challenging new role with a global impact? Join a modern technology team in Australia's largest professional services firm that delivers cutting-edge digital products and AI solutions.

The Opportunity

At PwC, we help Australian businesses, not-for-profits create value and improve the way they work. From improving healthcare, to creating smarter cities and igniting Australia’s start up industry, you’ll build trust in society and solve important problems.

The AI team is a group of highly experienced designers, developers, data scientists and analysts who are responsible for delivering digital products and AI solutions to PwC’s business across multiple LoS in Australia.

We partner with subject matter experts across the business to advise on, design and develop technology-enabled solutions that help to transform the way we deliver assurance, advisory, tax and legal services to our clients.

The Role

Our Data Scientists are responsible for designing and developing new digital products and AI solutions for PwC’s firmwide business and our clients.

On a day-to-day basis you will be:


Collaborating with cross-functional teams to design and build technical solutions.
Engaging in testing new ideas and pairing with developers.
Producing clean, maintainable and efficient code to be deployed at scale in Azure cloud.
Contributing to team stand-ups and software development lifecycle activities.
Participating in firmwide data science and machine learning forums and communities to share ideas and contribute to our body of knowledge.
Learning from our Senior Data Scientists.



About You

Applicants must be able to demonstrate the following key capabilities and behaviours:


Have 2-3 years experience as a junior-mid level data scientist
Python development experience with modern ML/LLM frameworks.
Experience with traditional ML/deep learning models, as well as LLM frameworks.
Strong willingness to learn on the job from the rest of the team and capability to learn on one's own initiative.
Experience with SQL databases such as PostgreSQL (or equivalents), preferable experiences in Vector DBs.
Capability to identify emerging theory and apply it to practical situations.
Strong critical thinking skills, an analytical mindset and outstanding attention to detail.
Ability to work efficiently with remote teams using collaboration technology.
Ability to identify issues and solve complex problems as part of a team.
Good written and verbal communication skills.
A proactive approach to resolving problems.
Knowledge of proper source code management and the use of Git repositories.



Ideally, you will also have:


Prior experience with microservices architectures and containerisation, including good knowledge of Docker.
Prompt engineering skills.
Knowledge of agile software development lifecycles (SDLC) and experience working on agile projects.
Prior experience with any message-queueing solutions (e.g. RabbitMQ, Kafka).
Prior experience with data pipelines at scale and building on top of them.
Prior experience with observability standards and frameworks such as OpenTelemetry.
Prior experience with developing on cloud environments such as Azure.
Typescript development experience with ReactJS and NodeJS.



547557WD
Show more "
Data Scientist | Artificial Intelligence,PwC Australia,Australia,2024-08-27,https://au.linkedin.com/jobs/view/data-scientist-artificial-intelligence-at-pwc-australia-4009416938?position=43&pageNum=0&refId=djANzLv%2FJMbf8OaodSCELA%3D%3D&trackingId=4JPmapybdNbF%2BApPUDTjlA%3D%3D&trk=public_jobs_jserp-result_search-card,"Flexible work options - work smarter in a way that suits your lifestyle.
26 weeks paid parental leave - for mum, dad & foster carers.
Opportunities available in Sydney, Adelaide, Brisbane and Melbourne.



Looking for an exciting, diverse and challenging new role with a global impact? Join a modern technology team in Australia's largest professional services firm that delivers cutting-edge digital products and AI solutions.

The Opportunity

At PwC, we help Australian businesses, not-for-profits create value and improve the way they work. From improving healthcare, to creating smarter cities and igniting Australia’s start up industry, you’ll build trust in society and solve important problems.

The AI team is a group of highly experienced designers, developers, data scientists and analysts who are responsible for delivering digital products and AI solutions to PwC’s business across multiple LoS in Australia.

We partner with subject matter experts across the business to advise on, design and develop technology-enabled solutions that help to transform the way we deliver assurance, advisory, tax and legal services to our clients.

The Role

Our Data Scientists are responsible for designing and developing new digital products and AI solutions for PwC’s firmwide business and our clients.

On a day-to-day basis you will be:


Collaborating with cross-functional teams to design and build technical solutions.
Engaging in testing new ideas and pairing with developers.
Producing clean, maintainable and efficient code to be deployed at scale in Azure cloud.
Contributing to team stand-ups and software development lifecycle activities.
Participating in firmwide data science and machine learning forums and communities to share ideas and contribute to our body of knowledge.
Learning from our Senior Data Scientists.



About You

Applicants must be able to demonstrate the following key capabilities and behaviours:


Have 2-3 years experience as a junior-mid level data scientist
Python development experience with modern ML/LLM frameworks.
Experience with traditional ML/deep learning models, as well as LLM frameworks.
Strong willingness to learn on the job from the rest of the team and capability to learn on one's own initiative.
Experience with SQL databases such as PostgreSQL (or equivalents), preferable experiences in Vector DBs.
Capability to identify emerging theory and apply it to practical situations.
Strong critical thinking skills, an analytical mindset and outstanding attention to detail.
Ability to work efficiently with remote teams using collaboration technology.
Ability to identify issues and solve complex problems as part of a team.
Good written and verbal communication skills.
A proactive approach to resolving problems.
Knowledge of proper source code management and the use of Git repositories.



Ideally, you will also have:


Prior experience with microservices architectures and containerisation, including good knowledge of Docker.
Prompt engineering skills.
Knowledge of agile software development lifecycles (SDLC) and experience working on agile projects.
Prior experience with any message-queueing solutions (e.g. RabbitMQ, Kafka).
Prior experience with data pipelines at scale and building on top of them.
Prior experience with observability standards and frameworks such as OpenTelemetry.
Prior experience with developing on cloud environments such as Azure.
Typescript development experience with ReactJS and NodeJS.



547557WD
Show more "
