title,company,location,date,link,description
Manager - AI R&D,Orica,Australia,2024-08-07,https://au.linkedin.com/jobs/view/manager-ai-r-d-at-orica-3993671194?position=38&pageNum=0&refId=xwG5PadpD%2FXvT4SkYMqbPQ%3D%3D&trackingId=nxTYFdhaxeleL2l92qA6qg%3D%3D&trk=public_jobs_jserp-result_search-card,"About Orica




At Orica, it’s the power of our people that leads innovation and shapes our futures.

Every day, all around the world, our people help mobilise vital resources essential to progress and sustainable mining. Established in 1874, we have grown to become the world leader in mining and civil blasting with a diverse of team of more than 13,000 across the world.

It’s an exciting time to join us – we are shaping the future of mining through digital and automated technologies, embracing new ways of thinking, pioneering innovation and reimagining the way we work.




About the role:




We are delighted to present an exciting opportunity for the position of Manager – AI R&D within our innovative Data, Analytics, and AI function. As the AI R&D Manager, you will oversee the research and development of cutting-edge solutions that leverage AI and advanced analytics. Your primary responsibility will be to define and shape the long-term AI and analytics strategy, ensuring alignment with our engineering, data platform, and portfolio delivery teams as well as the overall company technology roadmaps. This role is critical in maintaining Orica’s competitive edge by integrating the latest AI technologies and methodologies into our business processes.




In this dynamic and forward-thinking role, you will stay abreast of emerging trends in AI, identifying opportunities to harness these technologies for Orica’s benefit. You will develop Proof of Concept (POC) solutions, collaborating closely with the Engineering and Delivery teams to transition these concepts into scalable solutions. Your innovative approach and deep understanding of AI will be essential in driving the company’s technology strategy forward, ensuring that Orica remains at the forefront of industry advancements.




Additionally, you will work in close partnership with external partners such as international universities, research labs and the internal Portfolio Delivery, AI Engineering, and Data Platform teams to support the design, delivery, and management of various portfolios. Your ability to align AI initiatives with business objectives will be key to delivering impactful solutions that drive Orica’s success. This role offers a unique opportunity to influence Orica’s technological future while working within a global market-leading organization. Your exceptional leadership, strategic vision, and passion for AI will enable you to thrive and make significant contributions to Orica’s continued innovation and growth.




This will be a hybrid setup based in our Brisbane Office.




What you will be doing:




Leadership

Lead a team of AI engineers and Data/AI scientists to develop software and AI models aligned with business needs.
Inspire a culture of innovation and continuous personal development through mentoring, coaching, and regular feedback.
Provide the team with market data, tools, and skills for successful performance.
Recognize performance and engage in the reward and recognition program.
Address underperformance with appropriate actions to improve outcomes.
Champion change, fostering team energy, flexibility, and resilience.
Promote an inclusive culture in line with Orica’s Charter and Values.




Collaboration

Build proactive relationships within and across teams for strategic alignment and collaboration.
Share knowledge and ideas across teams to achieve Orica’s vision.
Manage prioritization, scheduling, and workload to meet performance metrics.
Define, review, and implement research delivery policies, standards, and procedures.




AI Governance & Compliance

Ensure proposed changes comply with Orica and Responsible AI standards.
Contribute to governance requirements for the function and R&D roadmap.
Oversee research/POC activities to ensure compliance and effective delivery.
Manage the AI, software, and hardware development lifecycle for applications.




POC Release & Management

Manage and implement regular POC releases and fixes with engineering and delivery teams.
Coordinate POC and technical deployments of prototype solutions in the field.
Review experiment outcomes and provide updates and recommendations to stakeholders.
Track, monitor, and report on research and POC activities, including compliance and risks.




Research Partners, IP & Budget Management

Ensure effective outcomes from outsource, contract, and software vendors.
Manage relationships with research and collaborative partners.
Oversee IP ownership negotiations and definitions.
Contribute to planning the R&D application budget and ensure budget adherence.




Stakeholder Engagement

Engage with research, business stakeholders, and IT to support field trials.
Align with Engineering, Data Platform, and Delivery teams for sustainable solutions.
Collaborate with AI Engineering Lead and Data Platform Manager to develop the technology roadmap.
Ensure alignment with strategy and roadmap through engagement with the strategy team.




General

Maintain flexibility to support daily demands and issues.
Escalate potential issues and risks to ensure timely resolution.
Align research delivery activities with design principles, strategy, architecture, and business objectives.




What you will bring:




PhD or Degree in Computer Science, Artificial Intelligence, Statistics, or Mining Engineering (or equivalent experience).
Minimum 7+ years of experience in AI and analytics research, development, and deployment, with a proven track record of successful projects in mining and other industries.
Broad skills and knowledge in technologies relevant to AI, particularly in Orica’s context.
Strong understanding of mining industry operations for both surface and underground.
Proficiency in machine learning algorithms, deep learning frameworks, and other AI technologies.
Experience leading and managing a team of AI and data science professionals.
Excellent communication, collaboration, and leadership skills, with the ability to influence stakeholders at all levels.
Strategic thinker with a keen eye for identifying and capitalizing on business opportunities through AI and analytics.
Proven ability to effectively manage R&D budgets and resources.




What we offer




As part of a truly global company, you will have the ability to grow and learn in a diverse, collaborative culture. We foster relationships and learning through connected global and local teams, promote flexible and diverse career paths and support the development of your knowledge and skills.

You will be paid a competitive salary, learn from talented individuals across multiple disciplines and be able to thrive in a safe workplace within a collaborative culture. Ignite your career at a place where your distinct potential can find its home.




Our commitment:




Orica promotes and fosters a culture of inclusion and Equal Opportunity Employment everywhere we operate. We treat our people and applicants with fairness, dignity, and respect, getting the best of everyone’s contributions.

All qualified applicants will receive consideration for employment without regard to race, religion, sexual orientation, gender perception or identity, nationality, age, military or veteran, marital or disability status.

Show more "
Data Scientist-Marketing Analytics,Loyalytics AI,Australia,2024-08-02,https://au.linkedin.com/jobs/view/data-scientist-marketing-analytics-at-loyalytics-ai-3990653027?position=39&pageNum=0&refId=xwG5PadpD%2FXvT4SkYMqbPQ%3D%3D&trackingId=4TSoOAHA3OCadgr6iczp0A%3D%3D&trk=public_jobs_jserp-result_search-card,"About Loyalytics

Loyalytics is a fast-growing Analytics consulting and product organization based out of Bangalore. We work with large retail clients across the globe helping them monetize their data assets through our consulting assignments and product accelerators. We are a young dynamic team of 100+ analytics practitioners working on some of the most cutting-edge tools and technologies.

Who We Are


Technical team: A team full of data scientists, data engineers and business analysts who work with 1M+ data points every day.
Market Size: Massive multi-billion $ global market opportunity.
Leadership: Combined experience of 40+ years of experience in the industry.
Customers: Word-of-mouth and referral driven marketing to acquire customers like big retail brands in GCC regions like Lulu, GMG, among others (Strong product-market fit).
What makes us stand apart: 8 years old bootstrapped and 100+ people company that is still hiring.


About The Job

We are looking for an experienced Data Scientist who is well-versed in machine learning and statistical modelling. You will be working with data platforms and databases, get deeply involve in data cleaning and ETL building, use whatever modeling skills you have, be it time-series forecasting or classification algorithms, to help solve marketing problems and finally bring your insight or solution to

the senior management. We are looking for a self-starter who is passionate about coding, data wrangling and sharing insight with others.

Responsibilities


Understand marketing initiatives, challenges, questions and concerns and transforming them into data science solutions and metrics.
Develop models and analytical frameworks to quantitatively measure the impact, efficiency and effectiveness of marketing activities.
Develop and implement innovative machine learning techniques to answer key business questions from marketing team or senior management while identifying new areas to explore.
Present your recommendation to marketing colleagues and senior management.
Collaborate with internal or external members to bring in data source/platform/technique into the team.


Requirements


2+ years of experience in data analytics
Experience with data cleaning and exploratory data analysis; High proficiency in SQL
Expertise in at least one scripting language (Python or R) as well as scientific libraries like-Numpy or Pandas.
Knowledge in statistical modeling: Regression/Classification/Clustering/Time Series/Forecasting/Causal Inference and other techniques
Experience working with popular machine learning frameworks like Scikit-learn, XGboost.
Experience developing sophisticated models and solving sophisticated quantitative problems that could be understood by non-technical colleagues
Basic understanding and knowledge of digital marketing practices and KPIs on ecommerce ad platforms
Desire to partner up with other data scientists, data analysts and key business partners
Show more "
Editor - Freelance AI Tutor,Mindrift,Australia,2024-08-24,https://au.linkedin.com/jobs/view/editor-freelance-ai-tutor-at-mindrift-4009557474?position=40&pageNum=0&refId=xwG5PadpD%2FXvT4SkYMqbPQ%3D%3D&trackingId=xdTaJHy96FWRVi890Cbxhw%3D%3D&trk=public_jobs_jserp-result_search-card,"If you're a professional editor, we have an exciting opportunity for you to use your language skills in a new and innovative way. Embrace the future by joining us as an AI Tutor - Editor, where your expertise doesn't just refine content but helps train AI to communicate effectively.

We're seeking freelance editors to collaborate with us creating a diverse range of content.

As an AI Tutor - Editor, you will use your language skills to create texts covering a wide range of topics. Following our style guide and other quality guidelines, you will create and check responses that will form the ""voice"" of future AI. You will create and edit original, helpful, honest, and harmless responses; fact check existing responses; bring submitted texts up to our standards; and work directly with Team Leads to help provide feedback to writers and other participants to ensure they can regularly produce high-quality work.

Requirements


You have at least 2 years of professional experience in editing texts in English
You have a native level of English
A degree in communications, linguistics, literature, journalism, or similar would be an advantage
You are ready to learn new methods, able to switch between projects and topics quickly and sometimes work with challenging, complex guidelines
Our freelance role is fully remote so, you just need a laptop, internet connection, time available and enthusiasm to take on a challenge



Benefits


Take part in part-time, remote, freelance projects that respect your primary professional or academic commitments
Try your hand at an AI project and enrich your portfolio with new experiences
Make a tangible impact on the quality of AI
Show more "
Data Scientist,Cashrewards,Australia,2024-08-26,https://au.linkedin.com/jobs/view/data-scientist-at-cashrewards-3975120007?position=41&pageNum=0&refId=xwG5PadpD%2FXvT4SkYMqbPQ%3D%3D&trackingId=Yz6ARlWQxtPyMlCuFifXuA%3D%3D&trk=public_jobs_jserp-result_search-card,"Heyyyyy! We're Cashrewards, Australia’s most loved cashback platform.

Shoppers love us, but not just shoppers, our team think we’re pretty awesome too. So much so that they voted and now we’re a certified Great Place to Work. As they say, the proof is in the pudding so check out this role to see if you fancy a slice yourself.

About The Role

As a Data Scientist, you will collaborate with stakeholders to drive decision-making and long-term analytics. Use advanced techniques to boost company performance and align with organizational goals. Co-create problem statements, enhance capabilities, and develop personalization for our cashback programs. Work with digital and marketing teams to highlight the benefits for merchants. Analyze data and design Power BI dashboards to solve business problems. Be a part of our innovative team!

Your Focus


Data Modeling and Analysis: Develop and implement sophisticated data models to support initiatives such as customer journey mapping, propensity modeling, and personalization implementation.
Forecasting and Predictive Analytics: Utilize statistical and machine learning techniques, including logistic regression, random forests, and ensemble modeling to create accurate forecasts and predictive models.
Incrementality Analysis: Conduct robust incrementality analyses and causal impact studies to measure the effectiveness of various marketing strategies.
Model Management: Oversee the full lifecycle of data science models from development to deployment (in conjunction with our Data Engineering Team) and maintenance, ensuring high performance and scalability.
BI and Analytics Development: Design and enhance BI tools and analytics frameworks to improve data visualization, reporting efficiency, and decision support across the organization.
Collaboration and Insight Presentation: Work closely with cross-functional teams to translate data-driven insights into actionable business strategies. Communicate complex results to non-technical stakeholders effectively.


About You


Business stakeholder engagement to understand their pain-points, identify opportunities, and develop analytical solutions that can create value for them, solving their most difficult problems and adjusting the communications style to successfully influence them.
Professional experience in a data science position, with a proven track record of implementing and managing advanced models in a business environment.
Prior experience of developing data science capabilities & driving its consumption.
Utilisation of data to discover insights, predict behaviour, add value and visualise results and patterns to provide recommendations to support Cashrewards’ ambitions.
Expertise in programming languages such as Python and SQL. Familiarity with cloud services is preferred.
Experience with building dashboards in either Power BI or Tableau
Experience of building and implementing personalization models is highly preferable.
Understanding of Marketing Technologies such as Adobe Analytics, Braze, Kevel or Salesforce is highly preferable.
Working with large datasets and click-stream data in the past is required. Experience with Retail/CPG/Advertising/Media analytics, Customer analytics, Marketing analytics is preferred


In the fast moving cashback category, Cashrewards has powered ahead of its rivals and taken the lead, serving over 2 million members with an enticing range of cashback offers from more than 2000 brand partners including Apple, Amazon, Myer, Liquorland, Adidas, Bonds, Target, Booking.com and The Iconic. As if that isn’t impressive enough, we’re fully Australian owned and operated, and backed by 1835i, one of Australia's leading venture funds. Plus, we support the Starlight Children's Foundation by donating 1% of all cash redeemed to the foundation.

Another cool thing, we're right smack-bang in the middle of Sydney CBD (next to the QVB) so we're easy to get to.

There's Lots More To Love About Working Here, Like


Flexible working
Friday hours (finish at 3pm on Fridays)
Double cashback
Free access to Headspace
Discounted fitness classes and wellness offering
Birthday leave
16 weeks paid parental leave
Ability to work up to 90 days a year from anywhere in the world
Awesome people who you'll get to know at some of our awesome celebrations and social events


So if you’re keen to jump on board and help us steer this fine ship into the future, don’t let this opportunity pass you by. So jump in, forget FOMO. Join the Cashrewards team today.

Check out our careers page https://www.cashrewards.com.au/careers
Show more "
Freelance Mathematics Expert - AI Tutor,Mindrift,Australia,2024-08-23,https://au.linkedin.com/jobs/view/freelance-mathematics-expert-ai-tutor-at-mindrift-4008828438?position=42&pageNum=0&refId=xwG5PadpD%2FXvT4SkYMqbPQ%3D%3D&trackingId=zB2dj10A4n1wNCZWoRjfqQ%3D%3D&trk=public_jobs_jserp-result_search-card,"We are embarking on a large-scale project with a leading technology company to develop an AI system with a deep understanding of the natural sciences. This part-time, fully remote project offers a unique opportunity to influence the future of education and the role of AI in mathematics, logic, theoretical computer science, artificial intelligence, statistics, and more.

As an AI Tutor - Mathematics Expert, your work will involve creating and refining AI-generated content to ensure accuracy, relevance, and engagement across a wide array of topics within the formal sciences. Your contributions will help shape an AI that educates, inspires curiosity, and promotes a deeper understanding of abstract systems and their applications.

Requirements


You have a degree in mathematics, logic, statistics or related fields. Professional experience in those fields is an advantage
Your level of English is advanced (C1) or above
A strong passion for writing, editing, and the formal science
You are ready to learn new methods, able to switch between tasks and topics quickly and sometimes work with challenging, complex guidelines
Our freelance role is fully remote so, you just need a laptop, internet connection, time available and enthusiasm to take on a challenge



Benefits


Take part in part-time, remote, freelance projects that respect your primary professional or academic commitments
Try your hand at an AI project and enrich your portfolio with new experiences
Make a tangible impact on the quality of AI
Show more "
Data Scientist | Generative AI,Deloitte,Australia,2024-08-25,https://au.linkedin.com/jobs/view/data-scientist-generative-ai-at-deloitte-3893701519?position=45&pageNum=0&refId=xwG5PadpD%2FXvT4SkYMqbPQ%3D%3D&trackingId=tOOzBKq%2F2zDCQFW%2B%2FK135w%3D%3D&trk=public_jobs_jserp-result_search-card,"Description:

Job Requisition ID: 35018

Senior Consultant - Data Scientist | Generative AI


Work on cutting edge Analytics & AI technologies in real world environments
Flexible work arrangements – work in a way that suits you best
Salary packaging – to suit your personal and financial circumstances


The Data Scientist will serve as a vital member of our team. You will be responsible for leveraging advanced analytical methods and generative algorithms to automate workflows and derive actionable insights. This role offers a unique opportunity to work at the cutting-edge of Generative AI, alongside a multidisciplinary team including Data Engineers & Machine Learning Engineers and supports the Engineering Lead in the execution of the GenAI SDT program of work.

What will your typical day look like?


Advising clients to help solve real-life business problems across diverse industries through use of data, cloud, analytics and AI technologies
Performing “hands on” statistical and machine learning modelling, computations, and data engineering
Involvement in identifying trends and innovation in deep learning, machine learning and related technologies


Key Accountabilities:


Machine Learning Modelling & GenAI Applications: Develop and implement machine learning models, including those leveraging Generative AI techniques, to address diverse business challenges. Ability to prototype and bring models into production is key.
Data Analysis & Interpretation: Analyse complex data sets and provide actionable insights that align with business objectives
Research & Development: Stay abreast of emerging trends in Generative AI and contribute to the in-house knowledge base by actively participating in research initiatives
Collaboration & Communication: Collaborate with different departments to identify business needs and devise solutions, effectively communicating technical concepts to non-technical stakeholders
Ethical Considerations: Implement ethical guidelines in all data science projects, particularly those involving synthetic data, to ensure responsible and compliant data usage
Technical Leadership: Mentor junior data scientists and collaborate with the data engineering team to ensure seamless data pipeline integration for generative models.


Enough About Us, Let’s Talk About You.

You may have all or some of the following skills / experiences:


A minimum 5 years’ relevant work experience with data analytics, feature engineering and model development using market leading machine learning and deep learning techniques
A Master's degree or PhD in Data Science, Computer Science, Statistics, Mathematics, or a related field
Applied experience with GenAI use cases in production
Solid expertise in data science libraries and frameworks like Scikit-learn, TensorFlow, or PyTorch & strong command of programming languages such as Python or R
Experience with Big Data analytics, including Hadoop, Spark, graph analytics would be desirable
Fluency in data querying and manipulation using cloud-based SQL and NoSQL database technologies
Experience in utilising modern MLOps/DevOps approaches to manage and deploy models at scale on Azure (preferred), AWS or GCP.
Statistical Analysis: Robust understanding of statistical methods and data modelling techniques
Communication Skills: Ability to articulate complex technical information to a diverse range of stakeholders.
Excellent interpersonal skills and a collaborative mindset
Strong ethical grounding in data usage and AI implementation


Why Deloitte?  

At Deloitte, we focus our energy on interesting and impactful work. We’re always learning, innovating and setting the standard; making a positive difference to our clients and our society. We put coaching at the heart of what we do, helping our people grow their careers in any direction – whether it be up, moving into something new, or even moving across the world.  

We embrace diversity, equity and inclusion. We have a diverse collection of people from different backgrounds, with different experiences, gender identities, abilities and thinking styles. What binds us together is a shared commitment to value everyone’s perspective and to cultivate inclusion; so that our work environment is a safe space we can all belong. 

We prioritise flexibility and choice. At Deloitte, you get trust on Day 1. We know our people get their best work done when they’re in control of where and how they work, designing their work week around their client, team and personal commitments.

We help you live and work well. To support your personal and professional life, we offer a range of perks and benefits, including retail discounts, wellbeing leave, paid volunteering days, twelve flexible working options, market-leading parental leave and return to work support package. 

Next Steps

Sound like the sort of role for you? Apply now, we’d love to hear from you!

By applying for this job, you’ll be assessed against the Deloitte Talent Standards. We’ve designed these standards so that you can grow in your career, and we can provide our clients with a consistent and exceptional Deloitte employee experience globally. The preferred candidate will be subject to background screening by Deloitte or by their external third-party provider.

By applying for this job, you’ll be assessed against the Deloitte Talent Standards. We’ve designed these standards so that you can grow in your career, and we can provide our clients with a consistent and exceptional Deloitte employee experience globally. The preferred candidate will be subject to background screening by Deloitte or by their external third-party provider.
Show more "
