title,company,location,date,link,description
(Senior) Berater Application Performance Management (APM) / Observability (m/w/d),iteratec,Germany,2024-08-02,https://de.linkedin.com/jobs/view/senior-berater-application-performance-management-apm-observability-m-w-d-at-iteratec-3991381810?position=1&pageNum=0&refId=COQUFb4nPceNxPnf2hQp%2Fg%3D%3D&trackingId=pjmJyGjM4SoE6B74RtWQ%2BQ%3D%3D&trk=public_jobs_jserp-result_search-card,"Düsseldorf, Frankfurt a. M., Hamburg, Karlsruhe, München, Stuttgart

Worum geht es?

In unserem Kompetenzbereich Application Performance Management (kurz: APM) glauben wir, dass nachhaltig erfolgreiche Unternehmen die Erkenntnisse aus Software-Daten nutzen, um ihren Kunden stets den richtigen Service in der höchsten Qualität anbieten zu können. Mit Methoden des Performance Engineering, technischem und fachlichem Monitoring, modernen Betriebskonzepten sowie in enger Zusammenarbeit mit dem Fachbereich sind wir als Vermittler, Coach und Enabler unterwegs, beraten unabhängig und entwickeln unsere Kunden zum Digital Champion.

Was dich erwartet

Du kannst dich in den Bereichen Application Performance Management / Observability in verschiedenen Disziplinen vertiefen und weiterbilden:


Entwickle Konzepte, Strategien und Prozesse, um APM einzuführen, anzupassen, weiterzuentwickeln und nachhaltig den Wertschöpfungszyklus zu etablieren
Berate den Fachbereich, um Business Monitoring einzuführen, User Experience Journey Monitoring zu etablieren und zwischen fachlichen Anforderungen und der IT Brücken zu bauen
Nutze APM / Observability im Entwicklungskontext, um performante & skalierbare (Software-)Architekturen zu bauen, Probleme zu analysieren und hochqualitative Software zu entwickeln
Überwache Anwendungen und Service im digitalen Betrieb - egal ob DevOps, SRE oder Observability - und nutze Monitoring Insights und AIOps für Betriebsautomatisierung und Impact-Mangement


Wir bieten dir ein spannendes Umfeld mit individuellen und anspruchsvollen Kundenprojekten. Als querschnittlicher Themenbereich bietet dir APM die Möglichkeit mit den verschiedenen Bereichen aus Entwicklung, Betrieb, Fachbereich und Business zusammenzuarbeiten, gemeinsam an kundenorientierten Lösungen zu arbeiten und deine individuellen Stärken einbringen zu können.

Als technologischer Experte und mit breitem Methodenwissen bist du für unsere Kunden Sparringspartner und Vordenker mit hoher Verantwortung sowie Mentor für weniger erfahrene Kolleg*innen.

Was du mitbringst

Grundsätzliche Anforderungen:


Technologische Expertise / Exzellenz in Softwaretechnik und -architektur, z.B. durch ein Studium der Informatik oder Wirtschaftsinformatik (Quereinstieg möglich)
Reisebereitschaft in vertretbarem Rahmen (wir präferieren generell Projekte bei unseren Kunden vor Ort)
Sicheres Auftreten als Berater und ausgeprägte Kommunikationsfähigkeit mit Kunden und Stakeholdern (von der Entwicklung über Betrieb, Fachbereich bis zum Management)
Analytisches und Experten-Mindset mit dem Anspruch, auch komplizierte Herausforderungen anzugehen und die Komfortzone zu verlassen
Erfahrung in der Lieferung und ggf. auch Leitung von Kundenprojekten, gerne auch Softwareprojekten


Hilfreiche Zusatzqualifikationen:


Erfahrung mit Lastverhalten, Skalierung und Performance, bspw. Last- und Performancetests (Referenzen)
Routine im Umgang mit Software Architektur, Cloud-Umgebungen (AWS, Google Cloud, Azure), Cloud-native Entwicklung
Guter Überblick über DevOps, SRE, Observability
Kenntnisse im Umgang mit einem kommerziellen APM Werkzeug (Instana, DataDog, Dynatrace, AppDynamics, New Relic, CA APM, ...) oder Open Source Lösungen (OpenTelemetry, Zipkin, Jaeger, ...)
Erfahrung mit Logging- und Loganalyse Plattformen (Elastic, Graylog, Splunk, ...)
Continuous Integration und Continuous Delivery sind keine Fremdwörter genauso wie Docker, Kubernetes und OpenShift


Unsere Benefits


Arbeiten bei einem „Great Place to Work“: Seit 2014 nehmen wir an der jährlichen Mitarbeiterbefragung von „Great Place to Work“ teil – auch in diesem Jahr zählen wir zu den besten Arbeitgebern Deutschlands und der ITK-Branche
Exzellente Kolleg*innen: vielfältiges & motiviertes Team, mit dem es Spaß macht, Probleme für anspruchsvolle Projekte zu lösen
Vielfältige Entwicklungsmöglichkeiten: Kontinuierliche Potentialentfaltung durch ein unbegrenztes Budget für Deine Weiterentwicklung (Trainings, Konferenzen und Coachings, etc.)
Berufliche Abenteuer und Freiraum für Gestaltung: durch inspirierende und sinnstiftende Projekte & individuelle Freiräume, z. B. beim „Innovation Frei-Day“, in unseren Communities oder als Mentor
Der Mensch steht immer an erster Stelle: Achtsames Miteinander und Füreinander in einer leistungsorientierten Wohlfühlatmosphäre
Einen rundum modernen Arbeitsplatz: Freiheit in der Arbeitszeitgestaltung durch hybrides Arbeiten und Gleitzeitregelungen, sowie frei wählbares Equipment (Smartphone, Laptop), moderne Büros und ergonomische Arbeitsplätze
Förderung deines Engagements: bei Barcamps, auf Konferenzen, als Lehrbeauftragter oder Autor
Außergewöhnliche Mitgestaltungsmöglichkeiten: durch unsere Genossenschaft, bei der du Miteigentümer von iteratec werden kannst
Gesundheit und Vorsorge: Zuschuss zu Gesundheitsangeboten, Coachings und betriebliche Altersvorsorge, sowie die Möglichkeit, bis zu 10 Tage zusätzlichen Urlaub zu kaufen
Geldwerte Vorteile: Essenszuschuss, Prepaid-Kreditkarte für private Zwecke, Zuschuss zum ÖPNV, Fahrrad Leasing über JobRad, Kinderbetreuungszuschuss


Deine Bewerbung

Bitte sende uns deine Bewerbungsunterlagen in weniger als 2 Minuten über unser Bewerbungsformular.
Show more "
DevOps Consultant Kubernetes (m/w/d),Devoteam Innovative Tech,Germany,2024-08-12,https://de.linkedin.com/jobs/view/devops-consultant-kubernetes-m-w-d-at-devoteam-innovative-tech-3996446903?position=2&pageNum=0&refId=COQUFb4nPceNxPnf2hQp%2Fg%3D%3D&trackingId=QMuWbsGSuq71f8A4Zzekqw%3D%3D&trk=public_jobs_jserp-result_search-card,"
Unternehmensbeschreibung

Wir fördern Dein persönliches Wachstum, gemeinsamen Erfolg und neue Innovationen. 

Wir sind ein internationales Beratungsunternehmen mit über 25 Jahren Erfahrung und über 10.000 Tech- und Business Expert:innen. Unser Fokus liegt auf digitaler Strategie, Plattformtechnologien, Cybersicherheit und Unternehmenstransformation. Als strategischer Partner von führenden Cloud-Anbietern wie AWS, Google, Microsoft, ServiceNow und SAP erwecken wir gemeinsam mit Dir digitale Visionen zum Leben.

Wir bieten Dir die Möglichkeit, Dich persönlich weiterzuentwickeln und Teil eines erfolgreichen Teams zu werden. Wir schaffen eine inspirierende, moderne Arbeitsumgebung, in der Innovation und Deine Kreativität gefördert werden.

Entdecke die Welt von Devoteam und bewirb Dich noch heute!

Creative Tech For Better Change

#Consulting #Cloud #DevOps #Kubernetes

Das erwartet Dich

Deine Benefits: Neben unserer revolutionären Arbeitskultur von New Way of Work:

Moderne Büros in Toplage in München, Frankfurt und Stuttgart
Flexibles Remote- oder Hybrid Working mit der Möglichkeit Deine Arbeitszeiten und Arbeitsorte individuell auf Deine Bedürfnisse anzupassen
Unsere Devoteam Academy bietet Dir ein großes Angebot an zertifizierten Trainings und Sprachkursen 
Internationale Entwicklungsmöglichkeiten für Deinen Karriereboost bei Devoteam
Gaming-Lounge für Deine kreative Pause zwischen Meetings und Calls
Get-Together Partys und Teamevents für den regelmäßigen Austausch und Spaß mit Deinen Kollleg:innen
Mitarbeiter:innen-Prämien beim Werben von neuen Mitarbeiter:innen
Moderne IT-Ausstattung - Wähle aus einer Vielzahl von Möglichkeiten das für Dich passende Produkt  
Corporate Benefits mit großer Auswahl an zahlreichen Angeboten für nahezu jeden Bereich
Jobrad Angebot mit attraktiven steuerlichen Vorteilen für Dich
Betriebliche Altersvorsorge, Direktversicherungen und vermögenswirksame Leistungen stehen Dir als Zusatzleistungen zur Verfügung
Integration Day inkl. Mentorenprogramme für Deinen perfekten Start bei Devoteam


Stellenbeschreibung

Dein neuer Job:

Als DevOps Engineer Kubernetes (m/w/d) bei Devoteam Innovative Tech bist Du der Fachexperte für das Design und den Aufbau von Kubernetes-Plattformen in unseren Kundenprojekten. Darüber hinaus beteiligst du dich an der Weiterentwicklung und an operativen Aufgaben. Als Teil eines multidisziplinären Teams unterstützt du unsere Kunden mit Spitzentechnologien, neuen Denkansätzen und dem Aufbau und Betrieb innovativer Anwendungen auf modernsten Plattformen, um deren Produktivität und Wachstum maximal zu steigern. 

Dein Arbeitsalltag besteht aus folgenden Aufgaben

Du bist für den Aufbau von Kubernetes- und GitOps-Lösungen in unseren Kundenprojekten verantwortlich
Du unterstützt in Kubernetes-Projekten von Design und Architektur, über die Implementierung und Portierung von Apps auf die Plattform bis hin zur Überführung der Lösung in den Betrieb.
Du leistest mit Deiner Expertise Beratung zur Lösungsarchitektur, Plattform- und Tool-Auswahl
Du hast ein sehr gutes technisches Verständnis und bringst deine praktische Erfahrung aus dem Kubernetes Platform Engineering-Umfeld in unsere Softwareprojekte ein.
Du arbeitest in interdisziplinären Teams und bringst Dich mit Deinen Ideen aktiv beim Design, bei der Beratung und bei der Implementierung von Konzepten mit ein
Du gehst Themen proaktiv an, nutzt gestalterischen Freiraum und unterstützt Deine Kollegen


Qualifikationen

Das bringst Du mit:

Eine abgeschlossene Hochschulausbildung in der Informatik oder einem verwandten Studienfach
Mindestens 5 Jahre Erfahrung als DevOps oder Site Reliability Engineer
Du verfügst über mehrjährige, praktische Erfahrung mit Kubernetes, Docker, Infrastructure-as-Code, CI/CD, GitOps und entsprechenden Tools
Deine Leidenschaft ist Technologie und Innovation, du lebst die DevOps-Philosophie und bist mit den Modellen, Prinzipien & Best Practices vertraut
Du gehst Themen proaktiv an, nutzt gestalterischen Freiraum und unterstützt Deine Kollegen
Hohes Maß an Eigeninitiative und Teamfähigkeit
Offenheit für neue Themen, Technologien und Lösungen
Analytische Fähigkeiten
fließende Deutsch- und  Englischkenntnisse sowie ein hohes Maß an Kommunikationsfähigkeit runden dein Profil ab



In diesem Themen fühlst Du dich sicher:

Sehr gute Kenntnisse in Linux, Docker und Kubernetes
Vertraut mit Configuration Management Tools (z.B. Kustomize, Helm)
Container/K8s Security Best Practices
Gute Kenntnisse in K8s Networking (z.B. Calico, Cilium, Flannel) und Ceph Storage
Idealerweise Service Mesh Know-how (z.B. Istio, Linkerd, Consul)
Kenntnisse in CI/CD und GitOps (z.B. Git, Quay, Tekton, Argo CD, Flux CD, Fleet)
Erfahrung mit Monitoring-Tools (z.B. Prometheus, Grafana, ELK/EFK, Jaeger)
Solide Kenntnisse in Bash und Python
Praktische Erfahrung mit Red Hat OpenShift, SUSE Rancher oder VMware Tanzu ist ein Vorteil

Wünschenswert

Erfahrungen im Einsatz von AI basierten Productivity Tools wie ChatGPT, GitHub Copilot, o.Ä.
Erste Erfahrungen in MLOps und AIOps


Zusätzliche Informationen

Melde Dich bei unserem Recruiting Team

Durch unsere offene Unternehmenskultur legen wir großen Wert darauf, Menschen die Chance zu geben, sich zu bewerben, auch wenn nicht alle spezifischen Fähigkeiten der Stellenbeschreibung erfüllt werden. Wir sind überzeugt, dass jede:r Einzelne durch unsere Unterstützung und ein motiviertes Team sein volles Potenzial entfalten kann.

Wir freuen uns auf Deine Bewerbung!

Recruiting Team

Devoteam Germany

de.recruiting@devoteam.com

Weitere Stellenangebote findest Du auf: 

https://de.devoteam.com/newwayofwork/

Show more "
Senior Solutions Architect - Germany (Pre-sales),Elastic,Germany,2024-08-16,https://de.linkedin.com/jobs/view/senior-solutions-architect-germany-pre-sales-at-elastic-3946638940?position=3&pageNum=0&refId=COQUFb4nPceNxPnf2hQp%2Fg%3D%3D&trackingId=9kDKr81BcqsZYDPvtaRgVw%3D%3D&trk=public_jobs_jserp-result_search-card,"Elastic is a free and open search company that powers enterprise search, observability, and security solutions built on one technology stack that can be deployed anywhere. From finding documents to monitoring infrastructure to hunting for threats, Elastic makes data usable in real-time and at scale. Thousands of organizations worldwide, including Barclays, Cisco, eBay, Fairfax, ING, Goldman Sachs, Microsoft, The Mayo Clinic, NASA, The New York Times, Wikipedia, and Verizon, use Elastic to power mission-critical systems. Founded in 2012, Elastic is a distributed company with Elasticians around the globe. Learn more at elastic.co.

Are you looking to make a real impact and play a meaningful role in the growth of our company?

As a Solutions Architect at Elastic, you will serve as a technical authority and trusted advisor to our sales team, customers, partners, and community. You will understand and solve our customer’s business issues with the Elastic Stack, engage the regional Elastic community through events and programs, and enable sales through our Partners. A successful SA at Elastic will be focused on excellence; taking the initiative to improve both themselves and the team through continuous learning and questioning the status quo.

What You Will Be Doing:


Serving as the technical point of contact for your accounts and account managers in your assigned territory.
Uncovering new use cases within Cyber Security, AIops and Search within your territory
Developing a deep understanding of customers’ goals and objectives and articulating how our offerings address their needs.
Creating and owning value-based relationships at all levels in customer organizations.
Actively participating in all phases of planning and execution for your territory, from initial discovery to the technical win.
Developing and maintaining a deep understanding of the Elastic products and solutions to demonstrate the value of our offerings in sales meetings, and at events such as meetups and conferences.
Advising the sales team on effective ways of positioning Elastic products, solutions and services.
Onboarding, educating and enabling our partners, and supporting them in sales cycles.
Creating collateral, contributing to programs and collaborating with other Elasticians to meet individual client needs.
Being the voice of the customer and community to communicate needs, gaps, and enhancements to our engineering and leadership teams.
Deepening both your sales and technical skills through self driven education while taking advantage of all the professional development opportunities provided by Elastic.


What You Bring Along:


A track record of success in a technical presales’ role-- enough experience selling and implementing technology to earn your customer’s trust.
A demonstrable ability to articulate and sell the benefits of modern platforms, software, and technologies.
A real passion for being curious and a continuous learner. You are someone that invests in yourself as much as you invest in your professional relationships.
A history of successful customer relations where you developed an understanding of what made a difference, and devised architectures that helped meet a goal, tackle a problem, or outpace competitors.
An ability to influence. Have you more than once convinced a team you worked for, of an idea, technology, or architectural pattern?
The ability to inspire groups, both large and small.
A willingness to travel 25%-30% within region, as well as occasionally internationally.
Native or fluent in German language and also fluency in English as mandatory requirement.


Additional Information - We Take Care Of Our People

As a distributed company, diversity drives our identity. Whether you’re looking to launch a new career or grow an existing one, Elastic is the type of company where you can balance great work with great life. Your age is only a number. It doesn’t matter if you’re just out of college or your children are; we need you for what you can do.

We strive to have parity of benefits across regions and while regulations differ from place to place, we believe taking care of our people is the right thing to do.


Competitive pay based on the work you do here and not your previous salary
Health coverage for you and your family in many locations
Ability to craft your calendar with flexible locations and schedules for many roles
Generous number of vacation days each year
Increase your impact - We match up to $2000 (or local currency equivalent) for financial donations and service
Up to 40 hours each year to use toward volunteer projects you love
Embracing parenthood with minimum of 16 weeks of parental leave


Different people approach problems differently. We need that. Elastic is an equal opportunity/affirmative action employer committed to diversity, equity, and inclusion. Qualified applicants will receive consideration for employment without regard to race, ethnicity, color, religion, sex, pregnancy, sexual orientation, gender perception or identity, national origin, age, marital status, protected veteran status, disability status, or any other basis protected by federal, state or local law, ordinance or regulation.

We welcome individuals with disabilities and strive to create an accessible and inclusive experience for all individuals. To request an accommodation during the application or the recruiting process, please email candidate_accessibility@elastic.co We will reply to your request within 24 business hours of submission.

Applicants have rights under Federal Employment Laws, view posters linked below: Family and Medical Leave Act (FMLA) Poster; Pay Transparency Nondiscrimination Provision Poster; Employee Polygraph Protection Act (EPPA) Poster and Know Your Rights (Poster)

Elasticsearch develops and distributes encryption software and technology that is subject to U.S. export controls and licensing requirements for individuals who are located in or are nationals of the following sanctioned countries and regions: Belarus, Cuba, Iran, North Korea, Russia, Syria, the Crimea Region of Ukraine, the Donetsk People’s Republic (“DNR”), and the Luhansk People’s Republic (“LNR”). If you are located in or are a national of one of the listed countries or regions, an export license may be required as a condition of your employment in this role. Please note that national origin and/or nationality do not affect eligibility for employment with Elastic.

Please see here for our Privacy Statement.
Show more "
Lead IT Expert Log-Management (m/w/d),BWI GmbH,Germany,2024-08-13,https://de.linkedin.com/jobs/view/lead-it-expert-log-management-m-w-d-at-bwi-gmbh-3998682593?position=4&pageNum=0&refId=COQUFb4nPceNxPnf2hQp%2Fg%3D%3D&trackingId=V%2BWQrEkmb4YWrHh7cMOIBA%3D%3D&trk=public_jobs_jserp-result_search-card,"Sorgen Sie gemeinsam mit uns für die digitale Zukunftsfähigkeit der Bundeswehr.

Als primärer Digitalisierungspartner der Bundeswehr erbringen wir stabile, sichere und effiziente IT-Services im In- und Ausland, vom Grundbetrieb bis in den einsatznahen Bereich und tragen so zur kontinuierlichen Erhöhung der Führungs- und Einsatzfähigkeit der Bundeswehr bei. Mit über 7.000 Kolleg*innen betreiben und modernisieren wir eine der größten und komplexesten IT-Infrastrukturen in Deutschland. Wir suchen verantwortungsvolle IT-Spezialist*innen, die die Bundeswehr-IT aus Überzeugung in herausfordernden Digitalisierungsvorhaben weiterentwickeln und so einen Beitrag zur Sicherheit Deutschlands leisten wollen.

Der Bereich Shared Service Delivery (SSD) ist für das Servicedesign, die Serviceentwicklung und die Bereitstellung aller End-User-, Rechenzentren & Cloud-lnfrastruktur sowie Communication Services des BWI-Service-Portfolios verantwortlich. Er stellt überwiegend standardisierte Servicelösungen für Kunden zur Verfügung. Die Shared Service Delivery ist integraler Bestandteil der CDO und somit maßgeblich verantwortlich für die gemeinsamen Ziele und Maßnahmen. Unser Ansporn ist maximale Betriebsstabilität und hohe Kundenzufriedenheit. Die Services des Servicetowers SSD PoD 1 ITSM & Automation steigern die Effizienz und den Automatisierungsgrad der BWI und stellt die dafür benötigten Funktionalitäten, sowie eine zentrale ITSM-Landschaft bereit. Ziel ist eine einheitliche Architektur zur Automatisierung der Services bzw. Serviceketten und die Bereitstellung der dafür notwendigen Systeme, sowie das Zurverfügungstellen von Telemetriedaten (Logs, Events, Compliancechecks usw.) zur Sicherung der Systemlandschaft und Ansteuerung von Automatisierung (AIOps). Darüber hinaus tragen sie Verantwortung für die Management– und Dokumentationssysteme der Infrastruktur der BWI und der Bundeswehr.

Ihre Aufgaben


Verantwortung für die End-to-End-Lösungskonzeption und strategische Weiterentwicklung von systemübergreifenden Lösungen, inklusive architektonischer Vorgaben wie Applikationen, Schnittstellen und Prozesse
Erstellung technischer Konzepte (Architektur-, Implementierungs-, Sicherheits- und Migrationskonzepte) für den Service Log-Management unter Beachtung der geltenden Normen und Standards
Eigenverantwortliche Aufnahme, Analyse und Bewertung kundenspezifischer Anforderungen sowie Durchführung von Workshops zur Erarbeitung bzw. Evaluierung von Architekturen und Daten-Einstufungen
Interne Beratung zu relevanten technischen Themen sowie Übernahme der fachlichen Teilprojektleitung in bereichsübergreifenden Projekten
Enge Zusammenarbeit mit den Bereichen Servicemanagement, Engineering und Operation
Erstellung von servicespezifischen Arbeits- und Handlungsanweisungen


Ihr Profil


Abgeschlossenes Studium oder eine vergleichbare Ausbildung im Bereich IT
Etwa 8 Jahre Berufserfahrung im Themenbereich IT-Architektur sowie Erfahrung mit agilen Projekttechnologien und -methoden
Erfahrung in der fachlichen Führung von internen Mitarbeitenden und in der Steuerung von externen Dienstleistern
Gute Kenntnisse der Applikation QRadar oder einer verleichbaren Lösung sowie im Requirements Engineering
Eine ITIL Foundation Zertifizierung sowie Erfahrungen mit Applikationen wie NXLog, SPLUNK und/oder Scrible wünschenswert
Sehr gute Kommunikationsfähigkeiten, ein analytisches Verständnis, eine eigenständige und verantwortungsbewusste Arbeitsweise sowie strategisches Denkvermögen
Fließende Deutsch- sowie gute Englischkenntnisse in Wort und Schrift, Bereitschaft zu Dienstreisen


Wir Bieten


Durch abwechslungsreiche und gesellschaftlich relevante Aufgaben gewährleisten wir die IT-Sicherheit und Zukunftsfähigkeit Deutschlands
Sie erwartet ein angenehmes Arbeitsumfeld, ein wertschätzender Umgang miteinander und großer Teamgeist
Die BWI bietet eine marktgerechte Vergütung, einen sicheren Arbeitsplatz sowie eine prämierte und arbeitgeberfinanzierte betriebliche Altersvorsorge
Sie starten grundsätzlich mit 30 Tagen Jahresurlaub mit Option auf individuelle Anpassungen
Wir ermöglichen Ihnen Flexibilität, um Beruf und Privatleben in Einklang zu bringen
Show more "
