title,company,location,date,link,description
AI Engineer,Rhesis AI,Germany,2024-08-16,https://de.linkedin.com/jobs/view/ai-engineer-at-rhesis-ai-4002488653?position=1&pageNum=0&refId=wgVpWc9WVZuwd9nTfXNSIg%3D%3D&trackingId=kOO9t3MWReUmzn3HCEHgtg%3D%3D&trk=public_jobs_jserp-result_search-card,"Welcome to Rhesis AI, where we're passionate about making AI responsible. Our goal is to empower organizations with the right tools to navigate the complexities of AI and ensure their AI applications meet the highest standards of robustness, reliability and compliance. For this, we are developing a Continous Automated Assurance Solution.

To achieve our mission in which AI serves humanity responsibly, we need you!

Tasks

What you will do:


Oversee and/or execute the design, development, fine-tuning, and deployment of large language models and generative AI systems for the Rhesis AI platform.
Implement MLOps/LLMOps best practices to streamline the machine learning lifecycle from data ingestion to model deployment and continuous improvement.
Drive research and development to replicate state-of-the-art ML models and papers, as well as carry out independent research efforts (yes, you can publish!).
Architect and optimize near-real-time and real-time data pipelines for efficient data processing.
Collaborate with cross-functional teams to integrate AI solutions into existing systems and processes.
Stay updated on the latest advancements in AI, ML, and NLP to inform strategic decision-making and product innovation.
Lead research efforts to ensure compliance with regulatory requirements and ethical standards in AI development and deployment.



Requirements

You are great for this role, if you have:

Important Skills


Hands-on experience with Large Language Models and Generative AI
Strong background in Python programming, ML frameworks (JAX, PyTorch, TensorFlow, HuggingFace Transformers, Scikit-Learn), and MLOps expertise.
Knowledge of ML fundamentals and software engineering best practices, such as testing.
Experience in the development of robust, production-ready code.
Proficiency in CI/CD, DevOps pipelines, and containerization.
Experience in Natural Language Processing.



Awesome Skills


Experience with research, development and/or replication of state-of-the-art ML models / papers
Experience with infrastructure automation (e.g., Infrastructure as Code).
Building near-real-time and real-time data pipelines (e.g. using Spark and/or Databricks)
Knowledge of cloud-native solutions (GCP, Azure, AWS)
Building and fine-tuning deep learning models for deployment and inference



Overall Skills


Solid software engineering skills with the ability to design sophisticated software systems, curate datasets, and train models for scientific applications.
Proficiency in Python programming and developing production-ready code for data-driven applications.
Expertise in system design and problem-solving, including the ability to decompose complex problems into simpler solutions.
Familiarity with modern development practices and tools such as version control, CI/CD, containerization, and cloud-native solutions (e.g., Azure or AWS).
Experience in building real-time data pipelines, natural language processing, container-based development, and infrastructure automation.
Previous roles as a Senior Machine Learning Engineer with MLOps experience, optimizing and deploying deep learning models.



In summary, the candidate should have a strong background in both machine learning and software engineering, with specific expertise in developing and deploying advanced machine learning models, along with a solid understanding of modern development practices and tools.

Benefits

As part of our commitment to supporting our team members, we offer a range of benefits to applicants, including:


Comprehensive compensation package including shares: We offer salaries and benefits tailored to your experience and qualifications, along with the opportunity to gain ownership in the company.
Professional development opportunities: We offer resources and support for ongoing learning and career growth, including access to training programs, workshops, and conferences.
Flexible work arrangements: We understand the importance of work-life balance and offer flexible working arrangements to accommodate personal needs and preferences.
Social and community engagement: We encourage our employees to get involved in social and community initiatives.
A supportive and collaborative work environment: We foster a culture of teamwork, collaboration, and mutual respect, where every team member is valued and supported in their professional and personal growth.



We welcome applicants from all backgrounds, irrespective of gender, nationality, religion, or any other personal characteristic. Our organization values diversity and inclusion, and we encourage individuals from all walks of life to apply for this position. Even if you believe you may not meet all the listed requirements, we encourage you to submit your application. We believe that diverse perspectives enrich our team and contribute to our collective success. Your unique skills, experiences, and perspectives are highly valued, and we look forward to considering your application.
Show more "
Solution Data Architect,GMV,Germany,2024-08-27,https://de.linkedin.com/jobs/view/solution-data-architect-at-gmv-4009400634?position=2&pageNum=0&refId=wgVpWc9WVZuwd9nTfXNSIg%3D%3D&trackingId=BCz9oW3GQq2Vvia8vlOc6w%3D%3D&trk=public_jobs_jserp-result_search-card,"If the washing machine program is the only one you can’t figure out.... Your place is with us!

We are expanding our teams in the Technology sector to take on Big Data & AI projects.

We'll get to the point; we'll tell you what's not on the web. If you want to know more about us go to GMV website.

WHAT CHALLENGE WILL YOU BE TAKING ON?

In our team you will design and developdata architectures for new projects. Your main tasks will be:


Work with cross-functional teams to support the integration of various data sources, including structured and unstructured data.
Develop, deploy and optimize data pipelines for machine learning models and analytics.
Preparation, configuration and administration of development environments (on-premises and Cloud).
Evaluation of tools and technologies in PoC projects
Participation in the design and development of AI and data-driven applications.
Participation in proposal preparation and presales activities.


WHAT DO WE NEED IN OUR TEAM?

We are looking for Master’s engineers in Computer Science, Information Technology, Data Science, with experience on:


Unix/Linux environments including networking, storage, user management and security.
Containerization and orchestration (e.g. Docker and Kubernetes).
LLM development ecosystems, reference architectures, requirements.
Very good Python skills
Cloud platforms (e.g., AWS, Azure, GCP)
Familiarity with data modelling, ETL/ELT processes, and SQL/NoSQL databases


We will also value previous experience, and knowledge in DevOps, MLOps, and LLMOPs practices. German and/or Spanish skills are also a plus!

WHAT DO WE OFFER?

🕑 Hybrid working model and 8 weeks per year of teleworking outside your usual geographical area.

💻 Flexible start and finish times, and intensive working hours Fridays and in summer.

🚀 Personalized career plan development, training and language learning support.

🌍 National and international mobility. Do you come from another country? We can offer you a relocation package.

💰 Competitive compensation with ongoing reviews, flexible compensation and discount on brands.

💪Wellbeing program: Health, dental and accident insurance; free fruit and coffee, physical, mental and financialhealth training, and much more!

⚠️ In our recruitment processes you will always have telephone and personal contact, face-to-face or online, with our talent acquisition team. In addition, bank transfers and bank cards will never be requested. If you are contacted through any other process, please write to our team at privacy@gmv.com

❤️We promote equal opportunities in recruitment, and we are committed to inclusion and diversity.

WHAT ARE YOU WAITING FOR? JOIN US

If you have any questions please do not hesitate to contact Pablo Durán Álvarez, in charge of this vacancy.

Pablo Durán Álvarez


Show more "
Senior Data Scientist / LLM Engineer,akirolabs,Germany,2024-08-08,https://de.linkedin.com/jobs/view/senior-data-scientist-llm-engineer-at-akirolabs-3994698829?position=3&pageNum=0&refId=wgVpWc9WVZuwd9nTfXNSIg%3D%3D&trackingId=vd2dZqhEGJdCs09wJvDA8g%3D%3D&trk=public_jobs_jserp-result_search-card,"Company Description




akirolabs is an award-winning AI-powered B2B ProcureTech SaaS designed to elevate procurement from a tactical function to a strategic business partner orchestrating value chains. Our cutting-edge solution enables the development of procurement strategies, providing a ready-to-use framework that organizations can adapt to their unique needs and contexts. 




Having won many prestigious awards and recognitions, akirolabs is a recognized leader in the AI-driven procurement technology landscape. Some of our recent accolades include being named as the top 27 AI startup in Germany, shortlisted for the prestigious World Procurement Awards 2023 in the Procurement Technology Provider category, being named as one of the top 10 procure tech startups in the Digital Procurement world in 2022 and receiving the title of Gartner Cool Vendor 2022™ in Sourcing and Procurement Technology.




Our corporate culture and values can be found here https://akirolabs.com/company/our-vision/.




Job Description




Drive AI/DS/ML initiatives across an organization and take ownership of the entire ML lifecycle, from concept to delivery
Continue AI/ML development for our SaaS product with a passion for well-architected, secure, testable and documented code as well as scalable system design
You are a self-starter who identifies relevant research in the procurement area and subsequently integrates this knowledge into our product by conducting experiments and devising solutions for creating chatbots, forecasts and decision support systems 
Utilize your software engineering expertise and business acumen to build, scale and maintain our ML services, managing all phases of technology development
Create, and maintain high-quality datasets and implement data pipelines for processing procurement data
Collaborate with our cross-functional teams of software engineers implementing disruptive change in the procurement industry
Stay up-to-date with the latest advancements in AI/ML technologies and best practices, and proactively contribute ideas for continuous improvement
Learn, share knowledge and participate in further building of our Data Science team




Qualifications




University degree (PhD preferred) in a relevant field of study like Artificial intelligence, Machine Learning, Deep Learning, Data Science, Data Engineering, Statistics, Computer Science, Engineering
Strong knowledge of Machine Learning and generative models with understanding of computational constraints and data privacy considerations
5+ years of overall commercial experience in Data Science
3+ years of commercial experience with NLP / LLM including prompt engineering, training, fine-tuning, RAG, evaluation, transfer learning techniques
Knowledge of Data Analyze/Processing, Data Visualization and Storages (Databases, Data Lakes, Data Warehouses)
Champion best coding practices, documentation, reviews, data quality and security, and performance with proficiency in Python ecosystem and a strong grasp of popular ML libraries and frameworks, including LLM-oriented
Experience with Infrastructure (MLOps/LLMOps, AWS/GCP Clouds, SQL, REST APIs, GitHub) and managing end-to-end ML pipelines would be a big plus
Relevant experience in software development and familiarity with our tech stack (React and Java) would be a plus
Good English in speaking and writing, communication skills that are clear, open and professional




Additional Information




Be part of a recognised leader in AI-driven procurement technology startup, creating innovative services that have a substantial impact on the lives of our enterprise customers
Remote-first – work where you work best (within Berlin or the area), whether from home or in a hybrid/onsite mode from our office in a great location in Berlin
You have a unique chance to join the team an early stage and make your valued input in engineering excellence. Working in an international team and context
Business trips within Europe might be expected on demand (once per quarter in average)
Team building company events




Equal Opportunities




akirolabs is an Equal Opportunity Employer and Prohibits Discrimination and Harassment of Any Kind: akirolabs is committed to the principle of equal employment opportunity for all employees and to providing employees with a work environment free of discrimination and harassment. All employment decisions at akirolabs are based on business needs, job requirements and individual qualifications, without regard to race, colour, religion or belief, […], family or parental status, or any other status protected by the laws or regulations in the locations where we operate. akirolabs will not tolerate discrimination or harassment based on any of these characteristics. We encourage applicants of all ages.




Our privacy policy https://akirolabs.com/datenschutz/

Show more "
Responsible AI - Technology Architecture Senior Manager,Accenture DACH,Germany,2024-08-29,https://de.linkedin.com/jobs/view/responsible-ai-technology-architecture-senior-manager-at-accenture-dach-3969870006?position=4&pageNum=0&refId=wgVpWc9WVZuwd9nTfXNSIg%3D%3D&trackingId=xzXgMFWVK4ie5bnyCfllcA%3D%3D&trk=public_jobs_jserp-result_search-card,"We are:

Accenture’s Global Responsible AI team within the Global Data & AI Practice. AI is becoming more pervasive, more powerful, and more accessible. With these new opportunities come increased risks. We work with leading organizations to ensure AI is designed, built, and deployed in a manner that engenders trust and adheres to laws, regulations and ethical norms. Our Responsible AI strategy will enable us to embed responsibility into all of Accenture’s data and AI activities. We’re developing and deploying differentiated IP and Responsible AI solutions with our ecosystem partners. We’ll be engaging regulators to help shape the policy agenda, conducting pioneering research with academia and offer training and resources to our clients through the Responsible AI Academy. The risks of AI are real and well-known. Let’s help our clients turn those risks into opportunities.

You are:

We’re looking to grow our Responsible AI team and if you’re experienced in Monitoring & Compliance with a Responsible AI background, we’d love to hear from you.

As a Responsible AI Monitoring & Compliance professional, you’ll be experienced in ensuring that AI systems are developed, implemented, and maintained in a way that mitigates risks associated with AI. But you’ll also have at least a year’s experience looking at responsible aspects such as AI model Fairness, Transparency, Explainability, Robustness, Soundness and Privacy – preferably gained in a client-facing environment (if in the markets. Review if ATCi).

You’ll bring diverse expertise in monitoring AI systems, machine learning model risk management, and applying regulatory requirements to frameworks and technical tools. You’ll be an outstanding technical specialist with the strong communication skills needed to liaise with your clients and your colleagues.

At the forefront of the industry, you’ll help make our Responsible AI vision a reality for clients looking to better serve their customers and operate always-on enterprises. We’re not just focused on increasing revenues – our technologies and innovations are making millions of lives easier and more comfortable. But above all, we’re doing this responsibly and inclusively – to make sure AI technology is used equitably and in a way that is both ethically and technically sound.

The work:

You’ll be a key player helping to deliver outstanding work for our Responsible AI clients. Some of the areas you’ll be working in include:



Leading the architecture and design of ethical AI systems, ensuring compliance with relevant regulations, organizational policies using the required tools and technologies. Supporting client sales conversations and proposal preparation


Collaborating with cross-functional teams to design the integrations with existing data & AI platforms and workflows on cloud.


Designing, and guiding the team on best practices and architectural guidelines for AI model development, testing, deployment, and monitoring; including helping define, build and roll out our internal Responsible AI tools and assets.


Architecting the regular audits of AI systems to identify and mitigate biases, ensuring fairness and transparency.


Spearheading Responsible AI related technology thought leadership and PoV, staying abreast of emerging technologies.


Providing technical leadership and mentorship to AI development teams, & development and delivery of Responsible AI technical training.


Facilitating communication between technical and non-technical stakeholders regarding AI projects and their impact.


Supporting the evaluation of third-party Responsible AI tools and frameworks


Architecting and solutioning AI project lifecycle - from conception through to deployment and maintenance.



Travel may be required for this role. The amount of travel will vary from 0 to 100% depending on business need and client requirements.

Here’s What You Need:



Bachelor’s or Master’s degree in Computer Science, Artificial Intelligence, Data Science, or related technical fields.


Manager experience: 6-8 years


Senior Manager: 8-10 years


Architectural experience with cloud platforms (e.g., AWS, Azure, Google Cloud) and their AI services


Proficiency in AI and machine learning algorithms and frameworks (e.g., TensorFlow, PyTorch).


Strong programming skills in languages such as Python, R, or Java.


Experience with big data technologies (e.g., Hadoop, Spark) and database management systems.


Specific technology domain areas experience in at least one of: software development, cloud computing, systems engineering, data & analytics.


Knowledge of ethical AI principles, data privacy laws, and regulatory requirements.


Proven track record in leading and delivering complex AI projects.


Experience in implementing AI solutions in large-scale, enterprise environments.


Strong leadership and team management skills.


Excellent problem-solving and analytical abilities.


Effective communication skills, capable of conveying complex AI concepts to diverse audiences.


Commitment to ethical AI practices and continuous learning.


Ability to work under pressure and manage multiple projects simultaneously.



Bonus Points If You Have:



Additional courses or training in areas related to responsible AI, ethics in technology, or similar fields are beneficial.


Certifications in AI, machine learning, or related fields.


Experience with Data & AI in specific domains (e.g., healthcare, finance, retail).


Familiarity with AI model explainability and interpretability tools.


Understanding of MLOps, LLMOps and DevOps practices, including CI/CD pipelines, for AI systems.


Containerization capabilities such as Docker and Kubernetes.


Linguistic proficiency (to a reasonable business level) in a language other than English



Show more "
