title,company,location,date,link,description
Sr Hardware Design Verification Engineer,YO HR Consultancy,New zealand,2024-08-29,https://nz.linkedin.com/jobs/view/sr-hardware-design-verification-engineer-at-yo-hr-consultancy-4011047987?position=47&pageNum=0&refId=VVKOpBjq8Vwkr2RLBk%2FXoQ%3D%3D&trackingId=3qaPnC6fg0%2BtfQthZY5N0g%3D%3D&trk=public_jobs_jserp-result_search-card,"Hardware Design Developer

Experience: 3 - 25 Years

Location: - Permanent Remote anywhere in the World

Contract Length: 6 Months

Full time contract(8 hrs/day)

Project timing: UTC-8:00 America/Los_Angeles

Overlap Hours: 4 hrs/day with PST

Must-Have


BS or MS degree in Electrical, Engineering, or related field.
3-5 years of proven experience in hardware design development.
Expertise in HDLs such as Verilog, SystemVerilog, VHDL, and SystemC.
Expertise in scripting, front-end and verification workflows, and integrations within the hardware design environment.
Expertise in UVM environments
Expertise in Formal Verification
Expertise in Lint process and refinement
Good communication skills in English


Job Description

We're searching for an exceptional hardware design Developer to play a pivotal role in using the hardware design platform to generate the training data to enhance enterprise LLMs' capabilities. This unique position offers the chance to directly contribute to the sophistication of enterprise LLMs, ensuring they operate with unparalleled efficiency and intelligence.

Your Mission


Develop, configure, and customize the hardware design platform, utilizing it to generate vital training data for enterprise LLMs.
Liaise with research teams to translate requirements into actionable data insights, directly impacting our LLMs' performance.
Uphold the highest standards in coding, debugging, and documentation, ensuring the hardware design solutions are optimized for LLM training and benchmarking.
Collaborate across teams to identify and prioritize needs, contributing to the LLMs' ability to understand and automate complex processes.


We Need


BS or MS degree in Electrical, Engineering, or related field.
3-5 years of proven experience in hardware design development.
Expertise in HDLs such as Verilog, SystemVerilog, VHDL, and SystemC.
Expertise in scripting, front-end and verification workflows, and integrations within the hardware design environment.
Exceptional problem-solving, communication, and collaborative skills.Familiarity with ML and AI systems


Skills: verification workflows,front-end and verification workflows,hdls,vhdl,front-end development,integration within hardware design environment,ml,verilog,uvm,design,hardware design,lint,systemc,electronics hardware design,english communication,coding,debugging,hardware design development,refinement,ai systems,communication skills,hdl,scripting,lint process,english communication skills,electrical engineering,communication,documentation,uvm environments,problem-solving,integrations,formal verification,ai,verilog-a,systemverilog,collaborative skills,collaboration,front-end,integration
Show more "
Technical Product Owner,dataengine,New zealand,2024-08-22,https://nz.linkedin.com/jobs/view/technical-product-owner-at-dataengine-4003635987?position=48&pageNum=0&refId=VVKOpBjq8Vwkr2RLBk%2FXoQ%3D%3D&trackingId=Izzj4h5dmDrqLbjneVsWqA%3D%3D&trk=public_jobs_jserp-result_search-card,"Dataengine is a New Zealand-based leader in data solutions, empowering businesses to unlock the hidden value within their data and achieve true transformation. We connect people, processes, and technology for optimised efficiency and sustainable impact. Founded in 2018, we've grown rapidly thanks to our exceptional team and commitment to delivering practical, impactful results.




We're currently seeking a highly skilled and motivated technical product owner / project manager to play a pivotal role in leading and delivering our data and AI solutions for our clients.




You will be responsible for managing the project scope, budget, timeline, and quality as well as defining the product vision, roadmap, and backlog. You will be a highly collaborative person, who can easily work alongside our technical team, client stakeholders and the end users to ensure the alignment of the product with the business needs and expectations.




What You Will Do:

Project Planning: Develop comprehensive project plans, including scope definition, work breakdown structures, resource allocation, and timelines.
Project Execution: Oversee project execution, ensuring that tasks are completed on time, within budget, and according to quality standards.
Risk Management: Identify, assess, and mitigate project risks to minimize their impact on project success.
Stakeholder Management: Build and maintain positive relationships with clients, team members, and other stakeholders, effectively managing their expectations.
Team Leadership: Lead and motivate project teams, providing guidance, support, and coaching to ensure optimal performance.
Budget Management: Monitor and control project budgets, ensuring that costs are aligned with project objectives.
Quality Assurance: Implement quality assurance measures to ensure that project deliverables meet or exceed client requirements.
Reporting: Prepare regular project status reports, providing updates on project progress, risks, and issues.
Continuous Improvement: Identify opportunities for process improvement and implement changes to enhance project efficiency and effectiveness.
Product Ownership: Define the product vision and strategy, ensuring that it aligns with the client's business objectives; Create and maintain the product backlog, prioritizing features and user stories based on business value; Collaborate with stakeholders to gather and refine product requirements.
Represent the voice of the customer and ensure that the product meets their needs;
Work closely with the development team to ensure that the product is delivered on time, within budget, and to high quality standards.
Client Relationship Management: Build and maintain strong relationships with clients, acting as a trusted advisor and advocate; Proactively address client concerns and ensure their needs are met throughout the project lifecycle; Facilitate effective communication between clients, internal teams, and external stakeholders.
Team Leadership: Lead and motivate project teams, providing guidance and support to ensure optimal performance; Foster a collaborative and positive team environment.




About You:

Bachelor's degree in computer science, engineering, business, or related field.
Minimum of 3 years of experience in project management and product ownership in data and AI domain.
Strong knowledge and skills in agile methodologies, tools, and best practices.
Excellent communication, presentation, and stakeholder management skills.
Ability to work independently and as part of a team in a fast-paced and dynamic environment
Experience in data analysis, data visualisation, machine learning, or natural language processing is a plus.
Must be based in Auckland and willing to travel for customer meetings.







Here’s a Taste of What’s on Offer at dataengine:

Opportunity to solve real-world business problems.
Collaborative and supportive work environment.
Competitive salary.
Be at the forefront of data science innovation in a dynamic startup environment.
Work on a variety of challenging and impactful projects across different industries.
Opportunity to learn and grow your skillset with the latest technologies.
Continuous learning and development opportunities.
Weekly fresh fruit, snacks, monthly industry led lunches and active staff activities.
Be part of a company that is shaping the future of data-driven solutions.




If you are a passionate and talented technical product owner / project manager who is excited about making a real impact, we encourage you to apply!

Show more "
Analytics Lead - Next Gen Tool,Woolworths Group,New zealand,2024-08-15,https://nz.linkedin.com/jobs/view/analytics-lead-next-gen-tool-at-woolworths-group-4000168153?position=49&pageNum=0&refId=VVKOpBjq8Vwkr2RLBk%2FXoQ%3D%3D&trackingId=38nK9Xuy9yaVghIJ4xG9Wg%3D%3D&trk=public_jobs_jserp-result_search-card,"We are Woolworths Group
We are Woolworths Group. 200,000+ bright minds, passionate hearts, and unique perspectives across Australia and New Zealand. Connected by a shared Purpose - 'to create better experiences together for a better tomorrow'. That Purpose fuels our ambition to explore new ideas, make brave commitments, and innovate better ways to meet the food and everyday needs of more than 24 million customers every week.

If you're excited to turn today's blue-sky thinking into a better tomorrow for future generations, you'll find yourself supported and enriched in a dynamic, inclusive, and empowering workplace. With a culture of genuine care, a flexible approach to work, and opportunities across the group to grow your career and make a meaningful impact, the possibilities for what we can achieve together are endless.

Welcome to WIQ
We strive to create better experiences together for a better tomorrow for our customers and team, bringing the best of Woolworths Group and Quantium together to make data driven decisions. By partnering with Quantium, a world-class data science and advanced analytics business we’re excited about the future as we unlock the power of data to reimagine retail.

Through this partnership, we’ve created a new business called wiq who will harness the best of Woolworths Group and Quantium to reimagine retail by solving the most complex problems using data and analytics. As a team, we leverage Agile ways of working to help our team develop their skills while also making sure our team is focusing on solving the most complex problems for both our customers and team.

What You'll Do

The purpose of the wiqNZ team is to unlock the power of data to imagine retail, which contributes to making Kiwis’ lives a little better every day. We're seeking a highly technical and commercially-minded Analytics Lead to drive the progress of our Next Gen tools as they become an ongoing and highly valuable feature of our commercial operations. As a key member of the wiqNZ team, you will work closely with the WWNZ Commercial leadership team, as well as wiq (analytics) leads globally (AU and India). You'll harness your advanced Excel, SQL and Python expertise to empower a squad of technical analysts to deliver high-impact analytical solutions.

As the Analytics Lead, you will be managing the day to day workload of a highly technical analytics delivery squad. You are responsible for the delivery of all projects across the squad, the execution of BAU Analytics as well as ensuring urgent and important requests are responded to in a timely manner.


Oversee data pipeline refreshes and implement minor continuous improvement updates using DBT.
Maintain and enhance our business-facing toolkits (Excel front-end, SQL/Python backend), including daily and ongoing tool updates / releases.
Refresh and manage tool outcome / benefits trackers to ensure accurate and up-to-date information.
Debug and resolve tooling issues, making strategic decisions on implementing hot fixes versus longer-term solutions.
Monitor the tool inboxes, respond to and triage business stakeholder queries and communicate tool updates to the business
Raise data-related concerns with data governance and data teams to ensure data quality and integrity.


What You'll Bring

You can think creatively, critically and thrive in a fast-paced, dynamic culture. Your stakeholder management skills are exceptional and you don't shy away from conversations with senior business leaders. Your mature and likeable demeanour will allow you to influence, guide, and deliver the direction to the team. You will bring a wealth of experience working in analytics, ideally you have experience working in an agile environment and be able to demonstrate your strong leadership skills. You will have strong experience in delivering analytics projects and initiatives.

You will have a relevant tertiary degree and be looking to take a step up to a leadership position. Ideally you will be familiar with JIRA, Confluence and Project Management tools.

This is an opportunity to make your mark as an inspiring coach influencing at the highest levels. If you take joy in the success of others and bring to life the world of data science, you will love this role!
What You’ll Experience

Our Team Members are at the heart of everything we do and we’re always looking for ways to support your career journey and reward great work:

A progressive and flexible ‘work from anywhere’ policy that gives you more control over your work, life and wellbeing.
Team discounts across our range of Woolworths Group brands you know and love and a robust rewards program that celebrates and incentivises purpose-driven work.
Exposure to senior business leaders and valuable experience to grow your career in surprising ways.
A range of programs to help you prioritise and manage your wellbeing, including 24/7 access to the Sonder app.
A progressive and competitive leave policy that gives you more space for what matters to you.


Everyone belongs at Woolworths Group
Diversity, equity, inclusion, and belonging are key to realising our purpose of better together for a better tomorrow. We recognise the value our team’s diversity brings to our business, customers, and communities and that teams with diverse experiences and backgrounds enrich our group and are better able to innovate and solve problems. As one of the largest employers in Australia and New Zealand, we aim to create a truly inclusive workplace where everyone feels that they belong, can be their best selves, and reach their full potential.

We encourage all candidates to apply; please let us know in your application if we can support you with any adjustments in the hiring process.
Show more "
Staff Python Infrastructure Engineer - Remote across ANZ,Canva,New zealand,2024-08-19,https://nz.linkedin.com/jobs/view/staff-python-infrastructure-engineer-remote-across-anz-at-canva-4004562960?position=50&pageNum=0&refId=VVKOpBjq8Vwkr2RLBk%2FXoQ%3D%3D&trackingId=ssHS%2FdRzqqdzNOvglna9pA%3D%3D&trk=public_jobs_jserp-result_search-card,"Job Description

Join the team redefining how the world experiences design.

Hey, g'day, mabuhay, kia ora, 你好, hallo, vítejte!

Thanks for stopping by. We know job hunting can be a little time consuming and you're probably keen to find out what's on offer, so we'll get straight to the point.

Where And How You Can Work

Our flagship campus is in Sydney. We also have a campus in Melbourne and co-working spaces in Brisbane, Perth and Adelaide. But you have choice in where and how you work, we trust our Canvanauts to choose the balance that empowers them and their team to achieve their goals.

What You’d Be Doing In This Role

As Canva scales change continues to be part of our DNA. But we like to think that's all part of the fun. So this will give you the flavour of the type of things you'll be working on when you start, but this will likely evolve.

At The Moment, This Role Is Focused On


Shaping the crucial ML and Python specialty roadmap for the group, leveraging a strong product/platform mindset. Your role will be pivotal in defining the investment needed to elevate Python support and close the existing capability gaps.
Architecting, building and delivering solutions to improve the Python and ML engineering experience at Canva, ensuring high standards of engineering excellence.
Developing advanced tooling and metrics to enable both our team and platform users to understand and respond to the health of our systems.
Developing and maintaining comprehensive documentation, establishing best practices and guidelines for Python and ML engineering.
Mentoring and guiding other engineers, playing a key role in their professional growth and development, fostering a culture of continuous learning and development.
Influencing and advocating for engineering best practices across the organization, ensuring alignment with Canva’s long-term strategic goals.
Leading solution design meetings, participating in hiring interviews, and code reviews.



You're probably a match if


You have demonstrated leadership and ownership over complex, high-impact problems and their solutions, with a strong sense of accountability.
You're passionate about engineering excellence, systems architecture, and meeting non-functional requirements.
You have a proven track record of fostering team collaboration and driving collective success through shared challenges and goals.
You have deep expertise in Python development is essential, with experience in modern development tools such as Bazel or Nix being a plus.
You have extensive experience with containerization, Terraform, and GitOps principles for automation and deployment.
You have a strong background in ML concepts and applications, with a proven ability to integrate ML capabilities into existing infrastructure, and in-depth knowledge of MLOps best practices.
You're proficient with ML frameworks such as pandas, NumPy, PyTorch, Ray, and TensorRT is highly desirable. Hands-on experience with CUDA as a platform operator is a significant advantage.
You have a proven track record of leading and executing large-scale engineering projects, showcasing an ability to handle increased scope and complexity compared to a similar senior role.



About The Team

You'll be joining the Language Ecosystem team, whose mission is to uplift language and ecosystem support across Developer Platform products. Working directly with teams across the group, your role will focus on enhancing support for specific language-related workflows and delivering solutions that eliminate capability gaps.

As Canva continues to invest in ML, there is a growing need to bridge the gap between the experience of our ML Engineers and that of our frontend and backend engineers. Python is the language of choice in the AI/ML space. However, our current developer experience has been primarily focused on TypeScript (frontend) and Java (backend), leading to challenges with Python support. Currently, the AI Platform teams have built some key capabilities, but further investment in Platform Engineering teams is required to elevate Python support to be on par with Java and TypeScript. This investment will enable AI Platform to concentrate on AI-specific capabilities while the Platform Engineering teams enhance the overall Python experience.

The ML Parity program outlines a staged approach to incrementally invest in Python-based ML-serving technologies, empowering our ML engineers and applied scientists to leverage all Canva platforms effectively. This role is essential in driving this transition and ensuring Python becomes a first-class citizen at Canva.

As a Python Specialist on the Language Ecosystem team, you'll:


Lead and own collaborations with engineers across the organization to understand their requirements and design platform infrastructure solutions with a strong emphasis on Python.
Partner with Developer Platform product managers and leadership to define and drive strategic priorities and the roadmap for ML and Python-related initiatives within the team.
Take full ownership of high-impact projects aimed at uplifting the Python and ML local development experience, ensuring timely and effective delivery.
Spearhead innovation in Python and ML engineering practices and development experience, setting the standard for a unified and resilient infrastructure.
Serve as the primary point of contact for Python-related inquiries and challenges within the Developer Platform team, providing expert guidance and solutions.



What's in it for you?

Achieving our crazy big goals motivates us to work hard - and we do - but you'll experience lots of moments of magic, connectivity and fun woven throughout life at Canva, too. We also offer a range of benefits to set you up for every success in and outside of work.

Here's a Taste Of What's On Offer


Equity packages - we want our success to be yours too
Inclusive parental leave policy that supports all parents & carers
An annual Vibe & Thrive allowance to support your wellbeing, social connection, office setup & more
Flexible leave options that empower you to be a force for good, take time to recharge and supports you personally



Check out lifeatcanva.com for more info.

Other Stuff To Know

We make hiring decisions based on your experience, skills and passion, as well as how you can enhance Canva and our culture. When you apply, please tell us the pronouns you use and any reasonable adjustments you may need during the interview process.

We celebrate all types of skills and backgrounds at Canva so even if you don’t feel like your skills quite match what’s listed above - we still want to hear from you!

Please note that interviews are conducted virtually.
Show more "
Senior Data Engineer,UP Education,New zealand,2024-08-30,https://nz.linkedin.com/jobs/view/senior-data-engineer-at-up-education-4011297104?position=51&pageNum=0&refId=VVKOpBjq8Vwkr2RLBk%2FXoQ%3D%3D&trackingId=kGBCglXOfDrrHC4Mz32FPA%3D%3D&trk=public_jobs_jserp-result_search-card,"Are you a data wizard with a passion for AI? We’re on the hunt for a Senior Data Engineer to join our cutting-edge tech team and revolutionise the education experience across New Zealand and Australia!

We are seeking an experienced and highly skilled Senior Data Engineer to join our dynamic technology team, with a focus on building a data environment that supports our business to deliver the best education experience in New Zealand and Australia. This role is pivotal in driving the architecture, development, and maintenance of our data infrastructure in a Microsoft-based environment, ensuring it is robust, scalable, and fit for AI-driven initiatives. As a Lead Data Engineer, you will work closely with various stakeholders to ensure data is effectively managed, accessible, and optimized for advanced analytics and AI development. This position requires a combination of strong technical expertise, leadership abilities, and a strategic mindset to contribute to the organisation's data and AI-driven objectives.

💡 What You'll Do


Architect and build robust, scalable data environments using Microsoft Azure
Lead the charge in creating data pipelines that power AI and advanced analytics
Oversee database performance, ensuring top-tier reporting and AI efficiency
Mentor a dynamic data team and collaborate with stakeholders
Drive continuous improvement in data processes and stay ahead of emerging trends


🎯 What You Bring


5+ years of data engineering experience, with 2+ years in a leadership role
Expertise in Microsoft Azure and SQL Server
Proven skills in ETL/ELT, data warehousing
Strong leadership, problem-solving, and communication abilities
Microsoft certifications? Big plus!


Why work with us?


Great hands-on opportunity with people leadership elements
Lovely Ponsonby office, with some flexibility to work from home.
Fantastic opportunity to be part of an energising team and growing company


Ready to make a real impact? Join us in shaping the future of education with data-driven innovation. Apply now! 🌟

Who are we?

In a world where change happens faster with each new day, education forges pathways for the future. At UP Education, we are on a mission: to elevate and empower people to unlock their potential. Known for our agility, and responsiveness to the changing world, UP Education has launched a proprietary online learning platform to meet the growing needs of borderless education.

We believe learning should be defined by the exceptional and at UP Education we have an ongoing commitment to the development of our staff.

Alongside our online services we also have 30+ campuses in 10 locations across Australasia ensuring widespread accessibility to education for our learners.

To find out more about us, please visit https://www.up.education/

Questions about your identity help us appreciate the diversity of individuals looking to work at UP Education, ensuring we’re attracting applications from people with identities and perspectives that are as diverse as our students.

We are an equal opportunity employer. As part of our commitment to equity, we work to ensure a fair and consistent interview process. We celebrate diversity and we are committed to an inclusive work environment.
Show more "
