title,company,location,date,link,description
Senior Software Engineer,Marigold,New zealand,2024-08-31,https://nz.linkedin.com/jobs/view/senior-software-engineer-at-marigold-3976162436?position=25&pageNum=0&refId=L%2BA%2FtUmIqgPWyJH4DosoRg%3D%3D&trackingId=kUJZ5fl3lSKqJXo7pjhkiA%3D%3D&trk=public_jobs_jserp-result_search-card,"Marigold helps brands foster customer relationships through the science and art of connection. Marigold Relationship Marketing is a suite of world-class martech solutions that help marketers create long term customer love and loyalty. Marigold’s products address the Messaging, Loyalty and Experiences marketing offerings, to a customer base that is categorized in three segments: Enterprise, Professional and Commercial. Marigold provides the most comprehensive set of use cases for Marketers at any level. Headquartered in Nashville, TN, Marigold has offices globally across the United States, Europe, Australia, New Zealand, Malaysia, India, South America and Central America, as well as in Japan.

The Role

We're looking for a skilled Senior Software Engineer with polyglot across projects building software at scale. As you’ll be joining a Data Engineering team, we’re hoping to see a breath of experience in Python.

You should have a solid grasp of software testing principles, and particularly strong database skills. Some familiarity with frontend technologies and containerisation (Docker, Kubernetes) is a plus. This role involves collaboration with product , design and other teams, owning the stack, and participating in an on-call rotation.

While working a standard NZ day, you’ll enjoy the benefits of working with an international team which follows the sun. You'll also get to collaborate with a Principal and Product Owners in the US.

The Data Engineering team is dedicated to empowering customers to make informed decisions about their marketing strategies through intuitive and reliable access to data. As a Senior Software Engineer at Sailthru, you'll be pivotal in steering data-driven decision-making processes across various departments, and shaping a modern data architecture. Responsibilities include analyzing extensive datasets, crafting data models, implementing ETL and ELT flows, and working on capabilities that deliver insights to stakeholders.

Responsibilities


Develop and engineer Java and Python services in a distributed architecture.
Collaborate with teams to design, implement, and deploy highly scalable solutions.
Write and maintain comprehensive unit and integration tests for the software you produce.
Develop and maintain software engineered in Python (and/or Java) integrating with databases such as Databricks, MongoDB, and Postgres.
Confidence in debugging flows across a complex environment; including troubleshooting eventing and ETL issues
Experience of debugging and tuning database queries and systems.
Be part of our regular on call rotation with the other team members.


Requirements

Whilst we do not expect you to have all of the following, we’re looking for an exceptional engineer who would tick most of these boxes:


Bachelor's degree in Computer Science or relevant experience.
5+ years proficiency at a high level in Python and at least one other programming language.
Experience with Object Oriented and Functional programming patterns.
Experience in working with Agile or Lean teams.
Experience with Git, software testing principles, and continuous integration.
Experience or familiarity with Docker and Kubernetes.
Experience developing software making integrating with both NoSQL and relational databases.
Experience with, or desire to learn, Airflow and DataBricks technologies to implement Spark jobs.
Exposure to working with event streaming or publish/subscribe technologies such as Kafka.
Excellent problem-solving and debugging skills, with the ability to solve hard problems in a collaborative environment.
A deep experience of working with AWS is desirable (EC2, S3, lambda, redshift).
EKS or other Kubernetes experience
Experience with observability tools (eg. ELK/OpenSearch, Grafana, Datadog, Cloudwatch, etc).
Familiarity with machine learning techniques and pipelines.
Strong knowledge of SQL


If you're enthusiastic about building scalable and resilient software solutions, come be a part of our pioneering Data Engineering team!
Show more "
Lecturer/ Senior Lecturer in Computer Graphics/Vision,University of Canterbury,New zealand,2024-08-12,https://nz.linkedin.com/jobs/view/lecturer-senior-lecturer-in-computer-graphics-vision-at-university-of-canterbury-3994011012?position=26&pageNum=0&refId=L%2BA%2FtUmIqgPWyJH4DosoRg%3D%3D&trackingId=g28OvXINXeS0p1CAtEuFLQ%3D%3D&trk=public_jobs_jserp-result_search-card,"Te Tari Pūhanga Pūmanawa Rorohiko | Department of Computer Science and Software Engineering

Located in Christchurch, New Zealand


Full-time at 37.5 hours per week (1.0 FTE)
Continuing (i.e. permanent) position


What You Will Do

We invite applications for a Lecturer/Senior Lecturer position (equivalent to Assistant Professor/Associate Professor in the US System) working in the area of Computer Graphics, Computer Vision or related fields. Exceptional candidates in other fields of computer science will be considered.

You will contribute to teaching in undergraduate and postgraduate subjects. You will develop a strong research programme, including supervising postgraduate students and seeking external research funding. You will also participate in departmental and university administration. The appointee will be expected to collaborate with other academics in the department, and to develop links with the wider computer science research community at local, national and international levels.

Who You Are

Applicants must hold a Ph.D. degree in Computer Science (or equivalent) and have a demonstrated record of published research in Computer Graphics, Computer Vision or a closely-aligned research field (such as algorithms, scientific visualization, and machine learning methods for graphics, vision, and/or multi-modal models). The successful candidate will have a commitment to excellence in teaching Graphics and related courses, and supervising research projects at both undergraduate and postgraduate levels.

At the University of Canterbury, we strive for inclusivity and diversity. We understand that some candidates may hesitate to apply unless they meet every criterion. Our hiring decisions strive to go beyond traditional qualifications and job experience. If you're interested in applying but unsure about meeting all requirements or need extra support, please inform us. We also encourage you to share your preferred pronouns at any stage of the recruitment process.

Who You Will Work With

The Department of Computer Science and Software Engineering is a strong and forward-looking department, dedicated to excellence in both research and teaching. We aspire to be a productive, dynamic, creative and inspiring community that maintains an inclusive, welcoming and supportive environment in which students and staff alike can flourish.

Our department is one of the largest at University of Canterbury, and one of the fastest growing in student numbers. We teach a diverse range of students from programmes across the University. We take care in supporting students in their learning and we are well resourced to help you with your teaching. Our teaching activities are highly collaborative, both within the Department and University wide. Our teaching teams are student-centred, proactive and feedback-seeking, and work in an open reflective cycle of design, deliver and review. Our diverse research interests and strong collaborative connections span many Departments across campus, and internationally.

Opportunities for collaboration within the Department are strong, with several research groups addressing fields relating to computer graphics, including deep learning, computer vision, immersive gaming, augmented reality, spatial interactive systems, and semi-autonomous robotic systems. There are also opportunities for collaboration with other groups across the University, including the Human Interface Technology Lab (HITLab, predominantly interested in AR/VR) and the School of Product Design (Applied Immersive Game Design), as well as the Southern Hemisphere's largest Digital Screen Campus, currently under development.

The opportunity is here now for you to help build the future of our department. For more information about our department and team, please visit our website.

Please take a virtual tour of our Engineering facilities.

Why UCUniversity of Canterbury is in Christchurch, the gateway to the South Island of New Zealand. Christchurch is a very desirable place to live. We have a lot of green space, great bike routes, and access to the sea and mountains (which you can see from our department building) all within one-hour drive from the city.

We Offer a Range Of Benefits


Relocation support
Onsite child care facilities
A unique bequest funded endowment (Erskine fund) that supports an extensive visiting Fellowship programme
Widely accessible sabbatical provision
University and Faculty scholarship support for graduate students
Generous annual leave provisions
Flexible working arrangements
Supportive working environment
Professional development opportunities
Living in Aotearoa New Zealand
A unique working environment in a beautiful campus with access to UC facilities. For more information, please visit: http://www.canterbury.ac.nz/joinus


The University of Canterbury is a leading university in New Zealand, with over 18,000 students. The university is committed to promoting world-class research and teaching excellence. We are also committed to accessible higher education, service to the community and the encouragement of talent without barriers of distance, wealth, class, gender or ethnicity. We produce graduates and support staff who are engaged with their communities, empowered to act for good and determined to make a difference in the world. We recognise our obligation under the Treaty of Waitangi | Te Tiriti o Waitangi and are committed to supporting Equity and Diversity, recognising that a sense of 'belonging' is an integral part of university life. At the University of Canterbury, we have a diverse, culture-rich, and cooperative environment with policies and practices that ensure all staff and students are given the opportunity and support to grow as individuals and as part of the wider community. Applications that promote our offering a diverse and inclusive workplace are especially encouraged.

Universities in New Zealand do not have a tenure system as compared to North American programmes and academic staff are continuing (i.e. permanent) employees upon appointment. Promotion to higher levels is based upon performance in all three keys areas: teaching, research and administrative responsibilities.

We are an Equal Employment Opportunities (EEO) employer and we encourage diversity in our staffing profile. The University of Canterbury actively seeks to meet its obligation under the Treaty of Waitangi | Te Tiriti o Waitangi.

We offer a range of fantastic benefits including flexible work practices, study opportunities and generous superannuation and leave provisions. For more information, please visit us: http://www.canterbury.ac.nz/joinus.

For more information about the University of Canterbury, please visit www.canterbury.ac.nz.

The appointable salary range will depend on the skills and experience of the successful applicant and covered by the academic and associated staff collective employment agreement: Lecturer (2.01 - $89,645) to Senior Lecturer (5.03 - $142,591).

The closing date for this position is: 6 September, 2024

Please note applications will be reviewed after the close date.

How To Apply

Applications for this position must be submitted online through our careers website and should include:


a cover letter;
a full academic CV with contact information of three academic referees;
a list of publications, highlighting up to three most significant contributions;
a research statement highlighting recent research achievements and outlining future research plans (~2 pages); and
a teaching statement outlining any prior teaching experience, your teaching philosophy, and contributions particularly related to Computer Graphics (~1 page).


We do not accept applications by email; however, we are happy to answer your queries in relation to the application process. Please forward these to WorkatUC@canterbury.ac.nz.

For further information specifically about the role, please contact: Associate Prof. Ben Adams, benjamin.adams@canterbury.ac.nz
Show more "
Managed Services - Team Lead,Altis Consulting,New zealand,2024-08-15,https://nz.linkedin.com/jobs/view/managed-services-team-lead-at-altis-consulting-3998727548?position=27&pageNum=0&refId=L%2BA%2FtUmIqgPWyJH4DosoRg%3D%3D&trackingId=1j22axvfgRtCVGFI9Pjoyg%3D%3D&trk=public_jobs_jserp-result_search-card,"Who is Altis Consulting?




An Australian-owned industry leader who continues to “Do more with data than you imagined possible”.




Altis Consulting is a market leader with over 25 years experience providing a deep understanding of the data and analytics landscape. From both a technical and business perspective, we combine commercial expertise, technical agnostic capabilities, and long-standing relationships to support our clients and deliver high-quality solutions.




As we continually foster an environment of lifelong learning, high performance, and ongoing relationships, our values of ""Lead With Heart, Find a Way, Own It, and Be Curious"" drive our team to continually deliver solutions that make us stand out and remain unique in our approach.




About The Team

Our team at Altis is the foundation of our ongoing success!

Comprised of a diverse group of immensely talented individuals, we consistently make a significant impact in the Data and Analytics Industry. We place great emphasis on supporting our team members by providing continuous learning opportunities and fostering their professional development. By nurturing a culture of growth, we empower our team to unlock doors and achieve their full potential, surpassing their own expectations. We believe in enabling our people to reach heights they may have never imagined possible.




About the Role

As a Lead Managed Services Technician, you play a vital role in ensuring the success of managed services operations. By providing technical leadership, overseeing client support, and driving continuous improvement, you contribute to the exceptional delivery of services and client satisfaction. Your expertise, team management skills, and dedication to proactive monitoring and maintenance enable you to address technical challenges effectively and build strong relationships with clients.




Your Background

Experience contributing to the on-going development of the Managed Support function through mentoring by conducting peer reviews, sharing knowledge, experience and expertise with other team members
Experience designing and developing enhancements to client DW/BI solutions using best practice methodologies
Expereince investigating and resolving issues
Experience Maintain records and advise relevant persons of actions taken.
Experience managing multiple clients concurrently
Experience monitoring managed databases
Experience preparing and running support meetings for clients on a regular basis and ensuring appropriate minutes are recorded and actions are clear
Experience processing and co-ordinating appropriately and timely responses to incident reports
Experience providing support services to between 2 and 4 clients
Experience receiving and handling requests for support following agreed procedures.
Experience responding to common requests for support by providing information to enable resolution and promptly escalate unresolved calls as appropriate.
Experience supporting collation and generation of monthly client reporting
Used to working on a Roster that will include some weekend activities (on-call - this is spread across the team)




Experience:

7+ Years of core Tech Ops / Application Managed Services Solution Sales / Pre Sales.
7+ years of experience working in teams to provide IT Support to clients
7+ years hands-on experience in ETL and BI tools such as Microsoft (SSIS, SSRS, SSAS).
7+ years of Report development/support using cloud-based tools such as Power BI and/or Tableau.
7+ years' experience using cloud-based tools such as Azure Data Factory, Databricks, DBT, Matillion or other.




Why Altis?

Our Commitment to you. We will support your needs by giving you the tools to deliver your best work and then recognise achievements. We will set your curiosity free to allow brilliant minds to do their best work and we will invest in new ideas, removing barriers where we can.




Culture

As a team, we celebrate enjoyment and fun in our work environment. We believe that fostering a positive and enjoyable atmosphere enhances collaboration and productivity. We also value knowledge sharing and continuous learning, recognizing that knowledge sharing is essential for personal and professional growth. We do all this whilst having great team events and celebrations along the way.




We embrace diversity, equity, and inclusion. Our people are from a variety of backgrounds, gender identities, learning and thinking styles, different experiences, and capabilities. We unite through understanding and empower through inclusion. We are passionate about our people and our Diversity and Inclusion Council aims to cultivate an environment where our people feel supported.




What we offer

- We offer a hybrid working model

- Competitive Salary Package dependent on skills and experience, along with a bi-annual bonus scheme

-Training and Development to help propel your career both in technical and soft skills

-Generous Paid Parental Leave up to 14 weeks, eligible after 6 months

-Health and Wellness Program, including access to an Employee Assistance Program for our employees and your family

-Reward and Recognition scheme with an awesome referral bonus $$$




Next Steps




Apply Now! We would love to hear from you.




At the core of our values, we place a high priority on respect, fairness, development, and well-being. We strive to create an inclusive and diverse culture where individuals from all backgrounds are welcomed and celebrated. We believe in equal opportunities for all qualified applicants, regardless of their background, experience, identity, ability, or thinking style. If you require assistance or accommodation during the application process for accessibility reasons, we are readily available to accommodate your needs upon request.




Show more "
(Global Oil Gas) Senior Corporate Treasury Risk Analyst,MatchaTalent,New zealand,2024-08-22,https://nz.linkedin.com/jobs/view/global-oil-gas-senior-corporate-treasury-risk-analyst-at-matchatalent-4007547682?position=28&pageNum=0&refId=L%2BA%2FtUmIqgPWyJH4DosoRg%3D%3D&trackingId=5AZ5gynWrfxF1o9gB35dnw%3D%3D&trk=public_jobs_jserp-result_search-card,"This role required candidate to permanently relocate at Dhahran, Saudi Arabia.

About the Company



This company engages in the exploration, production, transportation, and sale of crude oil and natural gas. It operates through the following segments: Upstream, Downstream, and Corporate. The Upstream segment includes crude oil, natural gas and natural gas liquids exploration, field development, and production. The Downstream segment focuses on refining, logistics, power generation, and the marketing of crude oil, petroleum and petrochemical products, and related services to international and domestic customers. The Corporate segment offers supporting services including human resources, finance, and information technology. The company was founded on May 29, 1933 and is headquartered in Dhahran, Saudi Arabia.

Job Summary

We are seeking a Financial Analyst to join the Risk Oversight & Compliance Division of the Financial Risk Management Division at This Company. The Financial Analyst will provide risk analysis and consultancy for risk-based decision making and management advice.

Key Responsibilities:

Collaborate within a Group treasury function to analyze, oversee, advise, and report on Group financial risk activities.
Offer professional expertise on financial risk-reward analysis and provide risk-based decisions and proposals for management advice.
Enhance transparency on Treasury-related risks by developing or improving Group-level dashboards and reports for senior management monitoring and updates.
Establish and refine risk profiles and thresholds for various Group entities and their risk exposures, monitoring related key risk indicators.
Develop applicable procedures for the above responsibilities.



Requirements:

Willingness to relocate to Dhahran, Saudi Arabia.
Hold a Bachelor's degree in Finance, Analytics, or Accounting from a recognized program. An advanced degree like a Masters, CFA, or FRM is preferred.
Possess a minimum of 7 years' experience in Corporate Treasury risk functions, particularly in Credit and Market.
Have experience in developing risk metrics, including VaR, stress testing, and scenario analysis, and familiarity with risk appetite framework.
Proficient in data analytics, risk systems, and tools such as MATLAB, Tableau, MSCI RiskMetrics, or Power BI.
Strong analytical and problem-solving skills.
Collaborative attitude for working across a diverse portfolio of companies as part of a global risk team.
Exhibit intellectual curiosity and accountability.
Excellent written and oral English communication skills.
Show more "
(Global Oil Gas) Senior Corporate Treasury Risk Analyst,MatchaTalent,New zealand,2024-08-22,https://nz.linkedin.com/jobs/view/global-oil-gas-senior-corporate-treasury-risk-analyst-at-matchatalent-4007548720?position=29&pageNum=0&refId=L%2BA%2FtUmIqgPWyJH4DosoRg%3D%3D&trackingId=0NFIsD55IF5oQGLGiigdUA%3D%3D&trk=public_jobs_jserp-result_search-card,"This role required candidate to permanently relocate at Dhahran, Saudi Arabia.

About the Company



This company engages in the exploration, production, transportation, and sale of crude oil and natural gas. It operates through the following segments: Upstream, Downstream, and Corporate. The Upstream segment includes crude oil, natural gas and natural gas liquids exploration, field development, and production. The Downstream segment focuses on refining, logistics, power generation, and the marketing of crude oil, petroleum and petrochemical products, and related services to international and domestic customers. The Corporate segment offers supporting services including human resources, finance, and information technology. The company was founded on May 29, 1933 and is headquartered in Dhahran, Saudi Arabia.

Job Summary

We are seeking a Financial Analyst to join the Risk Oversight & Compliance Division of the Financial Risk Management Division at This Company. The Financial Analyst will provide risk analysis and consultancy for risk-based decision making and management advice.

Key Responsibilities:

Collaborate within a Group treasury function to analyze, oversee, advise, and report on Group financial risk activities.
Offer professional expertise on financial risk-reward analysis and provide risk-based decisions and proposals for management advice.
Enhance transparency on Treasury-related risks by developing or improving Group-level dashboards and reports for senior management monitoring and updates.
Establish and refine risk profiles and thresholds for various Group entities and their risk exposures, monitoring related key risk indicators.
Develop applicable procedures for the above responsibilities.



Requirements:

Willingness to relocate to Dhahran, Saudi Arabia.
Hold a Bachelor's degree in Finance, Analytics, or Accounting from a recognized program. An advanced degree like a Masters, CFA, or FRM is preferred.
Possess a minimum of 7 years' experience in Corporate Treasury risk functions, particularly in Credit and Market.
Have experience in developing risk metrics, including VaR, stress testing, and scenario analysis, and familiarity with risk appetite framework.
Proficient in data analytics, risk systems, and tools such as MATLAB, Tableau, MSCI RiskMetrics, or Power BI.
Strong analytical and problem-solving skills.
Collaborative attitude for working across a diverse portfolio of companies as part of a global risk team.
Exhibit intellectual curiosity and accountability.
Excellent written and oral English communication skills.
Show more "
