title,company,location,date,link,description
Senior Machine Learning Engineer,The Onset,New zealand,2024-08-14,https://nz.linkedin.com/jobs/view/senior-machine-learning-engineer-at-the-onset-4000931551?position=31&pageNum=0&refId=VVKOpBjq8Vwkr2RLBk%2FXoQ%3D%3D&trackingId=yFXRKQE7XS9aN4manFlPIw%3D%3D&trk=public_jobs_jserp-result_search-card,"Job Description

Machine Learning Engineer (Bangkok Based, Relocation Provided)

Are you passionate about transforming travel for millions of customers worldwide?

Imagine doing that while enjoying the vibrant metro of Bangkok, one of the best places in Asia to live and work. Or from a tropical paradise a few hours away!

This opportunity is a hybrid role, offering a flexible working model. You will be part of the client’s efforts to creatively increase business and implement resources such as operational and analytical databases, ML- driven solutions, queue systems, and data monitoring tools.

Who are they?

Headquartered in Bangkok, they are one of the world’s largest online travel platforms. Their team, comprising 4,000 members from 90 different nationalities, is driven by a shared passion for travel and a goal to make it more accessible. This diversity enhances their products and services by providing a better understanding of customers' needs. Collaboration is key, with teams working closely both locally and globally, bringing together varied experiences and ideas.

This company is focused on being data-driven to continually improve their customer and employee experience, even down to what snacks the staff enjoy in the kitchen.

What You’ll Do


Lead the team in improving scalability, stability, accuracy, speed, and efficiency of ML systems.
Build, administer, and scale ML processing pipelines.
Navigate technology stack: Python3, PySpark, Bash/Python scripting, Hadoop, SQL, S3, etc.
Understand the internals of ML models (Random Forest, CNN, Regression models, etc.).
Design, build, test, and deploy new libraries, frameworks, or systems with high testing and code quality standards.



Your Benefits


Work with cutting edge tooling & SMEs within technology across the business
Spend a month working remotely from anywhere globally each year.
Team days on Tuesday and Wednesday where everyone is together.
Receive discounts on accommodation worldwide.
Access to a Parental leave and Employee Assistance Programs for personal and workplace support.
Get health insurance and benefits including gym, yoga and dental.



What You’ll Bring


Education: Bachelor’s degree in computer science, information systems, engineering, or related field.
Experience: 8+ years in software engineering, with 4+ years in ML; strong background in PySpark and Python.
Technical Skills: Proficient in design patterns, object-oriented programming, SQL, and debugging production issues; understanding of data architecture principles and experience with Big Data technologies/tools is preferred.



Become part of a passionate team with people from different nationalities working together on a single goal in leading advancements in machine learning and innovation.

Relocation package available..

Want to know more? Apply here or share your resume to june@theonset.com.au
Show more "
Senior Data Scientist,Woolworths Group,New zealand,2024-08-16,https://nz.linkedin.com/jobs/view/senior-data-scientist-at-woolworths-group-4001530654?position=32&pageNum=0&refId=VVKOpBjq8Vwkr2RLBk%2FXoQ%3D%3D&trackingId=2oywF96vTVrVR7tex%2Frh5g%3D%3D&trk=public_jobs_jserp-result_search-card,"Join our WiqNZ business and work alongside our talented Advanced Analytics team
Competitive Salary + Bonus + Grocery discount + Other group discounts
Agile environment and Hybrid / flexible working


Ready to make an impact? We are!
This is an exceptional opportunity to further continue your experience with one of New Zealand’s largest employers.

As part of our high performing team you’ll be joining a fast-paced, dynamic organisation where we are proud of our customer centricity and our ability to make a real difference for our teams within a complex, large-scale, matrix environment.

About the Role | Mō te Tūranga
Working as part of our WiqNZ business and as a key leader within the A&I team, this role will drive scaleable value from advanced analytics use cases as well as to grow and mature our data science and machine learning ops capability and provide technical leadership to a broad data science community.

Support the establishment and embedding disciplines, practices and patterns that continuously improve data science ways of working / standards. A key part of this role is to balance what we build internally, what we buy, and what we borrow from the Group.

Some Of The Key Responsibilities Include


Provide technical thought leadership in advanced analytics, data science and ML Ops.
Apply advanced analytics thinking across a variety of business domains.
Technical mentoring for less experienced data scientists.
Provide quality assurance and peer review for data science initiatives.
Adhere to data principles and establish standards for model development.
Make good use of analytics productivity tools to enable a wider pool of analytics professionals to be effective.
Support the development of data science capabilities roadmap.
Providing input into the design of model factories, feature libraries and model management capabilities to enable continuous model deployment.
Design, develop, implement and maintain scalable analytical models.
Work with business and process teams to strive for higher quality data and strategic view of data as an asset.
Contribute to analytics problem solving and insight generation.
Bridge the gap between Data Science, analytics and data engineering.


About You | Mōu
As a Senior Data Scientist, your role is to work alongside a team of talented architects, data engineers, data scientists and senior analytics professionals to understand business challenges, design and implement data products and solutions for both operational and analytical purposes.

A key component of the role is optimising the usage of our data architecture as well as building scalable, reliable analytical models that can service both batch and realtime use cases.

As a senior member of the Data Science Chapter, you will also contribute to the development of data science patterns and processes and will bring in demonstrable experience across the following;

Agile delivery leadership including technical mentoring and peer review.
Advanced analytics skills and python programming experience.
Leading data science initiatives and developing, deploying and managing machine learning models at scale.
Working alongside external partners and in cross functional teams and clearly define desired business outcomes and communicate results.
Strong Agile maturity - understanding the principles.
Familiarity with JIRA, Confluence and Project Management tools.
Ability to think creatively and critically and thrive in a fast-paced, dynamic, and sometimes ambiguous work environment.


Working with Woolworths NZ | Me mahi tahi tatou ki Woolworths NZ
Our purpose is to make Kiwis' lives a little better every day.

There is plenty of scope for new ideas, lots of room for you to add value, and importantly, you’ll be working with a business that touches the lives of three million New Zealanders a week. We offer a diverse range of career opportunities across our ecosystem.

WoolworthsNZ
Cartology, Vineonline & WooliesX
Primary Connect
Wholesale Distributors Limited (Super Value & Fresh Choice)
We are proud to be a Work 180 endorsed employer for all women, view the great work we do here.

Come as you are | Nau mai, whakatau mai
We’re an equal opportunity employer and are committed to the principle of equal opportunity for all.

If you’re smart and good at what you do, let’s work together | Me mahi tahi tatou
Show more "
Engineering Manager - MLOps & Analytics,Canonical,New zealand,2024-08-29,https://nz.linkedin.com/jobs/view/engineering-manager-mlops-analytics-at-canonical-4012943093?position=33&pageNum=0&refId=VVKOpBjq8Vwkr2RLBk%2FXoQ%3D%3D&trackingId=duv%2BnaOkUN9WLLT1FI08yg%3D%3D&trk=public_jobs_jserp-result_search-card,"The role of an Engineering Manager at Canonical

As an Engineering Manager at Canonical, you must be technically strong, but your main responsibility is to run an effective team and develop the colleagues you manage. You will develop and review code as a leader, while at the same time staying aware of that the best way to improve the product is to ensure that the whole team is focused, productive and unblocked.

You are expected to help them grow as engineers, do meaningful work, do it outstandingly well, find professional and personal satisfaction, and work well with colleagues and the community. You will also be expected to be a positive influence on culture, facilitate technical delivery, and regularly reflect with your team on strategy and execution.

You will collaborate closely with other Engineering Managers, product managers, and architects, producing an engineering roadmap with ambitious and achievable goals.

We expect Engineering Managers to be fluent in the programming language, architecture, and components that their team uses, in this case popular open-source machine learning tools like Kubeflow, MLFlow, and Feast.

Code reviews and architectural leadership are part of the job. The commitment to healthy engineering practices, documentation, quality and performance optimisation is as important, as is the requirement for fair and clear management, and the obligation to ensure a high-performing team.

Location: This is a Globally remote role.

What your day will look like


Manage a distributed team of engineers and its MLOps/Analytics portfolio
Organize and lead the team's processes in order to help it achieve its objectives
Conduct one-on-one meetings with team members
Identify and measure team health indicators
Interact with a vibrant community
Review code produced by other engineers
Attend conferences to represent Canonical and its MLOps solutions
Mentor and grow your direct reports, helping them achieve their professional goals
Work from home with global travel for 2 to 4 weeks per year for internal and external events


What we are looking for in you


A proven track record of professional experience of software delivery
Professional python development experience, preferably with a track record in open source
A proven understanding of the machine learning space, its challenges and opportunities to improve
Experience designing and implementing MLOps solutions
An exceptional academic track record from both high school and preferably university
Willingness to travel up to 4 times a year for internal events


Additional skills that you might also bring

The following skills may be helpful to you in the role, but we don't expect everyone to bring all of them.


Hands-on experience with machine learning libraries, or tools.
Proven track record of building highly automated machine learning solutions for the cloud.
Experience with building machine learning models
Experience with container technologies (Docker, LXD, Kubernetes, etc.)
Experience with public clouds (AWS, Azure, Google Cloud)
Experience in the Linux and open-source software world
Working knowledge of cloud computing
Passionate about software quality and testing
Experience working on a distributed team on an open source project -- even if that is community open source contributions.
Demonstrated track record of Open Source contributions


What we offer you

We consider geographical location, experience, and performance in shaping compensation worldwide. We revisit compensation annually (and more often for graduates and associates) to ensure we recognise outstanding performance. In addition to base pay, we offer a performance-driven annual bonus. We provide all team members with additional benefits, which reflect our values and ideals. We balance our programs to meet local needs and ensure fairness globally.


Distributed work environment with twice-yearly team sprints in person - we've been working remotely since 2004!
Personal learning and development budget of USD 2,000 per year
Annual compensation review
Recognition rewards
Annual holiday leave
Maternity and paternity leave
Employee Assistance Programme
Opportunity to travel to new locations to meet colleagues from your team and others
Priority Pass for travel and travel upgrades for long haul company events


About Canonical

Canonical is a pioneering tech firm that is at the forefront of the global move to open source. As the company that publishes Ubuntu, one of the most important open source projects and the platform for AI, IoT and the cloud, we are changing the world on a daily basis. We recruit on a global basis and set a very high standard for people joining the company. We expect excellence - in order to succeed, we need to be the best at what we do.

Canonical has been a remote-first company since its inception in 2004. Work at Canonical is a step into the future, and will challenge you to think differently, work smarter, learn new skills, and raise your game. Canonical provides a unique window into the world of 21st-century digital business.

Canonical is an equal opportunity employer

We are proud to foster a workplace free from discrimination. Diversity of experience, perspectives, and background create a better work environment and better products. Whatever your identity, we will give your application fair consideration.


Show more "
"Senior Data Scientist, Loom",Loom,New zealand,2024-08-21,https://nz.linkedin.com/jobs/view/senior-data-scientist-loom-at-loom-4003673272?position=34&pageNum=0&refId=VVKOpBjq8Vwkr2RLBk%2FXoQ%3D%3D&trackingId=oTt6A3%2B9YOVLOv43HaLN1w%3D%3D&trk=public_jobs_jserp-result_search-card,"Overview

Working at Atlassian

Atlassians can choose where they work – whether in an office, from home, or a combination of the two. That way, Atlassians have more control over supporting their family, personal goals, and other priorities. We can hire people in any country where we have a legal entity. Interviews and onboarding are conducted virtually, a part of being a distributed-first company.

Your Future Team

We’re looking to add a Senior Data Scientist to the Loom Product team to help us drive activation, engagement and retention by driving value for both creators and viewers on our platform. The Core Product team at Loom is taking AI-led bets to transform video creation and editing, we’re looking for an data science excelling in using data insights to shape the team’s direction.

We use rich, complex datasets and for wide variety of analytical tasks, ranging from conducting ad-hoc research, creating dashboards, building funnels, designing and evaluating tests, crafting complex database queries and ETL pipelines, and developing sophisticated predictive models. The ideal candidate will be data-driven, intellectually curious, and a clear communicator.

Responsibilities

Your Role


Collaborate on a variety of product and business problems with a diverse set of cross-functional partners and become a trusted strategic partner through the structure and clarity of your work.
Apply technical expertise with quantitative analysis, experimentation, and the presentation of data to develop strategies for our business and help solve the business's biggest challenges.
Focus on developing hypotheses through analytical approaches, different methodologies, frameworks, and technical approaches to test them.
Define, understand, and test opportunities to improve the products and business and influence roadmaps through insights and recommendations.
Partner with cross-functional teams to inform, influence, and execute strategy decisions
Identify and measure the success of product efforts through forecasting and monitoring of key product metrics to understand trends.
You will use data to shape product development, quantify new opportunities, identify upcoming challenges, and ensure the products we build bring value to people, businesses, and Atlassian.



Qualifications

What we’re looking for


5+ years of experience in an analytics role turning data into insights and recommendations
Strong analytical and communication skills with the ability to synthesize insights into compelling stories
Experience with the SaaS customer lifecycle from acquisition to retention
Experience with designing and analyzing experiments
Superior SQL (Snowflake, Postgres) skills - able to write structured and efficient queries on large data sets
Experience with a Business Intelligence tool (e.g. Tableau or Hex)
Experience with a statistical scripting language (e.g. R or Python) is a plus



Compensation

At Atlassian, we strive to design equitable, explainable, and competitive compensation programs. To support this goal, the baseline of our range is higher than that of the typical market range, but in turn we expect to hire most candidates near this baseline. Base pay within the range is ultimately determined by a candidate's skills, expertise, or experience. In the United States, we have three geographic pay zones. For this role, our current base pay ranges for new hires in each zone are:

Zone A: $175,100 - $233,400

Zone B: $157,500 - $210,100

Zone C: $145,300 - $193,700

This role may also be eligible for benefits, bonuses, commissions, and equity.

Please visit go.atlassian.com/payzones for more information on which locations are included in each of our geographic pay zones. However, please confirm the zone for your specific location with your recruiter.

Our Perks & Benefits

Atlassian offers a variety of perks and benefits to support you, your family and to help you engage with your local community. Our offerings include health coverage, paid volunteer days, wellness resources, and so much more. Visit go.atlassian.com/perksandbenefits to learn more.

About Atlassian

At Atlassian, we're motivated by a common goal: to unleash the potential of every team. Our software products help teams all over the planet and our solutions are designed for all types of work. Team collaboration through our tools makes what may be impossible alone, possible together.

We believe that the unique contributions of all Atlassians create our success. To ensure that our products and culture continue to incorporate everyone's perspectives and experience, we never discriminate based on race, religion, national origin, gender identity or expression, sexual orientation, age, or marital, veteran, or disability status. All your information will be kept confidential according to EEO guidelines.

To provide you the best experience, we can support with accommodations or adjustments at any stage of the recruitment process. Simply inform our Recruitment team during your conversation with them.

To learn more about our culture and hiring process, visit go.atlassian.com/crh .
Show more "
Engineering Manager - MLOps & Analytics,Canonical,New zealand,2024-08-29,https://nz.linkedin.com/jobs/view/engineering-manager-mlops-analytics-at-canonical-4012943096?position=36&pageNum=0&refId=VVKOpBjq8Vwkr2RLBk%2FXoQ%3D%3D&trackingId=%2F0cAwWzcE6u5sazfTYaq8A%3D%3D&trk=public_jobs_jserp-result_search-card,"The role of an Engineering Manager at Canonical

As an Engineering Manager at Canonical, you must be technically strong, but your main responsibility is to run an effective team and develop the colleagues you manage. You will develop and review code as a leader, while at the same time staying aware of that the best way to improve the product is to ensure that the whole team is focused, productive and unblocked.

You are expected to help them grow as engineers, do meaningful work, do it outstandingly well, find professional and personal satisfaction, and work well with colleagues and the community. You will also be expected to be a positive influence on culture, facilitate technical delivery, and regularly reflect with your team on strategy and execution.

You will collaborate closely with other Engineering Managers, product managers, and architects, producing an engineering roadmap with ambitious and achievable goals.

We expect Engineering Managers to be fluent in the programming language, architecture, and components that their team uses, in this case popular open-source machine learning tools like Kubeflow, MLFlow, and Feast.

Code reviews and architectural leadership are part of the job. The commitment to healthy engineering practices, documentation, quality and performance optimisation is as important, as is the requirement for fair and clear management, and the obligation to ensure a high-performing team.

Location: This is a Globally remote role.

What your day will look like


Manage a distributed team of engineers and its MLOps/Analytics portfolio
Organize and lead the team's processes in order to help it achieve its objectives
Conduct one-on-one meetings with team members
Identify and measure team health indicators
Interact with a vibrant community
Review code produced by other engineers
Attend conferences to represent Canonical and its MLOps solutions
Mentor and grow your direct reports, helping them achieve their professional goals
Work from home with global travel for 2 to 4 weeks per year for internal and external events


What we are looking for in you


A proven track record of professional experience of software delivery
Professional python development experience, preferably with a track record in open source
A proven understanding of the machine learning space, its challenges and opportunities to improve
Experience designing and implementing MLOps solutions
An exceptional academic track record from both high school and preferably university
Willingness to travel up to 4 times a year for internal events


Additional skills that you might also bring

The following skills may be helpful to you in the role, but we don't expect everyone to bring all of them.


Hands-on experience with machine learning libraries, or tools.
Proven track record of building highly automated machine learning solutions for the cloud.
Experience with building machine learning models
Experience with container technologies (Docker, LXD, Kubernetes, etc.)
Experience with public clouds (AWS, Azure, Google Cloud)
Experience in the Linux and open-source software world
Working knowledge of cloud computing
Passionate about software quality and testing
Experience working on a distributed team on an open source project -- even if that is community open source contributions.
Demonstrated track record of Open Source contributions


What we offer you

We consider geographical location, experience, and performance in shaping compensation worldwide. We revisit compensation annually (and more often for graduates and associates) to ensure we recognise outstanding performance. In addition to base pay, we offer a performance-driven annual bonus. We provide all team members with additional benefits, which reflect our values and ideals. We balance our programs to meet local needs and ensure fairness globally.


Distributed work environment with twice-yearly team sprints in person - we've been working remotely since 2004!
Personal learning and development budget of USD 2,000 per year
Annual compensation review
Recognition rewards
Annual holiday leave
Maternity and paternity leave
Employee Assistance Programme
Opportunity to travel to new locations to meet colleagues from your team and others
Priority Pass for travel and travel upgrades for long haul company events


About Canonical

Canonical is a pioneering tech firm that is at the forefront of the global move to open source. As the company that publishes Ubuntu, one of the most important open source projects and the platform for AI, IoT and the cloud, we are changing the world on a daily basis. We recruit on a global basis and set a very high standard for people joining the company. We expect excellence - in order to succeed, we need to be the best at what we do.

Canonical has been a remote-first company since its inception in 2004. Work at Canonical is a step into the future, and will challenge you to think differently, work smarter, learn new skills, and raise your game. Canonical provides a unique window into the world of 21st-century digital business.

Canonical is an equal opportunity employer

We are proud to foster a workplace free from discrimination. Diversity of experience, perspectives, and background create a better work environment and better products. Whatever your identity, we will give your application fair consideration.


Show more "
