title,company,location,date,link,description
"Senior Data Scientist, Loom",Loom,New zealand,2024-08-21,https://nz.linkedin.com/jobs/view/senior-data-scientist-loom-at-loom-4003673272?position=16&pageNum=0&refId=L%2BA%2FtUmIqgPWyJH4DosoRg%3D%3D&trackingId=LsJBHCZk4rOGH6qjvfdhhg%3D%3D&trk=public_jobs_jserp-result_search-card,"Overview

Working at Atlassian

Atlassians can choose where they work – whether in an office, from home, or a combination of the two. That way, Atlassians have more control over supporting their family, personal goals, and other priorities. We can hire people in any country where we have a legal entity. Interviews and onboarding are conducted virtually, a part of being a distributed-first company.

Your Future Team

We’re looking to add a Senior Data Scientist to the Loom Product team to help us drive activation, engagement and retention by driving value for both creators and viewers on our platform. The Core Product team at Loom is taking AI-led bets to transform video creation and editing, we’re looking for an data science excelling in using data insights to shape the team’s direction.

We use rich, complex datasets and for wide variety of analytical tasks, ranging from conducting ad-hoc research, creating dashboards, building funnels, designing and evaluating tests, crafting complex database queries and ETL pipelines, and developing sophisticated predictive models. The ideal candidate will be data-driven, intellectually curious, and a clear communicator.

Responsibilities

Your Role


Collaborate on a variety of product and business problems with a diverse set of cross-functional partners and become a trusted strategic partner through the structure and clarity of your work.
Apply technical expertise with quantitative analysis, experimentation, and the presentation of data to develop strategies for our business and help solve the business's biggest challenges.
Focus on developing hypotheses through analytical approaches, different methodologies, frameworks, and technical approaches to test them.
Define, understand, and test opportunities to improve the products and business and influence roadmaps through insights and recommendations.
Partner with cross-functional teams to inform, influence, and execute strategy decisions
Identify and measure the success of product efforts through forecasting and monitoring of key product metrics to understand trends.
You will use data to shape product development, quantify new opportunities, identify upcoming challenges, and ensure the products we build bring value to people, businesses, and Atlassian.



Qualifications

What we’re looking for


5+ years of experience in an analytics role turning data into insights and recommendations
Strong analytical and communication skills with the ability to synthesize insights into compelling stories
Experience with the SaaS customer lifecycle from acquisition to retention
Experience with designing and analyzing experiments
Superior SQL (Snowflake, Postgres) skills - able to write structured and efficient queries on large data sets
Experience with a Business Intelligence tool (e.g. Tableau or Hex)
Experience with a statistical scripting language (e.g. R or Python) is a plus



Compensation

At Atlassian, we strive to design equitable, explainable, and competitive compensation programs. To support this goal, the baseline of our range is higher than that of the typical market range, but in turn we expect to hire most candidates near this baseline. Base pay within the range is ultimately determined by a candidate's skills, expertise, or experience. In the United States, we have three geographic pay zones. For this role, our current base pay ranges for new hires in each zone are:

Zone A: $175,100 - $233,400

Zone B: $157,500 - $210,100

Zone C: $145,300 - $193,700

This role may also be eligible for benefits, bonuses, commissions, and equity.

Please visit go.atlassian.com/payzones for more information on which locations are included in each of our geographic pay zones. However, please confirm the zone for your specific location with your recruiter.

Our Perks & Benefits

Atlassian offers a variety of perks and benefits to support you, your family and to help you engage with your local community. Our offerings include health coverage, paid volunteer days, wellness resources, and so much more. Visit go.atlassian.com/perksandbenefits to learn more.

About Atlassian

At Atlassian, we're motivated by a common goal: to unleash the potential of every team. Our software products help teams all over the planet and our solutions are designed for all types of work. Team collaboration through our tools makes what may be impossible alone, possible together.

We believe that the unique contributions of all Atlassians create our success. To ensure that our products and culture continue to incorporate everyone's perspectives and experience, we never discriminate based on race, religion, national origin, gender identity or expression, sexual orientation, age, or marital, veteran, or disability status. All your information will be kept confidential according to EEO guidelines.

To provide you the best experience, we can support with accommodations or adjustments at any stage of the recruitment process. Simply inform our Recruitment team during your conversation with them.

To learn more about our culture and hiring process, visit go.atlassian.com/crh .
Show more "
Senior Data Scientist,Woolworths Group,New zealand,2024-08-16,https://nz.linkedin.com/jobs/view/senior-data-scientist-at-woolworths-group-4001530654?position=18&pageNum=0&refId=L%2BA%2FtUmIqgPWyJH4DosoRg%3D%3D&trackingId=uQbhTKGiYHr0T%2BGNXuN%2BJA%3D%3D&trk=public_jobs_jserp-result_search-card,"Join our WiqNZ business and work alongside our talented Advanced Analytics team
Competitive Salary + Bonus + Grocery discount + Other group discounts
Agile environment and Hybrid / flexible working


Ready to make an impact? We are!
This is an exceptional opportunity to further continue your experience with one of New Zealand’s largest employers.

As part of our high performing team you’ll be joining a fast-paced, dynamic organisation where we are proud of our customer centricity and our ability to make a real difference for our teams within a complex, large-scale, matrix environment.

About the Role | Mō te Tūranga
Working as part of our WiqNZ business and as a key leader within the A&I team, this role will drive scaleable value from advanced analytics use cases as well as to grow and mature our data science and machine learning ops capability and provide technical leadership to a broad data science community.

Support the establishment and embedding disciplines, practices and patterns that continuously improve data science ways of working / standards. A key part of this role is to balance what we build internally, what we buy, and what we borrow from the Group.

Some Of The Key Responsibilities Include


Provide technical thought leadership in advanced analytics, data science and ML Ops.
Apply advanced analytics thinking across a variety of business domains.
Technical mentoring for less experienced data scientists.
Provide quality assurance and peer review for data science initiatives.
Adhere to data principles and establish standards for model development.
Make good use of analytics productivity tools to enable a wider pool of analytics professionals to be effective.
Support the development of data science capabilities roadmap.
Providing input into the design of model factories, feature libraries and model management capabilities to enable continuous model deployment.
Design, develop, implement and maintain scalable analytical models.
Work with business and process teams to strive for higher quality data and strategic view of data as an asset.
Contribute to analytics problem solving and insight generation.
Bridge the gap between Data Science, analytics and data engineering.


About You | Mōu
As a Senior Data Scientist, your role is to work alongside a team of talented architects, data engineers, data scientists and senior analytics professionals to understand business challenges, design and implement data products and solutions for both operational and analytical purposes.

A key component of the role is optimising the usage of our data architecture as well as building scalable, reliable analytical models that can service both batch and realtime use cases.

As a senior member of the Data Science Chapter, you will also contribute to the development of data science patterns and processes and will bring in demonstrable experience across the following;

Agile delivery leadership including technical mentoring and peer review.
Advanced analytics skills and python programming experience.
Leading data science initiatives and developing, deploying and managing machine learning models at scale.
Working alongside external partners and in cross functional teams and clearly define desired business outcomes and communicate results.
Strong Agile maturity - understanding the principles.
Familiarity with JIRA, Confluence and Project Management tools.
Ability to think creatively and critically and thrive in a fast-paced, dynamic, and sometimes ambiguous work environment.


Working with Woolworths NZ | Me mahi tahi tatou ki Woolworths NZ
Our purpose is to make Kiwis' lives a little better every day.

There is plenty of scope for new ideas, lots of room for you to add value, and importantly, you’ll be working with a business that touches the lives of three million New Zealanders a week. We offer a diverse range of career opportunities across our ecosystem.

WoolworthsNZ
Cartology, Vineonline & WooliesX
Primary Connect
Wholesale Distributors Limited (Super Value & Fresh Choice)
We are proud to be a Work 180 endorsed employer for all women, view the great work we do here.

Come as you are | Nau mai, whakatau mai
We’re an equal opportunity employer and are committed to the principle of equal opportunity for all.

If you’re smart and good at what you do, let’s work together | Me mahi tahi tatou
Show more "
R&D Senior Control Engineer,Oil and Gas Job Search Ltd,New zealand,2024-08-15,https://nz.linkedin.com/jobs/view/r-d-senior-control-engineer-at-oil-and-gas-job-search-ltd-3999319872?position=19&pageNum=0&refId=L%2BA%2FtUmIqgPWyJH4DosoRg%3D%3D&trackingId=kpE3QPjQHBL2UIyOogeWVA%3D%3D&trk=public_jobs_jserp-result_search-card,"At ABB, we are dedicated to addressing global challenges. Our core values: care, courage, curiosity, and collaboration - combined with a focus on diversity, inclusion, and equal opportunities - are key drivers in our aim to empower everyone to create sustainable solutions. Write the next chapter of your ABB story.

This position reports to

R & D Manager

Your Role And Responsibilities

In this role, you will be responsible for designing the main control models running in our power electronics products. Our products range from Power Protection (UPS) to Battery Energy storage to Static frequency converters, power ranges from 300kW to 3600kW. In your role, you'll have the opportunity to contribute significantly to successful project results in technology, software, product, and/or solution development, as well as associated Intellectual Property (IP). Each day, you will act as the first point of contact in Research and Development for specific product-related issues and maintenance. You will also showcase your expertise by identifying, proposing, and implementing innovative solutions. The work model for the role is: Onsite This role is contributing to the Power Protection Product Group in Napier, New Zealand. You will be mainly accountable for:


Maintaining recognized expertise in model-based design using MATLAB Simulink by integrating the latest developments in technologies, tools, and methodologies into your work.
Finding new ways of solving problems by distilling product requirements into engineering requirements and designing, documenting, and implementing controller models to run on 3-phase power electronics.
Documenting work results allowing others to maintain and improve them, including testing and debugging controller models on target hardware.
Understanding and initiating IP generation in your area of specialization, particularly in power systems, grid connection issues, and grid standards, and participating in the project IP strategy development.
Innovating in features and processes to keep us ahead of our competitors.
Supporting the software team in implementing user interfaces and commissioning products on-site. Our team dynamics: You will join a dynamic, high performing team, where you will be able to thrive.



Qualifications For The Role


You enjoy working with Automation of testing, with PLCs or NI LabView.
You have 5 years of experience.
Possess an enhanced knowledge of 3 phase systems, UPS, Energy Storage Systems, Variable Speed Drives.
Degree in Electrical/Electronic Engineering
You are at ease communicating in English



Benefits


Retirement plan
Life insurance
Disability insurance
Accident insurance
Flexible work practices



More About Us

ABB Smart Power is a global technology leader, with products and solutions that make power supplies smart, connected and protected. Its intelligent products and solutions make power more competitive by improving the energy efficiency, productivity, and reliability of almost any operation. We value people from different backgrounds. Apply today for your next career step within ABB and visit www.abb.com to learn about the impact of our solutions across the globe. #MyABBStory


Show more "
GNC Engineer II - Electron,Rocket Lab,New zealand,2024-08-15,https://nz.linkedin.com/jobs/view/gnc-engineer-ii-electron-at-rocket-lab-3982456873?position=20&pageNum=0&refId=L%2BA%2FtUmIqgPWyJH4DosoRg%3D%3D&trackingId=%2FXEUwQQZTIOI0D2SCVwQ9w%3D%3D&trk=public_jobs_jserp-result_search-card,"About Rocket Lab

Rocket Lab is a global leader in launch and space systems. The rockets and satellites we build and launch enable some of the most ambitious and vital space missions globally, supporting scientific exploration, Earth observation and missions to combat climate change, national security, and exciting new technology demonstrations. Our Electron rocket has provided reliable access to orbit since 2018, becoming one of the most frequently launched rockets in the world. Neutron will be our next rocket on the launch pad, an advanced 13-tonne payload class, reusable rocket to launch the mega constellations of the future. Our space systems business includes our extensive line of satellites and components that have enabled more than 1,700 missions including the James Webb Space Telescope, NASA Psyche Mission, Artemis I, Mars Ingenuity helicopter, and more.

Join our pioneering team and launch your career to new heights!

While other companies talk about it, we do it!

About Engineering At Rocket Lab

Engineering is at the heart of Rocket Lab . Our engineering team has a proven track record of designing and developing world-class rockets and spacecraft that are changing the way we access and use space . You’ll work alongside driven , talented engineers from varied backgrounds and experience levels , all committed to the same mission . Our engineering team members span design , analysis , prototyping , testing , manufacturing , assembly and integration , quality control , engineering documentation , and more.

What You'll Get To Do

The GNC Engineer is responsible for the design and implementation, and testing of GNC Systems involved in flight and ground operations for Electron and its production.

You'll Bring These Qualifications


Bachelor, Masters or Ph.D. in Electrical, Mechanical, Software, Mechatronics or Aerospace Engineering or equivalent qualification
3+ years’ launch vehicle or spacecraft dynamics and modelling experience
3+ years’ experience developing in C/C++
3+ years’ experience developing in Python or MATLAB
A thorough theoretical and/or practical understanding of rigid and/or flexible body dynamics, particularly 6DOF rocket dynamics
Understanding of orbital mechanics and/or closed-loop control systems
The ability to work under pressure and to tight deadlines
Excellent communication skills with the ability to build strong working relationships



These Qualifications Would Be Nice To Have


Experience with Git version control
Experience working in a continuous integration environment
Experience with Simulink
Experience in developing models from fundamental principles and validating through test
Experience with high reliability systems and processes
Experience with flight simulator or flight software development for UAVs, rockets, or spacecraft



ROCKET LAB EMPLOYEE BENEFITS: 


The opportunity to work on innovative and ground - breaking technology
Relocation support and visa sponsorship
An employee stock purchase program
Access to world leading experts to develop your career
Unlimited barista coffee, fruit, and snacks
Rocket Lab merchandise - T-shirts, mission patches etc.
Discounted health insurance with Southern Cross
Additional parental leave entitlements
A vibrant team culture with social activities throughout the year



If the above sounds like you apply now!

What To Expect

We’re on a mission to unlock the potential of space to improve life on Earth, but that’s not an easy task. It takes hard work, determination, relentless innovation, teamwork, grit, and an unwavering commitment to achieving what others often deem impossible. Our people out-think, out-work and out-pace. We pride ourselves on having each other’s backs, checking our egos at the door, and rolling up our sleeves on all tasks big and small. We thrive under pressure, work to tight deadlines, and our focus is always on how we can deliver, rather than dwelling on the challenges that stand in the way.

Important Information

FOR CANDIDATES SEEKING TO WORK IN US OFFICES ONLY:

To conform to U.S. Government space technology export regulations, including the International Traffic in Arms Regulations (ITAR), Rocket Lab Employees must be a U.S. citizen, lawful U.S. permanent resident (i.e., current Green Card holder), or lawfully admitted into the U.S. as a refugee or granted asylum, or be eligible to obtain the required authorizations from the U.S. Department of State and/or the U.S. Department of Commerce, as applicable. Learn more about ITAR

Rocket Lab provides equal employment opportunities to all employees and applicants for employment and prohibits discrimination and harassment of any type without regard to race, color, religion, age, sex, national origin, disability status, genetics, protected veteran status, sexual orientation, gender identity or expression, or any other characteristic protected by federal, state or local laws. This policy applies to all terms and conditions of employment at Rocket Lab, including recruiting, hiring, placement, promotion, termination, layoff, recall, transfer, leaves of absence, compensation and training.

Applicants requiring a reasonable accommodation for the application/interview process for a job in the United States should contact Giulia Biow at

FOR CANDIDATES SEEKING TO WORK IN NEW ZEALAND OFFICES ONLY:

For security reasons background checks will be undertaken prior to any employment offers being made to an applicant. These checks will include nationality checks as it is a requirement of this position that you be eligible to access equipment and data regulated by the United States' International Traffic in Arms Regulations.

Under these Regulations, you may be ineligible for this role if you do not hold citizenship of Australia, Japan, New Zealand, Switzerland, the European Union or a country that is part of NATO, or if you hold ineligible dual citizenship or nationality. For more information on these Regulations, click here
Show more "
