title,company,location,date,link,description
"Artificial Intelligence Engineer, 2 Hour Learning (Remote) - $100,000/year USD",Crossover,New zealand,2024-08-30,https://nz.linkedin.com/jobs/view/artificial-intelligence-engineer-2-hour-learning-remote-%24100-000-year-usd-at-crossover-4011700564?position=16&pageNum=0&refId=VVKOpBjq8Vwkr2RLBk%2FXoQ%3D%3D&trackingId=yjAJNGXT4GXsKwKw1Jn5Og%3D%3D&trk=public_jobs_jserp-result_search-card,"Crossover is the world's #1 source of full-time remote jobs. Our clients offer top-tier pay for top-tier talent. We're recruiting this role for our client, 2 Hour Learning. Have you got what it takes?

Are you a skilled full-stack developer with a passion for AI and a drive to transform K-12 education? At 2 Hour Learning, we're leading a revolution in digital learning backed by data and innovation.

At 2 Hour Learning, we don't just aim to improve education—we're redefining it. Our cutting-edge learning ecosystem, powered by advanced AI, learning science, and psychometrics, is twice as effective as traditional schooling. Students at every level, from kindergarten to high school, are achieving remarkable academic milestones, far surpassing standard expectations.

Your Role in the Revolution:

In this role, you’ll be at the forefront of our AI-powered educational transformation. With full autonomy and creative freedom, you’ll envision, develop, and deploy sophisticated full-stack applications and interactive AI tools that not only engage students but also enhance learning efficiency in unprecedented ways.

This is not a position for those who prefer to specialize in a single aspect of development. We're looking for innovative thinkers who can seamlessly integrate AI across both front-end and back-end systems, taking ownership of the entire product. Your work will directly impact thousands of students, ensuring that our tools meet their needs and set new standards for educational technology.

Who We're Looking For:

We need bold innovators who thrive on leveraging the latest in generative AI to create real-world educational impact. If you’re excited about pushing the boundaries of what’s possible in AI-driven education and are ready to bring your expertise in full-stack development and AI, this is your chance to make a difference.

For more information on 2 Hour Learning, visit our website [https://2hourlearning.com/] and the Future of Education Instagram page [https://www.instagram.com/futureof_education/]. To see a school built around 2 Hour Learning, check out Alpha [https://alpha.school/].

What You Will Be Doing


Develop AI-Powered Web Applications: Architect and code sophisticated web applications that integrate both front-end and back-end components, with a focus on enhancing user experience through AI.
Experiment and Innovate with AI: Work with cutting-edge AI technologies, specifically large language models (LLMs) like GPT-4 or Claude, to create autonomous tools and interactive features that redefine how students learn.
Drive Technical Projects: Take ownership of the entire development process, from gathering requirements to launching and iterating on products. You’ll work closely with stakeholders to ensure that our solutions meet learner needs and push the boundaries of what’s possible.
Collaborate and Communicate: Partner with a global team of developers, designers, and educational experts. Your ability to communicate complex ideas simply and effectively will be key to your success.
Continuous Improvement: Stay ahead of the curve by continually learning and applying the latest advancements in AI and web development to our platform.


What You Won’t Be Doing


Narrow AI Development: You won’t be working on isolated AI features that don’t integrate with the overall product strategy. Your work will have a direct impact on thousands of students.
Surface-Level Coding: This is not a role for those who focus only on either front-end or back-end development. You will be expected to integrate both, creating comprehensive and scalable solutions.
Routine Maintenance: This role is not about maintaining legacy systems or making minor updates. You will be driving innovation and building new, cutting-edge applications.
Waiting for Detailed Specifications: You won't be handed fully fleshed-out requirements. Instead, you will take high-level ideas and translate them into fully developed products, leveraging your expertise in AI and full-stack development.
Working in Isolation: You won't be coding in a vacuum. Collaboration with other developers, product managers, and educational experts is key to ensuring that the solutions you build are impactful and user-centered.


Artificial Intelligence Engineer Key Responsibilities

Develop and deliver engaging, human-centered AI applications that demonstrably accelerate learning outcomes and efficiency for thousands of K-12 students.

Basic Requirements


At least 3 years of experience in full-stack development, with proficiency in front-end frameworks such as React, Angular, Vue.js, or Svelte, and back-end technologies like Node.js, Django, Ruby on Rails, Flask, or Spring Boot.
Hands-on experience integrating large language models (LLMs) like GPT-4, Claude, or similar into web applications.
Proven ability to independently manage and execute technical projects from start to finish, including gathering requirements, development, deployment, and iteration.
Excellent verbal and written communication skills, with the ability to collaborate effectively with stakeholders, team members, and users across a global, remote team.
A demonstrated passion for staying at the forefront of technology, particularly in AI and web development, with a commitment to continuous learning and applying new advancements to your work.


About 2 Hour Learning

2hr Learning is powered by AI technology that enables schools to provide personalized, mastery learning to students, enabling them to learn faster than standard school, thereby freeing up the rest of the school day to pursue their passions and interests.

There is so much to cover for this exciting role, and space here is limited. Hit the Apply button if you found this interesting and want to learn more. We look forward to meeting you!

Working with Crossover

This is a full-time (40 hours per week), long-term position. The position is immediately available and requires entering into an independent contractor agreement with Crossover. The compensation level for this role is $50 USD/hour, which equates to $100,000 USD/year assuming 40 hours per week and 50 weeks per year. The payment period is weekly. Consult www.crossover.com/help-and-faqs for more details on this topic.

What to expect next:


You will receive an email with a link to start your self-paced, online job application.
Our hiring platform will guide you through a series of online “screening” assessments to check for basic job fit, job-related skills, and finally a few real-world job-specific assignments.


Important! If you do not receive an email from us:


First, emails may take up to 15 minutes to send, refresh and check again.
Second, check your spam and junk folders for an email from Crossover.com, mark as “Not Spam” since you will receive other emails as well.
Third, we will send to whatever email account you indicated on the Apply form - by default, that is the email address you use as your LinkedIn username and it might be different than the one you have already checked.
If all else fails, just reset your password by visiting https://www.crossover.com/auth/password-recovery if you already applied using LinkedIn EasyApply.


Crossover Job Code: LJ-5361-NZ-Auckland-ArtificialInte.002


Show more "
Expression of Interest - Analytics Engineering Lead,Marlee (Fingerprint For Success),New zealand,2024-08-27,https://nz.linkedin.com/jobs/view/expression-of-interest-analytics-engineering-lead-at-marlee-fingerprint-for-success-4011307309?position=17&pageNum=0&refId=VVKOpBjq8Vwkr2RLBk%2FXoQ%3D%3D&trackingId=jRDDO%2BFqJGcfB9qgf8pfNg%3D%3D&trk=public_jobs_jserp-result_search-card,"We are inviting professionals in high-growth industries who are thinking about their next move or looking for a new opportunity to join our expanding talent pool.


The Marlee Talent Pool is a pilot project designed to:

Help job seekers get discovered by our partners based on their anticipated hiring needs.
Provide optional support and resources for job seekers in their career endeavours.
Help individuals understand, and bring out the best in themselves and each other.

The Marlee Talent Pool process:

Once you express your interest, you will be asked to complete the Marlee work style assessment which measures 48 key attitudes and motivations in the context of work. On completion, you will be automatically added to our growing talent pool and contacted as new opportunities arise.

About Marlee (Fingerprint For Success)

Backed by 20+ years of research, Marlee’s revolutionary predictive analytics have achieved over 90% reliability in forecasting personal and team motivations, behaviours, and performance.

Ultimately, we help people find purpose and fulfillment at work, and help build and scale high-performing teams.


Keep in mind that joining our talent pool does not guarantee a job offer. We aim to balance your technical skills with the results of your Marlee work style assessment to match the hiring needs of our partners.

Your feedback is a gift! Write to us via: hello@getmarlee.com to help co-create the future of recruitment, together.

Show more "
Sr Python Developer - LLM,YO HR Consultancy,New zealand,2024-08-29,https://nz.linkedin.com/jobs/view/sr-python-developer-llm-at-yo-hr-consultancy-4011089867?position=18&pageNum=0&refId=VVKOpBjq8Vwkr2RLBk%2FXoQ%3D%3D&trackingId=Wm%2FDcvXm%2BSNGWuqG8jLXag%3D%3D&trk=public_jobs_jserp-result_search-card,"LLM Python Developer

Experience: 2 - 6 Years

Contract Duration: 6 Months

Opportunity- Full Time, 8 hours, Overlap Required: 5 hours Pst

Total Years Of exp- 2+ years

Mandatory Skills- Python min 2+ years. Technical Writing - min 2 yrs.

Job Description

We are actively seeking talented Senior Python Developers to join our ambitious team dedicated to pushing the frontiers of AI technology. This opportunity is tailored for professionals who thrive on developing innovative solutions and who aspire to be at the forefront of AI advancements. You will work with different companies in the US who are looking to develop both commercial and research AI solutions.

Required Skills


Write effective Python code to tackle complex issues
Use business sense and analytical abilities to glean valuable insights from public databases
Clearly express the reasoning and logic when writing code in Jupyter notebooks or other suitable mediums
Extensive experience working with Python
Proficiency with the language's syntax and conventions
Previous experience tackling algorithmic problems
Nice to have some prior Software Quality Assurance and Test Planning experience
Excellent spoken and written English communication skills


Required Skills For TWA

The ideal candidates should be able to


Clearly explain their strategies for problem-solving.
Design practical solutions in code.
Develop test cases to validate their solutions.
Debug and refine their solutions for improvement.


Skills: code,algorithmic problem solving,machine learning,spoken communication,writing,refining solutions,django,artificial intelligence,python,spoken english communication,flask,english communication,communication skills,english,developers,written english communication,conventions,business sense,software quality assurance,design,test cases,databases,debugging,refining,jupyter notebooks,algorithmic problems,syntax conventions,test case development,analytical abilities,problem-solving,test planning,written communication,technical writing,business analysis
Show more "
AI/ML and MLOps Field Engineer,Canonical,New zealand,2024-08-30,https://nz.linkedin.com/jobs/view/ai-ml-and-mlops-field-engineer-at-canonical-4013778227?position=19&pageNum=0&refId=VVKOpBjq8Vwkr2RLBk%2FXoQ%3D%3D&trackingId=n6Xzu9dFcpVsfhVMM3VpYw%3D%3D&trk=public_jobs_jserp-result_search-card,"Canonical is a leading provider of open source software and operating systems to the global enterprise and technology markets. Our platform, Ubuntu, is very widely used in breakthrough enterprise initiatives such as public cloud, data science, AI, engineering innovation and IoT. Our customers include the world's leading public cloud and silicon providers, and industry leaders in many sectors. The company is a pioneer of global distributed collaboration, with 1000+ colleagues in 70+ countries and very few roles based in offices. Teams meet two to four times yearly in person, in interesting locations around the world, to align on strategy and execution.

The company is founder led, profitable and growing.

We are hiring an AI/ML and MLOps Field Engineer to help global companies embrace AI in their business, using the latest open source capabilities on public and private cloud infrastructure, Linux and Kubernetes. Our team applies expert insights to real-world customer problems, enabling the enterprise adoption of Ubuntu, Kubeflow, MLFlow, Feast, DVC and related analytics, machine learning and data technologies. We are working to create the world's best open source data platform, covering traditional SQL databases and today's NoSQL data stores, as well as the machinery which turns data into insights and executable models.

The people who love this role are software engineers who enjoy customer conversations and solving customer problems during the presales cycle. They are are developers who like to solve customer problems through architecture, presentations and training. Ubuntu is used by pretty much every enterprise in the world, in every industry. This is a fantastic opportunity to learn about the open source technology landscape and develop your business technology insights. You will see first hand in various industries how Linux - and Ubuntu in particular - is shaping innovation and changing the world for the better.

This role is particularly suited to candidates with a technical background who are business minded and driven by commercial success. This role is on our global Field Engineering team and will work closely with enterprise sales leads. We are specifically looking for people interested in solving the most difficult problems in modern data architectures. Training LLMs on multiple K8s clusters deployed on a hybrid cloud infrastructure with GPU sharing across multiple teams? Processing 10M events in real time for financial transactions? Object detection on 10k parallel 4K video streams? These are the problems we solve day to day.

Location: Most of our colleagues work from home. We are growing teams in EMEA, Americas and APAC time zones, so can accommodate candidates from almost any country.

What your day will look like

The global Field Engineering team members are Linux and cloud solutions architects for our customers, designing private and public cloud solutions fitting their workload needs. They are the cloud consultants who work hands-on with the technologies by deploying, testing and handing over the solution to our support or managed services team at the end of a project. They are also software engineers who use Python to develop Kubernetes operators and Linux open source infrastructure-as-code.


Work across the entire Linux stack, from kernel, networking, storage, to applications
Architect cloud infrastructure solutions like Kubernetes, Kubeflow, OpenStack, and Spark
Deliver solutions either on-premise or in public cloud (AWS, Azure, Google Cloud)
Collect customer business requirements and advise them on Ubuntu and relevant open source applications
Grow a healthy, collaborative engineering culture in line with the company values
Deliver presentations and demonstrations of Ubuntu Pro and AI/ML capabilities to prospective and current clients
Liaise with product teams to give them feedback on requirements to influence roadmap
Work collaboratively with your sales team to reach our common targets
Global travel up to 25% of time for internal and external events and 25% to customer meetings


What we are looking for in you


Exceptional academic track record from both high school and university
Undergraduate degree in a technical subject or a compelling narrative about your alternative chosen path
Experience in data engineering, MLOps, or big data solutions deployment
Experience with a relevant programming language, like Python, R, or Rust.
Confidence to respectfully speak up, exchange feedback, and share ideas without hesitation
Track record of going above-and-beyond expectations to achieve outstanding results
Demonstrated personal interest in continuous learning and development
Practical knowledge of Linux, virtualisation, containers and networking
Business-minded technology thinker and problem solver
Knowledge of cloud computing concepts & leaders, such as Kubernetes, AWS, Azure, GCP
Interest in large-scale enterprise open source - private clouds, machine learning and AI, data and analytics
Intermediate level Python programming skills
Passion for technology evidenced by personal projects and initiatives
The work ethic and confidence to shine alongside motivated colleagues
Professional written and spoken English with excellent presentation skills
Experience with Linux (Debian or Ubuntu preferred)
Excellent interpersonal skills, curiosity, flexibility, and accountability
A dynamic person who loves to jump in new projects and interact with people
Appreciative of diversity, polite and effective in a multi-cultural, multi-national organisation
Thoughtfulness and self-motivation
Result-oriented, with a personal drive to follow up and meet commitments
Ability to travel internationally, for company events up to two weeks long, and customer or industry meetings


What you'll learn


Architect and deploy AI/ML infrastructures, data processing pipelines and multi-cluster distributed training
Wide range of open source applications and skills
Work directly with customers in a range of different businesses
Real-life and hands-on exposure to a wide range of emerging technologies and tools


What we offer colleagues

We consider geographical location, experience, and performance in shaping compensation worldwide. We revisit compensation annually (and more often for graduates and associates) to ensure we recognise outstanding performance. In addition to base pay, we offer a performance-driven annual bonus or commission. We provide all team members with additional benefits, which reflect our values and ideals. We balance our programs to meet local needs and ensure fairness globally.


Distributed work environment with twice-yearly team sprints in person
Personal learning and development budget of USD 2,000 per year
Annual compensation review
Recognition rewards
Annual holiday leave
Maternity and paternity leave
Employee Assistance Programme
Opportunity to travel to new locations to meet colleagues
Priority Pass, and travel upgrades for long haul company events


About Canonical

Canonical is a pioneering tech firm at the forefront of the global move to open source. As the company that publishes Ubuntu, one of the most important open source projects and the platform for AI, IoT and the cloud, we are changing the world of software. We recruit on a global basis and set a very high standard for people joining the company. We expect excellence - in order to succeed, we need to be the best at what we do. Most colleagues at Canonical have worked from home since its inception in 2004. Working here is a step into the future, and will challenge you to think differently, work smarter, learn new skills, and raise your game.

Canonical is an equal opportunity employer

We are proud to foster a workplace free from discrimination. Diversity of experience, perspectives, and background create a better work environment and better products. Whatever your identity, we will give your application fair consideration.


Show more "
